{"input": {"timestamp": "2024-03-13 08:00", "ticker": "AAPL", "primary_timeframe": "1d", "vpa_metrics": {"volume_class": "AVERAGE", "candle_class": "WIDE", "signal_type": null, "signal_strength": null}, "trend_analysis": {"trend_direction": "SIDEWAYS", "price_change_percent": 1.19, "volume_trend": "DECREASING", "signal_type": "CONSOLIDATION", "signal_strength": "NEUTRAL"}, "pattern_analysis": {"accumulation": {"detected": false, "strength": 1, "details": "Sideways: False, High volume count: 0, Support tests: 16"}, "distribution": {"detected": false, "strength": 1, "details": "Sideways: False, High volume count: 0, Resistance tests: 13"}, "testing": {"detected": false, "strength": 1, "details": "Testing low: True, Testing high: True, Low volume: False"}, "buying_climax": {"detected": false, "strength": 1, "details": "Near high: False, Very high volume: False, Wide up candle: False, Upper wick: True"}, "selling_climax": {"detected": false, "strength": 2, "details": "Near low: True, Very high volume: False, Wide down candle: True, Lower wick: False"}}, "support_resistance": {"support_levels": [180.17, 168.49], "resistance_levels": [187.05, 196.38, 174.38, 191.05, 185.04]}, "multi_timeframe_context": {"1h": {"trend_direction": "SIDEWAYS", "signal_strength": "NEUTRAL"}}, "risk_reward": {"risk_reward_ratio": 0, "stop_loss": 171.13, "take_profit": 171.13}, "volatility": 1.9176341777719013, "confidence_score": 50.0}, "output": {"signal": {"type": null, "strength": null}, "explanation": "VPA Analysis for AAPL on 2024-03-13 08:00 (1d):\n\n**Signal:** NEUTRAL (None)\n\n**Trend Context:** The primary trend is currently SIDEWAYS (Price change: 1.19%, Volume trend: DECREASING). Recent price action shows a CONSOLIDATION (NEUTRAL). \n\n**Current Candle Analysis:**\n- Candle Type: WIDE\n- Volume: AVERAGE\n- Signal: None (None)\n\n**Detected Patterns:** None\n\n**Support/Resistance:**\n- Support Levels: 180.17, 168.49\n- Resistance Levels: 187.05, 196.38, 174.38, 191.05, 185.04\n\n**Risk-Reward Analysis:**\n- Risk-Reward Ratio: 0.00\n- Suggested Stop Loss: 171.13\n- Suggested Take Profit: 171.13\n\n**Multi-Timeframe Context:**\n- 1h: SIDEWAYS trend, NEUTRAL signal\n\n**Confidence Score:** 50.0/100\n\n**Conclusion:** Based on the SIDEWAYS trend, the AVERAGE volume on the WIDE candle, a None NEUTRAL signal is generated with a confidence score of 50.0/100.", "confidence_score": 50.0}}
{"input": {"timestamp": "2024-03-14 08:00", "ticker": "AAPL", "primary_timeframe": "1d", "vpa_metrics": {"volume_class": "AVERAGE", "candle_class": "NARROW_UPPER_WICK_LOWER_WICK", "signal_type": null, "signal_strength": null}, "trend_analysis": {"trend_direction": "SLIGHT_UP", "price_change_percent": 2.37, "volume_trend": "FLAT", "signal_type": null, "signal_strength": null}, "pattern_analysis": {"accumulation": {"detected": false, "strength": 1, "details": "Sideways: False, High volume count: 0, Support tests: 16"}, "distribution": {"detected": false, "strength": 1, "details": "Sideways: False, High volume count: 0, Resistance tests: 13"}, "testing": {"detected": false, "strength": 1, "details": "Testing low: True, Testing high: True, Low volume: False"}, "buying_climax": {"detected": false, "strength": 1, "details": "Near high: False, Very high volume: False, Wide up candle: False, Upper wick: True"}, "selling_climax": {"detected": false, "strength": 2, "details": "Near low: True, Very high volume: False, Wide down candle: False, Lower wick: True"}}, "support_resistance": {"support_levels": [180.17, 168.49], "resistance_levels": [187.05, 174.38, 196.38, 191.05, 185.04]}, "multi_timeframe_context": {"1h": {"trend_direction": "SIDEWAYS", "signal_strength": null}}, "risk_reward": {"risk_reward_ratio": 0, "stop_loss": 173.0, "take_profit": 173.0}, "volatility": 1.898055978095528, "confidence_score": 43.75}, "output": {"signal": {"type": null, "strength": null}, "explanation": "VPA Analysis for AAPL on 2024-03-14 08:00 (1d):\n\n**Signal:** NEUTRAL (None)\n\n**Trend Context:** The primary trend is currently SLIGHT_UP (Price change: 2.37%, Volume trend: FLAT). Recent price action shows a None (None). \n\n**Current Candle Analysis:**\n- Candle Type: NARROW_UPPER_WICK_LOWER_WICK\n- Volume: AVERAGE\n- Signal: None (None)\n\n**Detected Patterns:** None\n\n**Support/Resistance:**\n- Support Levels: 180.17, 168.49\n- Resistance Levels: 187.05, 174.38, 196.38, 191.05, 185.04\n\n**Risk-Reward Analysis:**\n- Risk-Reward Ratio: 0.00\n- Suggested Stop Loss: 173.00\n- Suggested Take Profit: 173.00\n\n**Multi-Timeframe Context:**\n- 1h: SIDEWAYS trend, None signal\n\n**Confidence Score:** 43.8/100\n\n**Conclusion:** Based on the SLIGHT_UP trend, the AVERAGE volume on the NARROW_UPPER_WICK_LOWER_WICK candle, a None NEUTRAL signal is generated with a confidence score of 43.8/100.", "confidence_score": 43.75}}
{"input": {"timestamp": "2024-03-15 08:00", "ticker": "AAPL", "primary_timeframe": "1d", "vpa_metrics": {"volume_class": "VERY_HIGH", "candle_class": "WIDE", "signal_type": "VALIDATION", "signal_strength": "BULLISH"}, "trend_analysis": {"trend_direction": "SIDEWAYS", "price_change_percent": 1.11, "volume_trend": "INCREASING", "signal_type": "CONSOLIDATION", "signal_strength": "NEUTRAL"}, "pattern_analysis": {"accumulation": {"detected": false, "strength": 1, "details": "Sideways: False, High volume count: 1, Support tests: 15"}, "distribution": {"detected": false, "strength": 1, "details": "Sideways: False, High volume count: 1, Resistance tests: 13"}, "testing": {"detected": false, "strength": 1, "details": "Testing low: True, Testing high: True, Low volume: False"}, "buying_climax": {"detected": true, "strength": 3, "details": "Near high: False, Very high volume: True, Wide up candle: True, Upper wick: False"}, "selling_climax": {"detected": true, "strength": 4, "details": "Near low: True, Very high volume: True, Wide down candle: False, Lower wick: True"}}, "support_resistance": {"support_levels": [180.3, 168.49], "resistance_levels": [187.05, 174.38, 196.38, 191.05, 185.04]}, "multi_timeframe_context": {"1h": {"trend_direction": "SIDEWAYS", "signal_strength": "NEUTRAL"}}, "risk_reward": {"risk_reward_ratio": 0.4261501210653736, "stop_loss": 168.49, "take_profit": 174.38}, "volatility": 1.887904066736184, "confidence_score": 52.5}, "output": {"signal": {"type": "VALIDATION", "strength": "BULLISH"}, "explanation": "VPA Analysis for AAPL on 2024-03-15 08:00 (1d):\n\n**Signal:** BUY (BULLISH)\n\n**Trend Context:** The primary trend is currently SIDEWAYS (Price change: 1.11%, Volume trend: INCREASING). Recent price action shows a CONSOLIDATION (NEUTRAL). \n\n**Current Candle Analysis:**\n- Candle Type: WIDE\n- Volume: VERY_HIGH\n- Signal: VALIDATION (BULLISH)\n\n**Detected Patterns:**\n- Buying Climax (Strength: 3): Near high: False, Very high volume: True, Wide up candle: True, Upper wick: False\n- Selling Climax (Strength: 4): Near low: True, Very high volume: True, Wide down candle: False, Lower wick: True\n\n**Support/Resistance:**\n- Support Levels: 180.30, 168.49\n- Resistance Levels: 187.05, 174.38, 196.38, 191.05, 185.04\n\n**Risk-Reward Analysis:**\n- Risk-Reward Ratio: 0.43\n- Suggested Stop Loss: 168.49\n- Suggested Take Profit: 174.38\n\n**Multi-Timeframe Context:**\n- 1h: SIDEWAYS trend, NEUTRAL signal\n\n**Confidence Score:** 52.5/100\n\n**Conclusion:** Based on the SIDEWAYS trend, the VERY_HIGH volume on the WIDE candle, and the presence of buying_climax, selling_climax, a BULLISH BUY signal is generated with a confidence score of 52.5/100.", "confidence_score": 52.5}}
{"input": {"timestamp": "2024-03-18 08:00", "ticker": "AAPL", "primary_timeframe": "1d", "vpa_metrics": {"volume_class": "AVERAGE", "candle_class": "WIDE", "signal_type": null, "signal_strength": null}, "trend_analysis": {"trend_direction": "SIDEWAYS", "price_change_percent": 0.56, "volume_trend": "INCREASING", "signal_type": "CONSOLIDATION", "signal_strength": "NEUTRAL"}, "pattern_analysis": {"accumulation": {"detected": false, "strength": 1, "details": "Sideways: False, High volume count: 1, Support tests: 14"}, "distribution": {"detected": false, "strength": 1, "details": "Sideways: False, High volume count: 1, Resistance tests: 12"}, "testing": {"detected": false, "strength": 1, "details": "Testing low: True, Testing high: False, Low volume: False"}, "buying_climax": {"detected": false, "strength": 1, "details": "Near high: False, Very high volume: False, Wide up candle: False, Upper wick: True"}, "selling_climax": {"detected": false, "strength": 1, "details": "Near low: True, Very high volume: False, Wide down candle: False, Lower wick: False"}}, "support_resistance": {"support_levels": [180.3, 168.49], "resistance_levels": [187.05, 174.38, 196.38, 191.05, 185.04]}, "multi_timeframe_context": {"1h": {"trend_direction": "SIDEWAYS", "signal_strength": "NEUTRAL"}}, "risk_reward": {"risk_reward_ratio": 0, "stop_loss": 173.72, "take_profit": 173.72}, "volatility": 1.9565392585770207, "confidence_score": 50.0}, "output": {"signal": {"type": null, "strength": null}, "explanation": "VPA Analysis for AAPL on 2024-03-18 08:00 (1d):\n\n**Signal:** NEUTRAL (None)\n\n**Trend Context:** The primary trend is currently SIDEWAYS (Price change: 0.56%, Volume trend: INCREASING). Recent price action shows a CONSOLIDATION (NEUTRAL). \n\n**Current Candle Analysis:**\n- Candle Type: WIDE\n- Volume: AVERAGE\n- Signal: None (None)\n\n**Detected Patterns:** None\n\n**Support/Resistance:**\n- Support Levels: 180.30, 168.49\n- Resistance Levels: 187.05, 174.38, 196.38, 191.05, 185.04\n\n**Risk-Reward Analysis:**\n- Risk-Reward Ratio: 0.00\n- Suggested Stop Loss: 173.72\n- Suggested Take Profit: 173.72\n\n**Multi-Timeframe Context:**\n- 1h: SIDEWAYS trend, NEUTRAL signal\n\n**Confidence Score:** 50.0/100\n\n**Conclusion:** Based on the SIDEWAYS trend, the AVERAGE volume on the WIDE candle, a None NEUTRAL signal is generated with a confidence score of 50.0/100.", "confidence_score": 50.0}}
{"input": {"timestamp": "2024-03-19 08:00", "ticker": "AAPL", "primary_timeframe": "1d", "vpa_metrics": {"volume_class": "AVERAGE", "candle_class": "WIDE", "signal_type": null, "signal_strength": null}, "trend_analysis": {"trend_direction": "SIDEWAYS", "price_change_percent": 1.65, "volume_trend": "FLAT", "signal_type": "CONSOLIDATION", "signal_strength": "NEUTRAL"}, "pattern_analysis": {"accumulation": {"detected": false, "strength": 1, "details": "Sideways: False, High volume count: 1, Support tests: 14"}, "distribution": {"detected": false, "strength": 1, "details": "Sideways: False, High volume count: 1, Resistance tests: 13"}, "testing": {"detected": false, "strength": 1, "details": "Testing low: True, Testing high: True, Low volume: False"}, "buying_climax": {"detected": false, "strength": 1, "details": "Near high: False, Very high volume: False, Wide up candle: False, Upper wick: True"}, "selling_climax": {"detected": false, "strength": 2, "details": "Near low: True, Very high volume: False, Wide down candle: False, Lower wick: True"}}, "support_resistance": {"support_levels": [180.3, 168.49, 170.285], "resistance_levels": [187.05, 174.38, 196.38, 191.05, 185.04]}, "multi_timeframe_context": {"1h": {"trend_direction": "SIDEWAYS", "signal_strength": "NEUTRAL"}}, "risk_reward": {"risk_reward_ratio": 0, "stop_loss": 176.08, "take_profit": 176.08}, "volatility": 1.9705546521915873, "confidence_score": 50.0}, "output": {"signal": {"type": null, "strength": null}, "explanation": "VPA Analysis for AAPL on 2024-03-19 08:00 (1d):\n\n**Signal:** NEUTRAL (None)\n\n**Trend Context:** The primary trend is currently SIDEWAYS (Price change: 1.65%, Volume trend: FLAT). Recent price action shows a CONSOLIDATION (NEUTRAL). \n\n**Current Candle Analysis:**\n- Candle Type: WIDE\n- Volume: AVERAGE\n- Signal: None (None)\n\n**Detected Patterns:** None\n\n**Support/Resistance:**\n- Support Levels: 180.30, 168.49, 170.28\n- Resistance Levels: 187.05, 174.38, 196.38, 191.05, 185.04\n\n**Risk-Reward Analysis:**\n- Risk-Reward Ratio: 0.00\n- Suggested Stop Loss: 176.08\n- Suggested Take Profit: 176.08\n\n**Multi-Timeframe Context:**\n- 1h: SIDEWAYS trend, NEUTRAL signal\n\n**Confidence Score:** 50.0/100\n\n**Conclusion:** Based on the SIDEWAYS trend, the AVERAGE volume on the WIDE candle, a None NEUTRAL signal is generated with a confidence score of 50.0/100.", "confidence_score": 50.0}}
{"input": {"timestamp": "2024-03-20 08:00", "ticker": "AAPL", "primary_timeframe": "1d", "vpa_metrics": {"volume_class": "AVERAGE", "candle_class": "WIDE", "signal_type": null, "signal_strength": null}, "trend_analysis": {"trend_direction": "SLIGHT_UP", "price_change_percent": 4.41, "volume_trend": "FLAT", "signal_type": null, "signal_strength": null}, "pattern_analysis": {"accumulation": {"detected": false, "strength": 1, "details": "Sideways: False, High volume count: 1, Support tests: 13"}, "distribution": {"detected": false, "strength": 1, "details": "Sideways: False, High volume count: 1, Resistance tests: 12"}, "testing": {"detected": false, "strength": 1, "details": "Testing low: True, Testing high: True, Low volume: False"}, "buying_climax": {"detected": false, "strength": 1, "details": "Near high: False, Very high volume: False, Wide up candle: True, Upper wick: False"}, "selling_climax": {"detected": false, "strength": 2, "details": "Near low: True, Very high volume: False, Wide down candle: False, Lower wick: True"}}, "support_resistance": {"support_levels": [180.3, 168.49, 170.285], "resistance_levels": [187.05, 174.38, 196.38, 191.05, 185.04]}, "multi_timeframe_context": {"1h": {"trend_direction": "SIDEWAYS", "signal_strength": "NEUTRAL"}}, "risk_reward": {"risk_reward_ratio": 0, "stop_loss": 178.67, "take_profit": 178.67}, "volatility": 1.969826760891145, "confidence_score": 50.0}, "output": {"signal": {"type": null, "strength": null}, "explanation": "VPA Analysis for AAPL on 2024-03-20 08:00 (1d):\n\n**Signal:** NEUTRAL (None)\n\n**Trend Context:** The primary trend is currently SLIGHT_UP (Price change: 4.41%, Volume trend: FLAT). Recent price action shows a None (None). \n\n**Current Candle Analysis:**\n- Candle Type: WIDE\n- Volume: AVERAGE\n- Signal: None (None)\n\n**Detected Patterns:** None\n\n**Support/Resistance:**\n- Support Levels: 180.30, 168.49, 170.28\n- Resistance Levels: 187.05, 174.38, 196.38, 191.05, 185.04\n\n**Risk-Reward Analysis:**\n- Risk-Reward Ratio: 0.00\n- Suggested Stop Loss: 178.67\n- Suggested Take Profit: 178.67\n\n**Multi-Timeframe Context:**\n- 1h: SIDEWAYS trend, NEUTRAL signal\n\n**Confidence Score:** 50.0/100\n\n**Conclusion:** Based on the SLIGHT_UP trend, the AVERAGE volume on the WIDE candle, a None NEUTRAL signal is generated with a confidence score of 50.0/100.", "confidence_score": 50.0}}
{"input": {"timestamp": "2024-03-21 08:00", "ticker": "AAPL", "primary_timeframe": "1d", "vpa_metrics": {"volume_class": "HIGH", "candle_class": "WIDE", "signal_type": "VALIDATION", "signal_strength": "BEARISH"}, "trend_analysis": {"trend_direction": "SIDEWAYS", "price_change_percent": -0.94, "volume_trend": "INCREASING", "signal_type": "CONSOLIDATION", "signal_strength": "NEUTRAL"}, "pattern_analysis": {"accumulation": {"detected": true, "strength": 2, "details": "Sideways: False, High volume count: 2, Support tests: 12"}, "distribution": {"detected": true, "strength": 2, "details": "Sideways: False, High volume count: 2, Resistance tests: 13"}, "testing": {"detected": false, "strength": 1, "details": "Testing low: True, Testing high: True, Low volume: False"}, "buying_climax": {"detected": true, "strength": 3, "details": "Near high: False, Very high volume: True, Wide up candle: False, Upper wick: True"}, "selling_climax": {"detected": true, "strength": 4, "details": "Near low: True, Very high volume: True, Wide down candle: True, Lower wick: False"}}, "support_resistance": {"support_levels": [180.3, 168.49, 170.285], "resistance_levels": [174.38, 196.38, 191.05, 185.04]}, "multi_timeframe_context": {"1h": {"trend_direction": "SIDEWAYS", "signal_strength": "NEUTRAL"}}, "risk_reward": {"risk_reward_ratio": 0.3604651162790735, "stop_loss": 174.38, "take_profit": 170.285}, "volatility": 2.20791270350703, "confidence_score": 47.91666666666666}, "output": {"signal": {"type": "VALIDATION", "strength": "BEARISH"}, "explanation": "VPA Analysis for AAPL on 2024-03-21 08:00 (1d):\n\n**Signal:** SELL (BEARISH)\n\n**Trend Context:** The primary trend is currently SIDEWAYS (Price change: -0.94%, Volume trend: INCREASING). Recent price action shows a CONSOLIDATION (NEUTRAL). \n\n**Current Candle Analysis:**\n- Candle Type: WIDE\n- Volume: HIGH\n- Signal: VALIDATION (BEARISH)\n\n**Detected Patterns:**\n- Accumulation (Strength: 2): Sideways: False, High volume count: 2, Support tests: 12\n- Distribution (Strength: 2): Sideways: False, High volume count: 2, Resistance tests: 13\n- Buying Climax (Strength: 3): Near high: False, Very high volume: True, Wide up candle: False, Upper wick: True\n- Selling Climax (Strength: 4): Near low: True, Very high volume: True, Wide down candle: True, Lower wick: False\n\n**Support/Resistance:**\n- Support Levels: 180.30, 168.49, 170.28\n- Resistance Levels: 174.38, 196.38, 191.05, 185.04\n\n**Risk-Reward Analysis:**\n- Risk-Reward Ratio: 0.36\n- Suggested Stop Loss: 174.38\n- Suggested Take Profit: 170.28\n\n**Multi-Timeframe Context:**\n- 1h: SIDEWAYS trend, NEUTRAL signal\n\n**Confidence Score:** 47.9/100\n\n**Conclusion:** Based on the SIDEWAYS trend, the HIGH volume on the WIDE candle, and the presence of accumulation, distribution, buying_climax, selling_climax, a BEARISH SELL signal is generated with a confidence score of 47.9/100.", "confidence_score": 47.91666666666666}}
{"input": {"timestamp": "2024-03-22 08:00", "ticker": "AAPL", "primary_timeframe": "1d", "vpa_metrics": {"volume_class": "AVERAGE", "candle_class": "NARROW_LOWER_WICK", "signal_type": null, "signal_strength": null}, "trend_analysis": {"trend_direction": "SIDEWAYS", "price_change_percent": -0.2, "volume_trend": "DECREASING", "signal_type": "CONSOLIDATION", "signal_strength": "NEUTRAL"}, "pattern_analysis": {"accumulation": {"detected": true, "strength": 2, "details": "Sideways: False, High volume count: 2, Support tests: 12"}, "distribution": {"detected": true, "strength": 2, "details": "Sideways: False, High volume count: 2, Resistance tests: 12"}, "testing": {"detected": false, "strength": 1, "details": "Testing low: True, Testing high: False, Low volume: False"}, "buying_climax": {"detected": false, "strength": 1, "details": "Near high: False, Very high volume: False, Wide up candle: False, Upper wick: True"}, "selling_climax": {"detected": false, "strength": 2, "details": "Near low: True, Very high volume: False, Wide down candle: False, Lower wick: True"}}, "support_resistance": {"support_levels": [180.3, 170.285, 168.49], "resistance_levels": [174.38, 196.38, 191.05, 185.04, 178.67]}, "multi_timeframe_context": {"1h": {"trend_direction": "SIDEWAYS", "signal_strength": "NEUTRAL"}}, "risk_reward": {"risk_reward_ratio": 0, "stop_loss": 172.28, "take_profit": 172.28}, "volatility": 2.2231343101193883, "confidence_score": 50.0}, "output": {"signal": {"type": null, "strength": null}, "explanation": "VPA Analysis for AAPL on 2024-03-22 08:00 (1d):\n\n**Signal:** NEUTRAL (None)\n\n**Trend Context:** The primary trend is currently SIDEWAYS (Price change: -0.2%, Volume trend: DECREASING). Recent price action shows a CONSOLIDATION (NEUTRAL). \n\n**Current Candle Analysis:**\n- Candle Type: NARROW_LOWER_WICK\n- Volume: AVERAGE\n- Signal: None (None)\n\n**Detected Patterns:**\n- Accumulation (Strength: 2): Sideways: False, High volume count: 2, Support tests: 12\n- Distribution (Strength: 2): Sideways: False, High volume count: 2, Resistance tests: 12\n\n**Support/Resistance:**\n- Support Levels: 180.30, 170.28, 168.49\n- Resistance Levels: 174.38, 196.38, 191.05, 185.04, 178.67\n\n**Risk-Reward Analysis:**\n- Risk-Reward Ratio: 0.00\n- Suggested Stop Loss: 172.28\n- Suggested Take Profit: 172.28\n\n**Multi-Timeframe Context:**\n- 1h: SIDEWAYS trend, NEUTRAL signal\n\n**Confidence Score:** 50.0/100\n\n**Conclusion:** Based on the SIDEWAYS trend, the AVERAGE volume on the NARROW_LOWER_WICK candle, and the presence of accumulation, distribution, a None NEUTRAL signal is generated with a confidence score of 50.0/100.", "confidence_score": 50.0}}
{"input": {"timestamp": "2024-03-25 08:00", "ticker": "AAPL", "primary_timeframe": "1d", "vpa_metrics": {"volume_class": "AVERAGE", "candle_class": "NARROW_UPPER_WICK_LOWER_WICK", "signal_type": null, "signal_strength": null}, "trend_analysis": {"trend_direction": "SIDEWAYS", "price_change_percent": -1.65, "volume_trend": "DECREASING", "signal_type": "CONSOLIDATION", "signal_strength": "NEUTRAL"}, "pattern_analysis": {"accumulation": {"detected": true, "strength": 2, "details": "Sideways: False, High volume count: 2, Support tests: 12"}, "distribution": {"detected": true, "strength": 2, "details": "Sideways: False, High volume count: 2, Resistance tests: 13"}, "testing": {"detected": false, "strength": 1, "details": "Testing low: True, Testing high: True, Low volume: False"}, "buying_climax": {"detected": false, "strength": 1, "details": "Near high: False, Very high volume: False, Wide up candle: False, Upper wick: True"}, "selling_climax": {"detected": false, "strength": 2, "details": "Near low: True, Very high volume: False, Wide down candle: False, Lower wick: True"}}, "support_resistance": {"support_levels": [180.3, 170.285, 168.49], "resistance_levels": [174.38, 196.38, 191.05, 185.04, 178.67]}, "multi_timeframe_context": {"1h": {"trend_direction": "SIDEWAYS", "signal_strength": null}}, "risk_reward": {"risk_reward_ratio": 0, "stop_loss": 170.85, "take_profit": 170.85}, "volatility": 2.194531984042634, "confidence_score": 50.0}, "output": {"signal": {"type": null, "strength": null}, "explanation": "VPA Analysis for AAPL on 2024-03-25 08:00 (1d):\n\n**Signal:** NEUTRAL (None)\n\n**Trend Context:** The primary trend is currently SIDEWAYS (Price change: -1.65%, Volume trend: DECREASING). Recent price action shows a CONSOLIDATION (NEUTRAL). \n\n**Current Candle Analysis:**\n- Candle Type: NARROW_UPPER_WICK_LOWER_WICK\n- Volume: AVERAGE\n- Signal: None (None)\n\n**Detected Patterns:**\n- Accumulation (Strength: 2): Sideways: False, High volume count: 2, Support tests: 12\n- Distribution (Strength: 2): Sideways: False, High volume count: 2, Resistance tests: 13\n\n**Support/Resistance:**\n- Support Levels: 180.30, 170.28, 168.49\n- Resistance Levels: 174.38, 196.38, 191.05, 185.04, 178.67\n\n**Risk-Reward Analysis:**\n- Risk-Reward Ratio: 0.00\n- Suggested Stop Loss: 170.85\n- Suggested Take Profit: 170.85\n\n**Multi-Timeframe Context:**\n- 1h: SIDEWAYS trend, None signal\n\n**Confidence Score:** 50.0/100\n\n**Conclusion:** Based on the SIDEWAYS trend, the AVERAGE volume on the NARROW_UPPER_WICK_LOWER_WICK candle, and the presence of accumulation, distribution, a None NEUTRAL signal is generated with a confidence score of 50.0/100.", "confidence_score": 50.0}}
{"input": {"timestamp": "2024-03-26 08:00", "ticker": "AAPL", "primary_timeframe": "1d", "vpa_metrics": {"volume_class": "AVERAGE", "candle_class": "NARROW_UPPER_WICK", "signal_type": null, "signal_strength": null}, "trend_analysis": {"trend_direction": "SLIGHT_DOWN", "price_change_percent": -3.62, "volume_trend": "FLAT", "signal_type": null, "signal_strength": null}, "pattern_analysis": {"accumulation": {"detected": true, "strength": 2, "details": "Sideways: False, High volume count: 2, Support tests: 12"}, "distribution": {"detected": true, "strength": 2, "details": "Sideways: False, High volume count: 2, Resistance tests: 13"}, "testing": {"detected": false, "strength": 1, "details": "Testing low: True, Testing high: True, Low volume: False"}, "buying_climax": {"detected": false, "strength": 1, "details": "Near high: False, Very high volume: False, Wide up candle: False, Upper wick: True"}, "selling_climax": {"detected": false, "strength": 2, "details": "Near low: True, Very high volume: False, Wide down candle: False, Lower wick: True"}}, "support_resistance": {"support_levels": [180.0, 170.285, 168.49], "resistance_levels": [174.38, 196.38, 191.05, 185.04, 178.67]}, "multi_timeframe_context": {"1h": {"trend_direction": "SIDEWAYS", "signal_strength": "NEUTRAL"}}, "risk_reward": {"risk_reward_ratio": 0, "stop_loss": 169.71, "take_profit": 169.71}, "volatility": 2.1736088497715893, "confidence_score": 50.0}, "output": {"signal": {"type": null, "strength": null}, "explanation": "VPA Analysis for AAPL on 2024-03-26 08:00 (1d):\n\n**Signal:** NEUTRAL (None)\n\n**Trend Context:** The primary trend is currently SLIGHT_DOWN (Price change: -3.62%, Volume trend: FLAT). Recent price action shows a None (None). \n\n**Current Candle Analysis:**\n- Candle Type: NARROW_UPPER_WICK\n- Volume: AVERAGE\n- Signal: None (None)\n\n**Detected Patterns:**\n- Accumulation (Strength: 2): Sideways: False, High volume count: 2, Support tests: 12\n- Distribution (Strength: 2): Sideways: False, High volume count: 2, Resistance tests: 13\n\n**Support/Resistance:**\n- Support Levels: 180.00, 170.28, 168.49\n- Resistance Levels: 174.38, 196.38, 191.05, 185.04, 178.67\n\n**Risk-Reward Analysis:**\n- Risk-Reward Ratio: 0.00\n- Suggested Stop Loss: 169.71\n- Suggested Take Profit: 169.71\n\n**Multi-Timeframe Context:**\n- 1h: SIDEWAYS trend, NEUTRAL signal\n\n**Confidence Score:** 50.0/100\n\n**Conclusion:** Based on the SLIGHT_DOWN trend, the AVERAGE volume on the NARROW_UPPER_WICK candle, and the presence of accumulation, distribution, a None NEUTRAL signal is generated with a confidence score of 50.0/100.", "confidence_score": 50.0}}
{"input": {"timestamp": "2024-03-27 08:00", "ticker": "AAPL", "primary_timeframe": "1d", "vpa_metrics": {"volume_class": "AVERAGE", "candle_class": "WIDE", "signal_type": null, "signal_strength": null}, "trend_analysis": {"trend_direction": "SLIGHT_DOWN", "price_change_percent": -3.0, "volume_trend": "INCREASING", "signal_type": "TREND_VALIDATION", "signal_strength": "BEARISH"}, "pattern_analysis": {"accumulation": {"detected": true, "strength": 2, "details": "Sideways: False, High volume count: 2, Support tests: 12"}, "distribution": {"detected": true, "strength": 2, "details": "Sideways: False, High volume count: 2, Resistance tests: 12"}, "testing": {"detected": false, "strength": 1, "details": "Testing low: True, Testing high: True, Low volume: False"}, "buying_climax": {"detected": false, "strength": 1, "details": "Near high: False, Very high volume: False, Wide up candle: True, Upper wick: False"}, "selling_climax": {"detected": false, "strength": 2, "details": "Near low: True, Very high volume: False, Wide down candle: False, Lower wick: True"}}, "support_resistance": {"support_levels": [180.0, 170.285, 168.49], "resistance_levels": [174.38, 196.38, 191.05, 185.04, 178.67]}, "multi_timeframe_context": {"1h": {"trend_direction": "SIDEWAYS", "signal_strength": "NEUTRAL"}}, "risk_reward": {"risk_reward_ratio": 0, "stop_loss": 173.31, "take_profit": 173.31}, "volatility": 2.154271779500679, "confidence_score": 46.875}, "output": {"signal": {"type": null, "strength": null}, "explanation": "VPA Analysis for AAPL on 2024-03-27 08:00 (1d):\n\n**Signal:** NEUTRAL (None)\n\n**Trend Context:** The primary trend is currently SLIGHT_DOWN (Price change: -3.0%, Volume trend: INCREASING). Recent price action shows a TREND_VALIDATION (BEARISH). \n\n**Current Candle Analysis:**\n- Candle Type: WIDE\n- Volume: AVERAGE\n- Signal: None (None)\n\n**Detected Patterns:**\n- Accumulation (Strength: 2): Sideways: False, High volume count: 2, Support tests: 12\n- Distribution (Strength: 2): Sideways: False, High volume count: 2, Resistance tests: 12\n\n**Support/Resistance:**\n- Support Levels: 180.00, 170.28, 168.49\n- Resistance Levels: 174.38, 196.38, 191.05, 185.04, 178.67\n\n**Risk-Reward Analysis:**\n- Risk-Reward Ratio: 0.00\n- Suggested Stop Loss: 173.31\n- Suggested Take Profit: 173.31\n\n**Multi-Timeframe Context:**\n- 1h: SIDEWAYS trend, NEUTRAL signal\n\n**Confidence Score:** 46.9/100\n\n**Conclusion:** Based on the SLIGHT_DOWN trend, the AVERAGE volume on the WIDE candle, and the presence of accumulation, distribution, a None NEUTRAL signal is generated with a confidence score of 46.9/100.", "confidence_score": 46.875}}
{"input": {"timestamp": "2024-03-28 08:00", "ticker": "AAPL", "primary_timeframe": "1d", "vpa_metrics": {"volume_class": "AVERAGE", "candle_class": "NARROW_UPPER_WICK_LOWER_WICK", "signal_type": null, "signal_strength": null}, "trend_analysis": {"trend_direction": "SIDEWAYS", "price_change_percent": 0.06, "volume_trend": "DECREASING", "signal_type": "CONSOLIDATION", "signal_strength": "NEUTRAL"}, "pattern_analysis": {"accumulation": {"detected": true, "strength": 2, "details": "Sideways: False, High volume count: 2, Support tests: 12"}, "distribution": {"detected": true, "strength": 2, "details": "Sideways: False, High volume count: 2, Resistance tests: 12"}, "testing": {"detected": false, "strength": 1, "details": "Testing low: True, Testing high: True, Low volume: False"}, "buying_climax": {"detected": false, "strength": 1, "details": "Near high: False, Very high volume: False, Wide up candle: False, Upper wick: True"}, "selling_climax": {"detected": false, "strength": 2, "details": "Near low: True, Very high volume: False, Wide down candle: False, Lower wick: True"}}, "support_resistance": {"support_levels": [170.285, 180.0, 168.49], "resistance_levels": [174.38, 196.38, 191.05, 185.04, 178.67]}, "multi_timeframe_context": {"1h": {"trend_direction": "SIDEWAYS", "signal_strength": "NEUTRAL"}}, "risk_reward": {"risk_reward_ratio": 0, "stop_loss": 171.48, "take_profit": 171.48}, "volatility": 2.159766982186044, "confidence_score": 50.0}, "output": {"signal": {"type": null, "strength": null}, "explanation": "VPA Analysis for AAPL on 2024-03-28 08:00 (1d):\n\n**Signal:** NEUTRAL (None)\n\n**Trend Context:** The primary trend is currently SIDEWAYS (Price change: 0.06%, Volume trend: DECREASING). Recent price action shows a CONSOLIDATION (NEUTRAL). \n\n**Current Candle Analysis:**\n- Candle Type: NARROW_UPPER_WICK_LOWER_WICK\n- Volume: AVERAGE\n- Signal: None (None)\n\n**Detected Patterns:**\n- Accumulation (Strength: 2): Sideways: False, High volume count: 2, Support tests: 12\n- Distribution (Strength: 2): Sideways: False, High volume count: 2, Resistance tests: 12\n\n**Support/Resistance:**\n- Support Levels: 170.28, 180.00, 168.49\n- Resistance Levels: 174.38, 196.38, 191.05, 185.04, 178.67\n\n**Risk-Reward Analysis:**\n- Risk-Reward Ratio: 0.00\n- Suggested Stop Loss: 171.48\n- Suggested Take Profit: 171.48\n\n**Multi-Timeframe Context:**\n- 1h: SIDEWAYS trend, NEUTRAL signal\n\n**Confidence Score:** 50.0/100\n\n**Conclusion:** Based on the SIDEWAYS trend, the AVERAGE volume on the NARROW_UPPER_WICK_LOWER_WICK candle, and the presence of accumulation, distribution, a None NEUTRAL signal is generated with a confidence score of 50.0/100.", "confidence_score": 50.0}}
{"input": {"timestamp": "2024-04-01 08:00", "ticker": "AAPL", "primary_timeframe": "1d", "vpa_metrics": {"volume_class": "AVERAGE", "candle_class": "NEUTRAL", "signal_type": null, "signal_strength": null}, "trend_analysis": {"trend_direction": "SIDEWAYS", "price_change_percent": -1.31, "volume_trend": "DECREASING", "signal_type": "CONSOLIDATION", "signal_strength": "NEUTRAL"}, "pattern_analysis": {"accumulation": {"detected": true, "strength": 3, "details": "Sideways: True, High volume count: 2, Support tests: 13"}, "distribution": {"detected": true, "strength": 3, "details": "Sideways: True, High volume count: 2, Resistance tests: 13"}, "testing": {"detected": false, "strength": 1, "details": "Testing low: True, Testing high: True, Low volume: False"}, "buying_climax": {"detected": false, "strength": 1, "details": "Near high: False, Very high volume: False, Wide up candle: False, Upper wick: True"}, "selling_climax": {"detected": true, "strength": 3, "details": "Near low: True, Very high volume: False, Wide down candle: True, Lower wick: True"}}, "support_resistance": {"support_levels": [170.285, 180.0, 168.49], "resistance_levels": [174.38, 196.38, 191.05, 185.04, 178.67]}, "multi_timeframe_context": {"1h": {"trend_direction": "SIDEWAYS", "signal_strength": "NEUTRAL"}}, "risk_reward": {"risk_reward_ratio": 0, "stop_loss": 170.03, "take_profit": 170.03}, "volatility": 2.058546943728194, "confidence_score": 55.0}, "output": {"signal": {"type": null, "strength": null}, "explanation": "VPA Analysis for AAPL on 2024-04-01 08:00 (1d):\n\n**Signal:** NEUTRAL (None)\n\n**Trend Context:** The primary trend is currently SIDEWAYS (Price change: -1.31%, Volume trend: DECREASING). Recent price action shows a CONSOLIDATION (NEUTRAL). \n\n**Current Candle Analysis:**\n- Candle Type: NEUTRAL\n- Volume: AVERAGE\n- Signal: None (None)\n\n**Detected Patterns:**\n- Accumulation (Strength: 3): Sideways: True, High volume count: 2, Support tests: 13\n- Distribution (Strength: 3): Sideways: True, High volume count: 2, Resistance tests: 13\n- Selling Climax (Strength: 3): Near low: True, Very high volume: False, Wide down candle: True, Lower wick: True\n\n**Support/Resistance:**\n- Support Levels: 170.28, 180.00, 168.49\n- Resistance Levels: 174.38, 196.38, 191.05, 185.04, 178.67\n\n**Risk-Reward Analysis:**\n- Risk-Reward Ratio: 0.00\n- Suggested Stop Loss: 170.03\n- Suggested Take Profit: 170.03\n\n**Multi-Timeframe Context:**\n- 1h: SIDEWAYS trend, NEUTRAL signal\n\n**Confidence Score:** 55.0/100\n\n**Conclusion:** Based on the SIDEWAYS trend, the AVERAGE volume on the NEUTRAL candle, and the presence of accumulation, distribution, selling_climax, a None NEUTRAL signal is generated with a confidence score of 55.0/100.", "confidence_score": 55.0}}
{"input": {"timestamp": "2024-04-02 08:00", "ticker": "AAPL", "primary_timeframe": "1d", "vpa_metrics": {"volume_class": "AVERAGE", "candle_class": "NARROW_LOWER_WICK", "signal_type": null, "signal_strength": null}, "trend_analysis": {"trend_direction": "SIDEWAYS", "price_change_percent": -1.18, "volume_trend": "FLAT", "signal_type": "CONSOLIDATION", "signal_strength": "NEUTRAL"}, "pattern_analysis": {"accumulation": {"detected": true, "strength": 3, "details": "Sideways: True, High volume count: 2, Support tests: 14"}, "distribution": {"detected": true, "strength": 3, "details": "Sideways: True, High volume count: 2, Resistance tests: 13"}, "testing": {"detected": false, "strength": 1, "details": "Testing low: True, Testing high: False, Low volume: False"}, "buying_climax": {"detected": false, "strength": 1, "details": "Near high: False, Very high volume: False, Wide up candle: False, Upper wick: True"}, "selling_climax": {"detected": false, "strength": 2, "details": "Near low: True, Very high volume: False, Wide down candle: False, Lower wick: True"}}, "support_resistance": {"support_levels": [170.285, 180.0, 168.49], "resistance_levels": [174.38, 196.38, 191.05, 185.04, 178.67]}, "multi_timeframe_context": {"1h": {"trend_direction": "SIDEWAYS", "signal_strength": null}}, "risk_reward": {"risk_reward_ratio": 0, "stop_loss": 168.84, "take_profit": 168.84}, "volatility": 1.9583348919562569, "confidence_score": 50.0}, "output": {"signal": {"type": null, "strength": null}, "explanation": "VPA Analysis for AAPL on 2024-04-02 08:00 (1d):\n\n**Signal:** NEUTRAL (None)\n\n**Trend Context:** The primary trend is currently SIDEWAYS (Price change: -1.18%, Volume trend: FLAT). Recent price action shows a CONSOLIDATION (NEUTRAL). \n\n**Current Candle Analysis:**\n- Candle Type: NARROW_LOWER_WICK\n- Volume: AVERAGE\n- Signal: None (None)\n\n**Detected Patterns:**\n- Accumulation (Strength: 3): Sideways: True, High volume count: 2, Support tests: 14\n- Distribution (Strength: 3): Sideways: True, High volume count: 2, Resistance tests: 13\n\n**Support/Resistance:**\n- Support Levels: 170.28, 180.00, 168.49\n- Resistance Levels: 174.38, 196.38, 191.05, 185.04, 178.67\n\n**Risk-Reward Analysis:**\n- Risk-Reward Ratio: 0.00\n- Suggested Stop Loss: 168.84\n- Suggested Take Profit: 168.84\n\n**Multi-Timeframe Context:**\n- 1h: SIDEWAYS trend, None signal\n\n**Confidence Score:** 50.0/100\n\n**Conclusion:** Based on the SIDEWAYS trend, the AVERAGE volume on the NARROW_LOWER_WICK candle, and the presence of accumulation, distribution, a None NEUTRAL signal is generated with a confidence score of 50.0/100.", "confidence_score": 50.0}}
{"input": {"timestamp": "2024-04-03 08:00", "ticker": "AAPL", "primary_timeframe": "1d", "vpa_metrics": {"volume_class": "AVERAGE", "candle_class": "NEUTRAL", "signal_type": null, "signal_strength": null}, "trend_analysis": {"trend_direction": "SIDEWAYS", "price_change_percent": -0.04, "volume_trend": "DECREASING", "signal_type": "CONSOLIDATION", "signal_strength": "NEUTRAL"}, "pattern_analysis": {"accumulation": {"detected": true, "strength": 3, "details": "Sideways: True, High volume count: 2, Support tests: 15"}, "distribution": {"detected": true, "strength": 3, "details": "Sideways: True, High volume count: 2, Resistance tests: 14"}, "testing": {"detected": false, "strength": 1, "details": "Testing low: True, Testing high: True, Low volume: False"}, "buying_climax": {"detected": false, "strength": 1, "details": "Near high: False, Very high volume: False, Wide up candle: False, Upper wick: True"}, "selling_climax": {"detected": false, "strength": 2, "details": "Near low: True, Very high volume: False, Wide down candle: False, Lower wick: True"}}, "support_resistance": {"support_levels": [170.285, 180.0, 168.49], "resistance_levels": [174.38, 191.05, 185.04, 178.67]}, "multi_timeframe_context": {"1h": {"trend_direction": "SIDEWAYS", "signal_strength": null}}, "risk_reward": {"risk_reward_ratio": 0, "stop_loss": 169.65, "take_profit": 169.65}, "volatility": 1.9347138846231384, "confidence_score": 50.0}, "output": {"signal": {"type": null, "strength": null}, "explanation": "VPA Analysis for AAPL on 2024-04-03 08:00 (1d):\n\n**Signal:** NEUTRAL (None)\n\n**Trend Context:** The primary trend is currently SIDEWAYS (Price change: -0.04%, Volume trend: DECREASING). Recent price action shows a CONSOLIDATION (NEUTRAL). \n\n**Current Candle Analysis:**\n- Candle Type: NEUTRAL\n- Volume: AVERAGE\n- Signal: None (None)\n\n**Detected Patterns:**\n- Accumulation (Strength: 3): Sideways: True, High volume count: 2, Support tests: 15\n- Distribution (Strength: 3): Sideways: True, High volume count: 2, Resistance tests: 14\n\n**Support/Resistance:**\n- Support Levels: 170.28, 180.00, 168.49\n- Resistance Levels: 174.38, 191.05, 185.04, 178.67\n\n**Risk-Reward Analysis:**\n- Risk-Reward Ratio: 0.00\n- Suggested Stop Loss: 169.65\n- Suggested Take Profit: 169.65\n\n**Multi-Timeframe Context:**\n- 1h: SIDEWAYS trend, None signal\n\n**Confidence Score:** 50.0/100\n\n**Conclusion:** Based on the SIDEWAYS trend, the AVERAGE volume on the NEUTRAL candle, and the presence of accumulation, distribution, a None NEUTRAL signal is generated with a confidence score of 50.0/100.", "confidence_score": 50.0}}
{"input": {"timestamp": "2024-04-04 08:00", "ticker": "AAPL", "primary_timeframe": "1d", "vpa_metrics": {"volume_class": "AVERAGE", "candle_class": "NEUTRAL", "signal_type": null, "signal_strength": null}, "trend_analysis": {"trend_direction": "SLIGHT_DOWN", "price_change_percent": -2.59, "volume_trend": "DECREASING", "signal_type": "TREND_ANOMALY", "signal_strength": "BULLISH"}, "pattern_analysis": {"accumulation": {"detected": true, "strength": 3, "details": "Sideways: True, High volume count: 2, Support tests: 15"}, "distribution": {"detected": true, "strength": 3, "details": "Sideways: True, High volume count: 2, Resistance tests: 14"}, "testing": {"detected": false, "strength": 1, "details": "Testing low: True, Testing high: True, Low volume: False"}, "buying_climax": {"detected": false, "strength": 1, "details": "Near high: False, Very high volume: False, Wide up candle: False, Upper wick: True"}, "selling_climax": {"detected": false, "strength": 1, "details": "Near low: True, Very high volume: False, Wide down candle: False, Lower wick: False"}}, "support_resistance": {"support_levels": [170.285, 180.0, 168.49], "resistance_levels": [174.38, 191.05, 185.04, 178.67]}, "multi_timeframe_context": {"1h": {"trend_direction": "SIDEWAYS", "signal_strength": "BEARISH"}}, "risk_reward": {"risk_reward_ratio": 0, "stop_loss": 168.82, "take_profit": 168.82}, "volatility": 1.971037355264715, "confidence_score": 50.0}, "output": {"signal": {"type": null, "strength": null}, "explanation": "VPA Analysis for AAPL on 2024-04-04 08:00 (1d):\n\n**Signal:** NEUTRAL (None)\n\n**Trend Context:** The primary trend is currently SLIGHT_DOWN (Price change: -2.59%, Volume trend: DECREASING). Recent price action shows a TREND_ANOMALY (BULLISH). \n\n**Current Candle Analysis:**\n- Candle Type: NEUTRAL\n- Volume: AVERAGE\n- Signal: None (None)\n\n**Detected Patterns:**\n- Accumulation (Strength: 3): Sideways: True, High volume count: 2, Support tests: 15\n- Distribution (Strength: 3): Sideways: True, High volume count: 2, Resistance tests: 14\n\n**Support/Resistance:**\n- Support Levels: 170.28, 180.00, 168.49\n- Resistance Levels: 174.38, 191.05, 185.04, 178.67\n\n**Risk-Reward Analysis:**\n- Risk-Reward Ratio: 0.00\n- Suggested Stop Loss: 168.82\n- Suggested Take Profit: 168.82\n\n**Multi-Timeframe Context:**\n- 1h: SIDEWAYS trend, BEARISH signal\n\n**Confidence Score:** 50.0/100\n\n**Conclusion:** Based on the SLIGHT_DOWN trend, the AVERAGE volume on the NEUTRAL candle, and the presence of accumulation, distribution, a None NEUTRAL signal is generated with a confidence score of 50.0/100.", "confidence_score": 50.0}}
{"input": {"timestamp": "2024-04-05 08:00", "ticker": "AAPL", "primary_timeframe": "1d", "vpa_metrics": {"volume_class": "AVERAGE", "candle_class": "NARROW_UPPER_WICK_LOWER_WICK", "signal_type": null, "signal_strength": null}, "trend_analysis": {"trend_direction": "SIDEWAYS", "price_change_percent": -1.11, "volume_trend": "DECREASING", "signal_type": "CONSOLIDATION", "signal_strength": "NEUTRAL"}, "pattern_analysis": {"accumulation": {"detected": true, "strength": 3, "details": "Sideways: True, High volume count: 2, Support tests: 15"}, "distribution": {"detected": true, "strength": 3, "details": "Sideways: True, High volume count: 2, Resistance tests: 14"}, "testing": {"detected": false, "strength": 1, "details": "Testing low: True, Testing high: True, Low volume: False"}, "buying_climax": {"detected": false, "strength": 1, "details": "Near high: False, Very high volume: False, Wide up candle: False, Upper wick: True"}, "selling_climax": {"detected": false, "strength": 2, "details": "Near low: True, Very high volume: False, Wide down candle: False, Lower wick: True"}}, "support_resistance": {"support_levels": [170.285, 180.0, 168.49], "resistance_levels": [174.38, 191.05, 185.04, 178.67]}, "multi_timeframe_context": {"1h": {"trend_direction": "SIDEWAYS", "signal_strength": "NEUTRAL"}}, "risk_reward": {"risk_reward_ratio": 0, "stop_loss": 169.58, "take_profit": 169.58}, "volatility": 1.86319762136796, "confidence_score": 50.0}, "output": {"signal": {"type": null, "strength": null}, "explanation": "VPA Analysis for AAPL on 2024-04-05 08:00 (1d):\n\n**Signal:** NEUTRAL (None)\n\n**Trend Context:** The primary trend is currently SIDEWAYS (Price change: -1.11%, Volume trend: DECREASING). Recent price action shows a CONSOLIDATION (NEUTRAL). \n\n**Current Candle Analysis:**\n- Candle Type: NARROW_UPPER_WICK_LOWER_WICK\n- Volume: AVERAGE\n- Signal: None (None)\n\n**Detected Patterns:**\n- Accumulation (Strength: 3): Sideways: True, High volume count: 2, Support tests: 15\n- Distribution (Strength: 3): Sideways: True, High volume count: 2, Resistance tests: 14\n\n**Support/Resistance:**\n- Support Levels: 170.28, 180.00, 168.49\n- Resistance Levels: 174.38, 191.05, 185.04, 178.67\n\n**Risk-Reward Analysis:**\n- Risk-Reward Ratio: 0.00\n- Suggested Stop Loss: 169.58\n- Suggested Take Profit: 169.58\n\n**Multi-Timeframe Context:**\n- 1h: SIDEWAYS trend, NEUTRAL signal\n\n**Confidence Score:** 50.0/100\n\n**Conclusion:** Based on the SIDEWAYS trend, the AVERAGE volume on the NARROW_UPPER_WICK_LOWER_WICK candle, and the presence of accumulation, distribution, a None NEUTRAL signal is generated with a confidence score of 50.0/100.", "confidence_score": 50.0}}
{"input": {"timestamp": "2024-04-08 08:00", "ticker": "AAPL", "primary_timeframe": "1d", "vpa_metrics": {"volume_class": "AVERAGE", "candle_class": "NARROW", "signal_type": null, "signal_strength": null}, "trend_analysis": {"trend_direction": "SIDEWAYS", "price_change_percent": -0.93, "volume_trend": "DECREASING", "signal_type": "CONSOLIDATION", "signal_strength": "NEUTRAL"}, "pattern_analysis": {"accumulation": {"detected": true, "strength": 3, "details": "Sideways: True, High volume count: 2, Support tests: 15"}, "distribution": {"detected": true, "strength": 3, "details": "Sideways: True, High volume count: 2, Resistance tests: 15"}, "testing": {"detected": false, "strength": 1, "details": "Testing low: True, Testing high: True, Low volume: False"}, "buying_climax": {"detected": false, "strength": 1, "details": "Near high: False, Very high volume: False, Wide up candle: False, Upper wick: True"}, "selling_climax": {"detected": true, "strength": 3, "details": "Near low: True, Very high volume: False, Wide down candle: True, Lower wick: True"}}, "support_resistance": {"support_levels": [170.285, 168.49, 180.0], "resistance_levels": [174.38, 191.05, 185.04, 178.67, 171.92]}, "multi_timeframe_context": {"1h": {"trend_direction": "SIDEWAYS", "signal_strength": "NEUTRAL"}}, "risk_reward": {"risk_reward_ratio": 0, "stop_loss": 168.45, "take_profit": 168.45}, "volatility": 1.8035212697817544, "confidence_score": 55.0}, "output": {"signal": {"type": null, "strength": null}, "explanation": "VPA Analysis for AAPL on 2024-04-08 08:00 (1d):\n\n**Signal:** NEUTRAL (None)\n\n**Trend Context:** The primary trend is currently SIDEWAYS (Price change: -0.93%, Volume trend: DECREASING). Recent price action shows a CONSOLIDATION (NEUTRAL). \n\n**Current Candle Analysis:**\n- Candle Type: NARROW\n- Volume: AVERAGE\n- Signal: None (None)\n\n**Detected Patterns:**\n- Accumulation (Strength: 3): Sideways: True, High volume count: 2, Support tests: 15\n- Distribution (Strength: 3): Sideways: True, High volume count: 2, Resistance tests: 15\n- Selling Climax (Strength: 3): Near low: True, Very high volume: False, Wide down candle: True, Lower wick: True\n\n**Support/Resistance:**\n- Support Levels: 170.28, 168.49, 180.00\n- Resistance Levels: 174.38, 191.05, 185.04, 178.67, 171.92\n\n**Risk-Reward Analysis:**\n- Risk-Reward Ratio: 0.00\n- Suggested Stop Loss: 168.45\n- Suggested Take Profit: 168.45\n\n**Multi-Timeframe Context:**\n- 1h: SIDEWAYS trend, NEUTRAL signal\n\n**Confidence Score:** 55.0/100\n\n**Conclusion:** Based on the SIDEWAYS trend, the AVERAGE volume on the NARROW candle, and the presence of accumulation, distribution, selling_climax, a None NEUTRAL signal is generated with a confidence score of 55.0/100.", "confidence_score": 55.0}}
{"input": {"timestamp": "2024-04-09 08:00", "ticker": "AAPL", "primary_timeframe": "1d", "vpa_metrics": {"volume_class": "AVERAGE", "candle_class": "NEUTRAL", "signal_type": null, "signal_strength": null}, "trend_analysis": {"trend_direction": "SIDEWAYS", "price_change_percent": 0.49, "volume_trend": "DECREASING", "signal_type": "CONSOLIDATION", "signal_strength": "NEUTRAL"}, "pattern_analysis": {"accumulation": {"detected": true, "strength": 3, "details": "Sideways: True, High volume count: 2, Support tests: 16"}, "distribution": {"detected": true, "strength": 3, "details": "Sideways: True, High volume count: 2, Resistance tests: 15"}, "testing": {"detected": false, "strength": 1, "details": "Testing low: True, Testing high: True, Low volume: False"}, "buying_climax": {"detected": false, "strength": 1, "details": "Near high: False, Very high volume: False, Wide up candle: False, Upper wick: True"}, "selling_climax": {"detected": false, "strength": 2, "details": "Near low: True, Very high volume: False, Wide down candle: False, Lower wick: True"}}, "support_resistance": {"support_levels": [168.49, 170.285, 180.0], "resistance_levels": [174.38, 191.05, 185.04, 178.67, 171.92]}, "multi_timeframe_context": {"1h": {"trend_direction": "SIDEWAYS", "signal_strength": "NEUTRAL"}}, "risk_reward": {"risk_reward_ratio": 0, "stop_loss": 169.67, "take_profit": 169.67}, "volatility": 1.7505374209378564, "confidence_score": 50.0}, "output": {"signal": {"type": null, "strength": null}, "explanation": "VPA Analysis for AAPL on 2024-04-09 08:00 (1d):\n\n**Signal:** NEUTRAL (None)\n\n**Trend Context:** The primary trend is currently SIDEWAYS (Price change: 0.49%, Volume trend: DECREASING). Recent price action shows a CONSOLIDATION (NEUTRAL). \n\n**Current Candle Analysis:**\n- Candle Type: NEUTRAL\n- Volume: AVERAGE\n- Signal: None (None)\n\n**Detected Patterns:**\n- Accumulation (Strength: 3): Sideways: True, High volume count: 2, Support tests: 16\n- Distribution (Strength: 3): Sideways: True, High volume count: 2, Resistance tests: 15\n\n**Support/Resistance:**\n- Support Levels: 168.49, 170.28, 180.00\n- Resistance Levels: 174.38, 191.05, 185.04, 178.67, 171.92\n\n**Risk-Reward Analysis:**\n- Risk-Reward Ratio: 0.00\n- Suggested Stop Loss: 169.67\n- Suggested Take Profit: 169.67\n\n**Multi-Timeframe Context:**\n- 1h: SIDEWAYS trend, NEUTRAL signal\n\n**Confidence Score:** 50.0/100\n\n**Conclusion:** Based on the SIDEWAYS trend, the AVERAGE volume on the NEUTRAL candle, and the presence of accumulation, distribution, a None NEUTRAL signal is generated with a confidence score of 50.0/100.", "confidence_score": 50.0}}
{"input": {"timestamp": "2024-04-10 08:00", "ticker": "AAPL", "primary_timeframe": "1d", "vpa_metrics": {"volume_class": "AVERAGE", "candle_class": "NEUTRAL", "signal_type": null, "signal_strength": null}, "trend_analysis": {"trend_direction": "SIDEWAYS", "price_change_percent": -1.1, "volume_trend": "FLAT", "signal_type": "CONSOLIDATION", "signal_strength": "NEUTRAL"}, "pattern_analysis": {"accumulation": {"detected": true, "strength": 3, "details": "Sideways: True, High volume count: 2, Support tests: 16"}, "distribution": {"detected": true, "strength": 3, "details": "Sideways: True, High volume count: 2, Resistance tests: 15"}, "testing": {"detected": false, "strength": 1, "details": "Testing low: True, Testing high: True, Low volume: False"}, "buying_climax": {"detected": false, "strength": 1, "details": "Near high: False, Very high volume: False, Wide up candle: False, Upper wick: True"}, "selling_climax": {"detected": false, "strength": 2, "details": "Near low: True, Very high volume: False, Wide down candle: False, Lower wick: True"}}, "support_resistance": {"support_levels": [168.49, 170.285, 180.0], "resistance_levels": [174.38, 191.05, 185.04, 178.67, 171.92]}, "multi_timeframe_context": {"1h": {"trend_direction": "SIDEWAYS", "signal_strength": "NEUTRAL"}}, "risk_reward": {"risk_reward_ratio": 0, "stop_loss": 167.78, "take_profit": 167.78}, "volatility": 1.773080035886591, "confidence_score": 50.0}, "output": {"signal": {"type": null, "strength": null}, "explanation": "VPA Analysis for AAPL on 2024-04-10 08:00 (1d):\n\n**Signal:** NEUTRAL (None)\n\n**Trend Context:** The primary trend is currently SIDEWAYS (Price change: -1.1%, Volume trend: FLAT). Recent price action shows a CONSOLIDATION (NEUTRAL). \n\n**Current Candle Analysis:**\n- Candle Type: NEUTRAL\n- Volume: AVERAGE\n- Signal: None (None)\n\n**Detected Patterns:**\n- Accumulation (Strength: 3): Sideways: True, High volume count: 2, Support tests: 16\n- Distribution (Strength: 3): Sideways: True, High volume count: 2, Resistance tests: 15\n\n**Support/Resistance:**\n- Support Levels: 168.49, 170.28, 180.00\n- Resistance Levels: 174.38, 191.05, 185.04, 178.67, 171.92\n\n**Risk-Reward Analysis:**\n- Risk-Reward Ratio: 0.00\n- Suggested Stop Loss: 167.78\n- Suggested Take Profit: 167.78\n\n**Multi-Timeframe Context:**\n- 1h: SIDEWAYS trend, NEUTRAL signal\n\n**Confidence Score:** 50.0/100\n\n**Conclusion:** Based on the SIDEWAYS trend, the AVERAGE volume on the NEUTRAL candle, and the presence of accumulation, distribution, a None NEUTRAL signal is generated with a confidence score of 50.0/100.", "confidence_score": 50.0}}
{"input": {"timestamp": "2024-04-11 08:00", "ticker": "AAPL", "primary_timeframe": "1d", "vpa_metrics": {"volume_class": "HIGH", "candle_class": "WIDE", "signal_type": "VALIDATION", "signal_strength": "BULLISH"}, "trend_analysis": {"trend_direction": "SLIGHT_UP", "price_change_percent": 3.68, "volume_trend": "INCREASING", "signal_type": "TREND_VALIDATION", "signal_strength": "BULLISH"}, "pattern_analysis": {"accumulation": {"detected": true, "strength": 3, "details": "Sideways: True, High volume count: 3, Support tests: 16"}, "distribution": {"detected": true, "strength": 3, "details": "Sideways: True, High volume count: 3, Resistance tests: 14"}, "testing": {"detected": false, "strength": 1, "details": "Testing low: True, Testing high: False, Low volume: False"}, "buying_climax": {"detected": true, "strength": 4, "details": "Near high: True, Very high volume: True, Wide up candle: True, Upper wick: False"}, "selling_climax": {"detected": true, "strength": 4, "details": "Near low: True, Very high volume: True, Wide down candle: False, Lower wick: True"}}, "support_resistance": {"support_levels": [168.49, 170.285, 180.0], "resistance_levels": [174.38, 191.05, 185.04, 178.67, 171.92]}, "multi_timeframe_context": {"1h": {"trend_direction": "SIDEWAYS", "signal_strength": "NEUTRAL"}}, "risk_reward": {"risk_reward_ratio": 0.7634069400630913, "stop_loss": 170.285, "take_profit": 178.67}, "volatility": 1.8349129221591438, "confidence_score": 54.16666666666667}, "output": {"signal": {"type": "VALIDATION", "strength": "BULLISH"}, "explanation": "VPA Analysis for AAPL on 2024-04-11 08:00 (1d):\n\n**Signal:** BUY (BULLISH)\n\n**Trend Context:** The primary trend is currently SLIGHT_UP (Price change: 3.68%, Volume trend: INCREASING). Recent price action shows a TREND_VALIDATION (BULLISH). \n\n**Current Candle Analysis:**\n- Candle Type: WIDE\n- Volume: HIGH\n- Signal: VALIDATION (BULLISH)\n\n**Detected Patterns:**\n- Accumulation (Strength: 3): Sideways: True, High volume count: 3, Support tests: 16\n- Distribution (Strength: 3): Sideways: True, High volume count: 3, Resistance tests: 14\n- Buying Climax (Strength: 4): Near high: True, Very high volume: True, Wide up candle: True, Upper wick: False\n- Selling Climax (Strength: 4): Near low: True, Very high volume: True, Wide down candle: False, Lower wick: True\n\n**Support/Resistance:**\n- Support Levels: 168.49, 170.28, 180.00\n- Resistance Levels: 174.38, 191.05, 185.04, 178.67, 171.92\n\n**Risk-Reward Analysis:**\n- Risk-Reward Ratio: 0.76\n- Suggested Stop Loss: 170.28\n- Suggested Take Profit: 178.67\n\n**Multi-Timeframe Context:**\n- 1h: SIDEWAYS trend, NEUTRAL signal\n\n**Confidence Score:** 54.2/100\n\n**Conclusion:** Based on the SLIGHT_UP trend, the HIGH volume on the WIDE candle, and the presence of accumulation, distribution, buying_climax, selling_climax, a BULLISH BUY signal is generated with a confidence score of 54.2/100.", "confidence_score": 54.16666666666667}}
{"input": {"timestamp": "2024-04-12 08:00", "ticker": "AAPL", "primary_timeframe": "1d", "vpa_metrics": {"volume_class": "HIGH", "candle_class": "WIDE", "signal_type": "VALIDATION", "signal_strength": "BULLISH"}, "trend_analysis": {"trend_direction": "SLIGHT_UP", "price_change_percent": 4.11, "volume_trend": "INCREASING", "signal_type": "TREND_VALIDATION", "signal_strength": "BULLISH"}, "pattern_analysis": {"accumulation": {"detected": true, "strength": 3, "details": "Sideways: True, High volume count: 4, Support tests: 15"}, "distribution": {"detected": true, "strength": 3, "details": "Sideways: True, High volume count: 4, Resistance tests: 13"}, "testing": {"detected": false, "strength": 0, "details": "Testing low: False, Testing high: False, Low volume: False"}, "buying_climax": {"detected": true, "strength": 4, "details": "Near high: True, Very high volume: True, Wide up candle: False, Upper wick: True"}, "selling_climax": {"detected": true, "strength": 4, "details": "Near low: True, Very high volume: True, Wide down candle: False, Lower wick: True"}}, "support_resistance": {"support_levels": [168.49, 170.285, 180.0], "resistance_levels": [174.38, 178.67, 191.05, 185.04, 171.92]}, "multi_timeframe_context": {"1h": {"trend_direction": "SIDEWAYS", "signal_strength": "NEUTRAL"}}, "risk_reward": {"risk_reward_ratio": 0.3383878691141215, "stop_loss": 170.285, "take_profit": 178.67}, "volatility": 1.8619982411423615, "confidence_score": 54.16666666666667}, "output": {"signal": {"type": "VALIDATION", "strength": "BULLISH"}, "explanation": "VPA Analysis for AAPL on 2024-04-12 08:00 (1d):\n\n**Signal:** BUY (BULLISH)\n\n**Trend Context:** The primary trend is currently SLIGHT_UP (Price change: 4.11%, Volume trend: INCREASING). Recent price action shows a TREND_VALIDATION (BULLISH). \n\n**Current Candle Analysis:**\n- Candle Type: WIDE\n- Volume: HIGH\n- Signal: VALIDATION (BULLISH)\n\n**Detected Patterns:**\n- Accumulation (Strength: 3): Sideways: True, High volume count: 4, Support tests: 15\n- Distribution (Strength: 3): Sideways: True, High volume count: 4, Resistance tests: 13\n- Buying Climax (Strength: 4): Near high: True, Very high volume: True, Wide up candle: False, Upper wick: True\n- Selling Climax (Strength: 4): Near low: True, Very high volume: True, Wide down candle: False, Lower wick: True\n\n**Support/Resistance:**\n- Support Levels: 168.49, 170.28, 180.00\n- Resistance Levels: 174.38, 178.67, 191.05, 185.04, 171.92\n\n**Risk-Reward Analysis:**\n- Risk-Reward Ratio: 0.34\n- Suggested Stop Loss: 170.28\n- Suggested Take Profit: 178.67\n\n**Multi-Timeframe Context:**\n- 1h: SIDEWAYS trend, NEUTRAL signal\n\n**Confidence Score:** 54.2/100\n\n**Conclusion:** Based on the SLIGHT_UP trend, the HIGH volume on the WIDE candle, and the presence of accumulation, distribution, buying_climax, selling_climax, a BULLISH BUY signal is generated with a confidence score of 54.2/100.", "confidence_score": 54.16666666666667}}
{"input": {"timestamp": "2024-04-15 08:00", "ticker": "AAPL", "primary_timeframe": "1d", "vpa_metrics": {"volume_class": "AVERAGE", "candle_class": "WIDE", "signal_type": null, "signal_strength": null}, "trend_analysis": {"trend_direction": "SLIGHT_UP", "price_change_percent": 2.52, "volume_trend": "INCREASING", "signal_type": "TREND_VALIDATION", "signal_strength": "BULLISH"}, "pattern_analysis": {"accumulation": {"detected": true, "strength": 3, "details": "Sideways: True, High volume count: 4, Support tests: 16"}, "distribution": {"detected": true, "strength": 3, "details": "Sideways: True, High volume count: 4, Resistance tests: 13"}, "testing": {"detected": false, "strength": 1, "details": "Testing low: True, Testing high: True, Low volume: False"}, "buying_climax": {"detected": false, "strength": 1, "details": "Near high: False, Very high volume: False, Wide up candle: False, Upper wick: True"}, "selling_climax": {"detected": false, "strength": 2, "details": "Near low: True, Very high volume: False, Wide down candle: True, Lower wick: False"}}, "support_resistance": {"support_levels": [168.49, 170.285, 180.0], "resistance_levels": [174.38, 178.67, 191.05, 185.04, 171.92]}, "multi_timeframe_context": {"1h": {"trend_direction": "SIDEWAYS", "signal_strength": "NEUTRAL"}}, "risk_reward": {"risk_reward_ratio": 0, "stop_loss": 172.69, "take_profit": 172.69}, "volatility": 1.8743595917235307, "confidence_score": 53.125}, "output": {"signal": {"type": null, "strength": null}, "explanation": "VPA Analysis for AAPL on 2024-04-15 08:00 (1d):\n\n**Signal:** NEUTRAL (None)\n\n**Trend Context:** The primary trend is currently SLIGHT_UP (Price change: 2.52%, Volume trend: INCREASING). Recent price action shows a TREND_VALIDATION (BULLISH). \n\n**Current Candle Analysis:**\n- Candle Type: WIDE\n- Volume: AVERAGE\n- Signal: None (None)\n\n**Detected Patterns:**\n- Accumulation (Strength: 3): Sideways: True, High volume count: 4, Support tests: 16\n- Distribution (Strength: 3): Sideways: True, High volume count: 4, Resistance tests: 13\n\n**Support/Resistance:**\n- Support Levels: 168.49, 170.28, 180.00\n- Resistance Levels: 174.38, 178.67, 191.05, 185.04, 171.92\n\n**Risk-Reward Analysis:**\n- Risk-Reward Ratio: 0.00\n- Suggested Stop Loss: 172.69\n- Suggested Take Profit: 172.69\n\n**Multi-Timeframe Context:**\n- 1h: SIDEWAYS trend, NEUTRAL signal\n\n**Confidence Score:** 53.1/100\n\n**Conclusion:** Based on the SLIGHT_UP trend, the AVERAGE volume on the WIDE candle, and the presence of accumulation, distribution, a None NEUTRAL signal is generated with a confidence score of 53.1/100.", "confidence_score": 53.125}}
{"input": {"timestamp": "2024-04-16 08:00", "ticker": "AAPL", "primary_timeframe": "1d", "vpa_metrics": {"volume_class": "AVERAGE", "candle_class": "WIDE", "signal_type": null, "signal_strength": null}, "trend_analysis": {"trend_direction": "SIDEWAYS", "price_change_percent": -0.17, "volume_trend": "INCREASING", "signal_type": "CONSOLIDATION", "signal_strength": "NEUTRAL"}, "pattern_analysis": {"accumulation": {"detected": true, "strength": 3, "details": "Sideways: True, High volume count: 3, Support tests: 16"}, "distribution": {"detected": true, "strength": 3, "details": "Sideways: True, High volume count: 3, Resistance tests: 13"}, "testing": {"detected": false, "strength": 1, "details": "Testing low: True, Testing high: True, Low volume: False"}, "buying_climax": {"detected": false, "strength": 1, "details": "Near high: False, Very high volume: False, Wide up candle: False, Upper wick: True"}, "selling_climax": {"detected": false, "strength": 2, "details": "Near low: True, Very high volume: False, Wide down candle: False, Lower wick: True"}}, "support_resistance": {"support_levels": [168.49, 170.285, 180.0], "resistance_levels": [174.38, 178.67, 191.05, 185.04, 171.92]}, "multi_timeframe_context": {"1h": {"trend_direction": "SIDEWAYS", "signal_strength": "NEUTRAL"}}, "risk_reward": {"risk_reward_ratio": 0, "stop_loss": 169.38, "take_profit": 169.38}, "volatility": 1.9704930054502154, "confidence_score": 50.0}, "output": {"signal": {"type": null, "strength": null}, "explanation": "VPA Analysis for AAPL on 2024-04-16 08:00 (1d):\n\n**Signal:** NEUTRAL (None)\n\n**Trend Context:** The primary trend is currently SIDEWAYS (Price change: -0.17%, Volume trend: INCREASING). Recent price action shows a CONSOLIDATION (NEUTRAL). \n\n**Current Candle Analysis:**\n- Candle Type: WIDE\n- Volume: AVERAGE\n- Signal: None (None)\n\n**Detected Patterns:**\n- Accumulation (Strength: 3): Sideways: True, High volume count: 3, Support tests: 16\n- Distribution (Strength: 3): Sideways: True, High volume count: 3, Resistance tests: 13\n\n**Support/Resistance:**\n- Support Levels: 168.49, 170.28, 180.00\n- Resistance Levels: 174.38, 178.67, 191.05, 185.04, 171.92\n\n**Risk-Reward Analysis:**\n- Risk-Reward Ratio: 0.00\n- Suggested Stop Loss: 169.38\n- Suggested Take Profit: 169.38\n\n**Multi-Timeframe Context:**\n- 1h: SIDEWAYS trend, NEUTRAL signal\n\n**Confidence Score:** 50.0/100\n\n**Conclusion:** Based on the SIDEWAYS trend, the AVERAGE volume on the WIDE candle, and the presence of accumulation, distribution, a None NEUTRAL signal is generated with a confidence score of 50.0/100.", "confidence_score": 50.0}}
{"input": {"timestamp": "2024-04-17 08:00", "ticker": "AAPL", "primary_timeframe": "1d", "vpa_metrics": {"volume_class": "AVERAGE", "candle_class": "NEUTRAL", "signal_type": null, "signal_strength": null}, "trend_analysis": {"trend_direction": "SIDEWAYS", "price_change_percent": 0.13, "volume_trend": "FLAT", "signal_type": "CONSOLIDATION", "signal_strength": "NEUTRAL"}, "pattern_analysis": {"accumulation": {"detected": true, "strength": 3, "details": "Sideways: True, High volume count: 3, Support tests: 16"}, "distribution": {"detected": true, "strength": 3, "details": "Sideways: True, High volume count: 3, Resistance tests: 12"}, "testing": {"detected": false, "strength": 1, "details": "Testing low: True, Testing high: False, Low volume: False"}, "buying_climax": {"detected": false, "strength": 1, "details": "Near high: False, Very high volume: False, Wide up candle: False, Upper wick: True"}, "selling_climax": {"detected": false, "strength": 2, "details": "Near low: True, Very high volume: False, Wide down candle: True, Lower wick: False"}}, "support_resistance": {"support_levels": [168.49, 170.285, 180.0], "resistance_levels": [174.38, 178.67, 185.04, 171.92]}, "multi_timeframe_context": {"1h": {"trend_direction": "SIDEWAYS", "signal_strength": "NEUTRAL"}}, "risk_reward": {"risk_reward_ratio": 0, "stop_loss": 168.0, "take_profit": 168.0}, "volatility": 1.957543859649121, "confidence_score": 50.0}, "output": {"signal": {"type": null, "strength": null}, "explanation": "VPA Analysis for AAPL on 2024-04-17 08:00 (1d):\n\n**Signal:** NEUTRAL (None)\n\n**Trend Context:** The primary trend is currently SIDEWAYS (Price change: 0.13%, Volume trend: FLAT). Recent price action shows a CONSOLIDATION (NEUTRAL). \n\n**Current Candle Analysis:**\n- Candle Type: NEUTRAL\n- Volume: AVERAGE\n- Signal: None (None)\n\n**Detected Patterns:**\n- Accumulation (Strength: 3): Sideways: True, High volume count: 3, Support tests: 16\n- Distribution (Strength: 3): Sideways: True, High volume count: 3, Resistance tests: 12\n\n**Support/Resistance:**\n- Support Levels: 168.49, 170.28, 180.00\n- Resistance Levels: 174.38, 178.67, 185.04, 171.92\n\n**Risk-Reward Analysis:**\n- Risk-Reward Ratio: 0.00\n- Suggested Stop Loss: 168.00\n- Suggested Take Profit: 168.00\n\n**Multi-Timeframe Context:**\n- 1h: SIDEWAYS trend, NEUTRAL signal\n\n**Confidence Score:** 50.0/100\n\n**Conclusion:** Based on the SIDEWAYS trend, the AVERAGE volume on the NEUTRAL candle, and the presence of accumulation, distribution, a None NEUTRAL signal is generated with a confidence score of 50.0/100.", "confidence_score": 50.0}}
{"input": {"timestamp": "2024-04-18 08:00", "ticker": "AAPL", "primary_timeframe": "1d", "vpa_metrics": {"volume_class": "AVERAGE", "candle_class": "NEUTRAL", "signal_type": null, "signal_strength": null}, "trend_analysis": {"trend_direction": "SLIGHT_DOWN", "price_change_percent": -4.57, "volume_trend": "DECREASING", "signal_type": "TREND_ANOMALY", "signal_strength": "BULLISH"}, "pattern_analysis": {"accumulation": {"detected": true, "strength": 3, "details": "Sideways: True, High volume count: 3, Support tests: 17"}, "distribution": {"detected": true, "strength": 3, "details": "Sideways: True, High volume count: 3, Resistance tests: 12"}, "testing": {"detected": false, "strength": 1, "details": "Testing low: True, Testing high: False, Low volume: False"}, "buying_climax": {"detected": false, "strength": 1, "details": "Near high: False, Very high volume: False, Wide up candle: False, Upper wick: True"}, "selling_climax": {"detected": false, "strength": 2, "details": "Near low: True, Very high volume: False, Wide down candle: False, Lower wick: True"}}, "support_resistance": {"support_levels": [168.49, 170.285, 180.0], "resistance_levels": [174.38, 178.67, 185.04, 171.92]}, "multi_timeframe_context": {"1h": {"trend_direction": "SIDEWAYS", "signal_strength": "NEUTRAL"}}, "risk_reward": {"risk_reward_ratio": 0, "stop_loss": 167.04, "take_profit": 167.04}, "volatility": 1.7879360758217364, "confidence_score": 53.125}, "output": {"signal": {"type": null, "strength": null}, "explanation": "VPA Analysis for AAPL on 2024-04-18 08:00 (1d):\n\n**Signal:** NEUTRAL (None)\n\n**Trend Context:** The primary trend is currently SLIGHT_DOWN (Price change: -4.57%, Volume trend: DECREASING). Recent price action shows a TREND_ANOMALY (BULLISH). \n\n**Current Candle Analysis:**\n- Candle Type: NEUTRAL\n- Volume: AVERAGE\n- Signal: None (None)\n\n**Detected Patterns:**\n- Accumulation (Strength: 3): Sideways: True, High volume count: 3, Support tests: 17\n- Distribution (Strength: 3): Sideways: True, High volume count: 3, Resistance tests: 12\n\n**Support/Resistance:**\n- Support Levels: 168.49, 170.28, 180.00\n- Resistance Levels: 174.38, 178.67, 185.04, 171.92\n\n**Risk-Reward Analysis:**\n- Risk-Reward Ratio: 0.00\n- Suggested Stop Loss: 167.04\n- Suggested Take Profit: 167.04\n\n**Multi-Timeframe Context:**\n- 1h: SIDEWAYS trend, NEUTRAL signal\n\n**Confidence Score:** 53.1/100\n\n**Conclusion:** Based on the SLIGHT_DOWN trend, the AVERAGE volume on the NEUTRAL candle, and the presence of accumulation, distribution, a None NEUTRAL signal is generated with a confidence score of 53.1/100.", "confidence_score": 53.125}}
{"input": {"timestamp": "2024-04-19 08:00", "ticker": "AAPL", "primary_timeframe": "1d", "vpa_metrics": {"volume_class": "AVERAGE", "candle_class": "NEUTRAL", "signal_type": null, "signal_strength": null}, "trend_analysis": {"trend_direction": "DOWN", "price_change_percent": -6.54, "volume_trend": "DECREASING", "signal_type": "TREND_ANOMALY", "signal_strength": "BULLISH"}, "pattern_analysis": {"accumulation": {"detected": true, "strength": 2, "details": "Sideways: False, High volume count: 3, Support tests: 17"}, "distribution": {"detected": true, "strength": 2, "details": "Sideways: False, High volume count: 3, Resistance tests: 11"}, "testing": {"detected": false, "strength": 0, "details": "Testing low: False, Testing high: False, Low volume: False"}, "buying_climax": {"detected": false, "strength": 1, "details": "Near high: False, Very high volume: False, Wide up candle: False, Upper wick: True"}, "selling_climax": {"detected": false, "strength": 2, "details": "Near low: True, Very high volume: False, Wide down candle: False, Lower wick: True"}}, "support_resistance": {"support_levels": [168.49, 170.285, 180.0], "resistance_levels": [174.38, 178.67, 185.04, 171.92]}, "multi_timeframe_context": {"1h": {"trend_direction": "SIDEWAYS", "signal_strength": "NEUTRAL"}}, "risk_reward": {"risk_reward_ratio": 0, "stop_loss": 165.0, "take_profit": 165.0}, "volatility": 1.809244019138754, "confidence_score": 53.125}, "output": {"signal": {"type": null, "strength": null}, "explanation": "VPA Analysis for AAPL on 2024-04-19 08:00 (1d):\n\n**Signal:** NEUTRAL (None)\n\n**Trend Context:** The primary trend is currently DOWN (Price change: -6.54%, Volume trend: DECREASING). Recent price action shows a TREND_ANOMALY (BULLISH). \n\n**Current Candle Analysis:**\n- Candle Type: NEUTRAL\n- Volume: AVERAGE\n- Signal: None (None)\n\n**Detected Patterns:**\n- Accumulation (Strength: 2): Sideways: False, High volume count: 3, Support tests: 17\n- Distribution (Strength: 2): Sideways: False, High volume count: 3, Resistance tests: 11\n\n**Support/Resistance:**\n- Support Levels: 168.49, 170.28, 180.00\n- Resistance Levels: 174.38, 178.67, 185.04, 171.92\n\n**Risk-Reward Analysis:**\n- Risk-Reward Ratio: 0.00\n- Suggested Stop Loss: 165.00\n- Suggested Take Profit: 165.00\n\n**Multi-Timeframe Context:**\n- 1h: SIDEWAYS trend, NEUTRAL signal\n\n**Confidence Score:** 53.1/100\n\n**Conclusion:** Based on the DOWN trend, the AVERAGE volume on the NEUTRAL candle, and the presence of accumulation, distribution, a None NEUTRAL signal is generated with a confidence score of 53.1/100.", "confidence_score": 53.125}}
{"input": {"timestamp": "2024-04-22 08:00", "ticker": "AAPL", "primary_timeframe": "1d", "vpa_metrics": {"volume_class": "AVERAGE", "candle_class": "NARROW_UPPER_WICK_LOWER_WICK", "signal_type": null, "signal_strength": null}, "trend_analysis": {"trend_direction": "SLIGHT_DOWN", "price_change_percent": -3.97, "volume_trend": "DECREASING", "signal_type": "TREND_ANOMALY", "signal_strength": "BULLISH"}, "pattern_analysis": {"accumulation": {"detected": true, "strength": 2, "details": "Sideways: False, High volume count: 2, Support tests: 17"}, "distribution": {"detected": true, "strength": 2, "details": "Sideways: False, High volume count: 2, Resistance tests: 12"}, "testing": {"detected": false, "strength": 1, "details": "Testing low: True, Testing high: True, Low volume: False"}, "buying_climax": {"detected": false, "strength": 1, "details": "Near high: False, Very high volume: False, Wide up candle: False, Upper wick: True"}, "selling_climax": {"detected": false, "strength": 2, "details": "Near low: True, Very high volume: False, Wide down candle: False, Lower wick: True"}}, "support_resistance": {"support_levels": [168.49, 170.285, 180.0], "resistance_levels": [174.38, 178.67, 185.04, 171.92]}, "multi_timeframe_context": {"1h": {"trend_direction": "SIDEWAYS", "signal_strength": "NEUTRAL"}}, "risk_reward": {"risk_reward_ratio": 0, "stop_loss": 165.84, "take_profit": 165.84}, "volatility": 1.7892896133241902, "confidence_score": 53.125}, "output": {"signal": {"type": null, "strength": null}, "explanation": "VPA Analysis for AAPL on 2024-04-22 08:00 (1d):\n\n**Signal:** NEUTRAL (None)\n\n**Trend Context:** The primary trend is currently SLIGHT_DOWN (Price change: -3.97%, Volume trend: DECREASING). Recent price action shows a TREND_ANOMALY (BULLISH). \n\n**Current Candle Analysis:**\n- Candle Type: NARROW_UPPER_WICK_LOWER_WICK\n- Volume: AVERAGE\n- Signal: None (None)\n\n**Detected Patterns:**\n- Accumulation (Strength: 2): Sideways: False, High volume count: 2, Support tests: 17\n- Distribution (Strength: 2): Sideways: False, High volume count: 2, Resistance tests: 12\n\n**Support/Resistance:**\n- Support Levels: 168.49, 170.28, 180.00\n- Resistance Levels: 174.38, 178.67, 185.04, 171.92\n\n**Risk-Reward Analysis:**\n- Risk-Reward Ratio: 0.00\n- Suggested Stop Loss: 165.84\n- Suggested Take Profit: 165.84\n\n**Multi-Timeframe Context:**\n- 1h: SIDEWAYS trend, NEUTRAL signal\n\n**Confidence Score:** 53.1/100\n\n**Conclusion:** Based on the SLIGHT_DOWN trend, the AVERAGE volume on the NARROW_UPPER_WICK_LOWER_WICK candle, and the presence of accumulation, distribution, a None NEUTRAL signal is generated with a confidence score of 53.1/100.", "confidence_score": 53.125}}
{"input": {"timestamp": "2024-04-23 08:00", "ticker": "AAPL", "primary_timeframe": "1d", "vpa_metrics": {"volume_class": "AVERAGE", "candle_class": "NEUTRAL", "signal_type": null, "signal_strength": null}, "trend_analysis": {"trend_direction": "SIDEWAYS", "price_change_percent": -1.46, "volume_trend": "DECREASING", "signal_type": "CONSOLIDATION", "signal_strength": "NEUTRAL"}, "pattern_analysis": {"accumulation": {"detected": true, "strength": 2, "details": "Sideways: False, High volume count: 2, Support tests: 17"}, "distribution": {"detected": true, "strength": 2, "details": "Sideways: False, High volume count: 2, Resistance tests: 12"}, "testing": {"detected": false, "strength": 1, "details": "Testing low: True, Testing high: True, Low volume: False"}, "buying_climax": {"detected": false, "strength": 1, "details": "Near high: False, Very high volume: False, Wide up candle: True, Upper wick: False"}, "selling_climax": {"detected": false, "strength": 2, "details": "Near low: True, Very high volume: False, Wide down candle: False, Lower wick: True"}}, "support_resistance": {"support_levels": [168.49, 170.285, 180.0, 164.075], "resistance_levels": [174.38, 178.67, 185.04, 171.92]}, "multi_timeframe_context": {"1h": {"trend_direction": "SIDEWAYS", "signal_strength": "NEUTRAL"}}, "risk_reward": {"risk_reward_ratio": 0, "stop_loss": 166.9, "take_profit": 166.9}, "volatility": 1.787070732553371, "confidence_score": 50.0}, "output": {"signal": {"type": null, "strength": null}, "explanation": "VPA Analysis for AAPL on 2024-04-23 08:00 (1d):\n\n**Signal:** NEUTRAL (None)\n\n**Trend Context:** The primary trend is currently SIDEWAYS (Price change: -1.46%, Volume trend: DECREASING). Recent price action shows a CONSOLIDATION (NEUTRAL). \n\n**Current Candle Analysis:**\n- Candle Type: NEUTRAL\n- Volume: AVERAGE\n- Signal: None (None)\n\n**Detected Patterns:**\n- Accumulation (Strength: 2): Sideways: False, High volume count: 2, Support tests: 17\n- Distribution (Strength: 2): Sideways: False, High volume count: 2, Resistance tests: 12\n\n**Support/Resistance:**\n- Support Levels: 168.49, 170.28, 180.00, 164.07\n- Resistance Levels: 174.38, 178.67, 185.04, 171.92\n\n**Risk-Reward Analysis:**\n- Risk-Reward Ratio: 0.00\n- Suggested Stop Loss: 166.90\n- Suggested Take Profit: 166.90\n\n**Multi-Timeframe Context:**\n- 1h: SIDEWAYS trend, NEUTRAL signal\n\n**Confidence Score:** 50.0/100\n\n**Conclusion:** Based on the SIDEWAYS trend, the AVERAGE volume on the NEUTRAL candle, and the presence of accumulation, distribution, a None NEUTRAL signal is generated with a confidence score of 50.0/100.", "confidence_score": 50.0}}
{"input": {"timestamp": "2024-04-24 08:00", "ticker": "AAPL", "primary_timeframe": "1d", "vpa_metrics": {"volume_class": "AVERAGE", "candle_class": "WIDE", "signal_type": null, "signal_strength": null}, "trend_analysis": {"trend_direction": "SIDEWAYS", "price_change_percent": 0.61, "volume_trend": "FLAT", "signal_type": "CONSOLIDATION", "signal_strength": "NEUTRAL"}, "pattern_analysis": {"accumulation": {"detected": true, "strength": 2, "details": "Sideways: False, High volume count: 2, Support tests: 17"}, "distribution": {"detected": true, "strength": 2, "details": "Sideways: False, High volume count: 2, Resistance tests: 11"}, "testing": {"detected": false, "strength": 1, "details": "Testing low: True, Testing high: True, Low volume: False"}, "buying_climax": {"detected": false, "strength": 1, "details": "Near high: False, Very high volume: False, Wide up candle: True, Upper wick: False"}, "selling_climax": {"detected": false, "strength": 2, "details": "Near low: True, Very high volume: False, Wide down candle: False, Lower wick: True"}}, "support_resistance": {"support_levels": [168.49, 170.285, 180.0, 164.075], "resistance_levels": [174.38, 178.67, 185.04, 171.92]}, "multi_timeframe_context": {"1h": {"trend_direction": "SIDEWAYS", "signal_strength": "NEUTRAL"}}, "risk_reward": {"risk_reward_ratio": 0, "stop_loss": 169.02, "take_profit": 169.02}, "volatility": 1.739744284388642, "confidence_score": 50.0}, "output": {"signal": {"type": null, "strength": null}, "explanation": "VPA Analysis for AAPL on 2024-04-24 08:00 (1d):\n\n**Signal:** NEUTRAL (None)\n\n**Trend Context:** The primary trend is currently SIDEWAYS (Price change: 0.61%, Volume trend: FLAT). Recent price action shows a CONSOLIDATION (NEUTRAL). \n\n**Current Candle Analysis:**\n- Candle Type: WIDE\n- Volume: AVERAGE\n- Signal: None (None)\n\n**Detected Patterns:**\n- Accumulation (Strength: 2): Sideways: False, High volume count: 2, Support tests: 17\n- Distribution (Strength: 2): Sideways: False, High volume count: 2, Resistance tests: 11\n\n**Support/Resistance:**\n- Support Levels: 168.49, 170.28, 180.00, 164.07\n- Resistance Levels: 174.38, 178.67, 185.04, 171.92\n\n**Risk-Reward Analysis:**\n- Risk-Reward Ratio: 0.00\n- Suggested Stop Loss: 169.02\n- Suggested Take Profit: 169.02\n\n**Multi-Timeframe Context:**\n- 1h: SIDEWAYS trend, NEUTRAL signal\n\n**Confidence Score:** 50.0/100\n\n**Conclusion:** Based on the SIDEWAYS trend, the AVERAGE volume on the WIDE candle, and the presence of accumulation, distribution, a None NEUTRAL signal is generated with a confidence score of 50.0/100.", "confidence_score": 50.0}}
{"input": {"timestamp": "2024-04-25 08:00", "ticker": "AAPL", "primary_timeframe": "1d", "vpa_metrics": {"volume_class": "AVERAGE", "candle_class": "NARROW_UPPER_WICK_LOWER_WICK", "signal_type": null, "signal_strength": null}, "trend_analysis": {"trend_direction": "SIDEWAYS", "price_change_percent": 1.71, "volume_trend": "INCREASING", "signal_type": "CONSOLIDATION", "signal_strength": "NEUTRAL"}, "pattern_analysis": {"accumulation": {"detected": true, "strength": 2, "details": "Sideways: False, High volume count: 2, Support tests: 16"}, "distribution": {"detected": true, "strength": 2, "details": "Sideways: False, High volume count: 2, Resistance tests: 12"}, "testing": {"detected": false, "strength": 1, "details": "Testing low: False, Testing high: True, Low volume: False"}, "buying_climax": {"detected": false, "strength": 1, "details": "Near high: False, Very high volume: False, Wide up candle: False, Upper wick: True"}, "selling_climax": {"detected": false, "strength": 2, "details": "Near low: True, Very high volume: False, Wide down candle: False, Lower wick: True"}}, "support_resistance": {"support_levels": [168.49, 170.285, 180.0, 164.075], "resistance_levels": [174.38, 178.67, 185.04, 171.92]}, "multi_timeframe_context": {"1h": {"trend_direction": "SIDEWAYS", "signal_strength": "NEUTRAL"}}, "risk_reward": {"risk_reward_ratio": 0, "stop_loss": 169.89, "take_profit": 169.89}, "volatility": 1.72026791329374, "confidence_score": 50.0}, "output": {"signal": {"type": null, "strength": null}, "explanation": "VPA Analysis for AAPL on 2024-04-25 08:00 (1d):\n\n**Signal:** NEUTRAL (None)\n\n**Trend Context:** The primary trend is currently SIDEWAYS (Price change: 1.71%, Volume trend: INCREASING). Recent price action shows a CONSOLIDATION (NEUTRAL). \n\n**Current Candle Analysis:**\n- Candle Type: NARROW_UPPER_WICK_LOWER_WICK\n- Volume: AVERAGE\n- Signal: None (None)\n\n**Detected Patterns:**\n- Accumulation (Strength: 2): Sideways: False, High volume count: 2, Support tests: 16\n- Distribution (Strength: 2): Sideways: False, High volume count: 2, Resistance tests: 12\n\n**Support/Resistance:**\n- Support Levels: 168.49, 170.28, 180.00, 164.07\n- Resistance Levels: 174.38, 178.67, 185.04, 171.92\n\n**Risk-Reward Analysis:**\n- Risk-Reward Ratio: 0.00\n- Suggested Stop Loss: 169.89\n- Suggested Take Profit: 169.89\n\n**Multi-Timeframe Context:**\n- 1h: SIDEWAYS trend, NEUTRAL signal\n\n**Confidence Score:** 50.0/100\n\n**Conclusion:** Based on the SIDEWAYS trend, the AVERAGE volume on the NARROW_UPPER_WICK_LOWER_WICK candle, and the presence of accumulation, distribution, a None NEUTRAL signal is generated with a confidence score of 50.0/100.", "confidence_score": 50.0}}
{"input": {"timestamp": "2024-04-26 08:00", "ticker": "AAPL", "primary_timeframe": "1d", "vpa_metrics": {"volume_class": "AVERAGE", "candle_class": "NARROW_UPPER_WICK", "signal_type": null, "signal_strength": null}, "trend_analysis": {"trend_direction": "SLIGHT_UP", "price_change_percent": 2.61, "volume_trend": "DECREASING", "signal_type": "TREND_ANOMALY", "signal_strength": "BEARISH"}, "pattern_analysis": {"accumulation": {"detected": true, "strength": 2, "details": "Sideways: False, High volume count: 2, Support tests: 16"}, "distribution": {"detected": true, "strength": 2, "details": "Sideways: False, High volume count: 2, Resistance tests: 12"}, "testing": {"detected": false, "strength": 1, "details": "Testing low: True, Testing high: True, Low volume: False"}, "buying_climax": {"detected": false, "strength": 1, "details": "Near high: False, Very high volume: False, Wide up candle: False, Upper wick: True"}, "selling_climax": {"detected": false, "strength": 1, "details": "Near low: True, Very high volume: False, Wide down candle: False, Lower wick: False"}}, "support_resistance": {"support_levels": [168.49, 170.285, 180.0, 164.075], "resistance_levels": [174.38, 178.67, 171.92, 185.04]}, "multi_timeframe_context": {"1h": {"trend_direction": "SIDEWAYS", "signal_strength": "NEUTRAL"}}, "risk_reward": {"risk_reward_ratio": 0, "stop_loss": 169.3, "take_profit": 169.3}, "volatility": 1.7310815431964424, "confidence_score": 46.875}, "output": {"signal": {"type": null, "strength": null}, "explanation": "VPA Analysis for AAPL on 2024-04-26 08:00 (1d):\n\n**Signal:** NEUTRAL (None)\n\n**Trend Context:** The primary trend is currently SLIGHT_UP (Price change: 2.61%, Volume trend: DECREASING). Recent price action shows a TREND_ANOMALY (BEARISH). \n\n**Current Candle Analysis:**\n- Candle Type: NARROW_UPPER_WICK\n- Volume: AVERAGE\n- Signal: None (None)\n\n**Detected Patterns:**\n- Accumulation (Strength: 2): Sideways: False, High volume count: 2, Support tests: 16\n- Distribution (Strength: 2): Sideways: False, High volume count: 2, Resistance tests: 12\n\n**Support/Resistance:**\n- Support Levels: 168.49, 170.28, 180.00, 164.07\n- Resistance Levels: 174.38, 178.67, 171.92, 185.04\n\n**Risk-Reward Analysis:**\n- Risk-Reward Ratio: 0.00\n- Suggested Stop Loss: 169.30\n- Suggested Take Profit: 169.30\n\n**Multi-Timeframe Context:**\n- 1h: SIDEWAYS trend, NEUTRAL signal\n\n**Confidence Score:** 46.9/100\n\n**Conclusion:** Based on the SLIGHT_UP trend, the AVERAGE volume on the NARROW_UPPER_WICK candle, and the presence of accumulation, distribution, a None NEUTRAL signal is generated with a confidence score of 46.9/100.", "confidence_score": 46.875}}
{"input": {"timestamp": "2024-04-29 08:00", "ticker": "AAPL", "primary_timeframe": "1d", "vpa_metrics": {"volume_class": "AVERAGE", "candle_class": "NARROW_UPPER_WICK_LOWER_WICK", "signal_type": null, "signal_strength": null}, "trend_analysis": {"trend_direction": "SLIGHT_UP", "price_change_percent": 4.62, "volume_trend": "INCREASING", "signal_type": "TREND_VALIDATION", "signal_strength": "BULLISH"}, "pattern_analysis": {"accumulation": {"detected": true, "strength": 2, "details": "Sideways: False, High volume count: 2, Support tests: 15"}, "distribution": {"detected": true, "strength": 2, "details": "Sideways: False, High volume count: 2, Resistance tests: 11"}, "testing": {"detected": false, "strength": 0, "details": "Testing low: False, Testing high: False, Low volume: False"}, "buying_climax": {"detected": false, "strength": 2, "details": "Near high: True, Very high volume: False, Wide up candle: False, Upper wick: True"}, "selling_climax": {"detected": false, "strength": 2, "details": "Near low: True, Very high volume: False, Wide down candle: False, Lower wick: True"}}, "support_resistance": {"support_levels": [168.49, 170.285, 164.075], "resistance_levels": [174.38, 178.67, 171.92, 185.04]}, "multi_timeframe_context": {"1h": {"trend_direction": "SIDEWAYS", "signal_strength": "NEUTRAL"}}, "risk_reward": {"risk_reward_ratio": 0, "stop_loss": 173.5, "take_profit": 173.5}, "volatility": 1.838735021993021, "confidence_score": 53.125}, "output": {"signal": {"type": null, "strength": null}, "explanation": "VPA Analysis for AAPL on 2024-04-29 08:00 (1d):\n\n**Signal:** NEUTRAL (None)\n\n**Trend Context:** The primary trend is currently SLIGHT_UP (Price change: 4.62%, Volume trend: INCREASING). Recent price action shows a TREND_VALIDATION (BULLISH). \n\n**Current Candle Analysis:**\n- Candle Type: NARROW_UPPER_WICK_LOWER_WICK\n- Volume: AVERAGE\n- Signal: None (None)\n\n**Detected Patterns:**\n- Accumulation (Strength: 2): Sideways: False, High volume count: 2, Support tests: 15\n- Distribution (Strength: 2): Sideways: False, High volume count: 2, Resistance tests: 11\n\n**Support/Resistance:**\n- Support Levels: 168.49, 170.28, 164.07\n- Resistance Levels: 174.38, 178.67, 171.92, 185.04\n\n**Risk-Reward Analysis:**\n- Risk-Reward Ratio: 0.00\n- Suggested Stop Loss: 173.50\n- Suggested Take Profit: 173.50\n\n**Multi-Timeframe Context:**\n- 1h: SIDEWAYS trend, NEUTRAL signal\n\n**Confidence Score:** 53.1/100\n\n**Conclusion:** Based on the SLIGHT_UP trend, the AVERAGE volume on the NARROW_UPPER_WICK_LOWER_WICK candle, and the presence of accumulation, distribution, a None NEUTRAL signal is generated with a confidence score of 53.1/100.", "confidence_score": 53.125}}
{"input": {"timestamp": "2024-04-30 08:00", "ticker": "AAPL", "primary_timeframe": "1d", "vpa_metrics": {"volume_class": "AVERAGE", "candle_class": "WIDE", "signal_type": null, "signal_strength": null}, "trend_analysis": {"trend_direction": "SLIGHT_UP", "price_change_percent": 2.06, "volume_trend": "INCREASING", "signal_type": "TREND_VALIDATION", "signal_strength": "BULLISH"}, "pattern_analysis": {"accumulation": {"detected": true, "strength": 2, "details": "Sideways: False, High volume count: 2, Support tests: 14"}, "distribution": {"detected": true, "strength": 2, "details": "Sideways: False, High volume count: 2, Resistance tests: 12"}, "testing": {"detected": false, "strength": 1, "details": "Testing low: True, Testing high: True, Low volume: False"}, "buying_climax": {"detected": false, "strength": 1, "details": "Near high: False, Very high volume: False, Wide up candle: False, Upper wick: True"}, "selling_climax": {"detected": false, "strength": 2, "details": "Near low: True, Very high volume: False, Wide down candle: True, Lower wick: False"}}, "support_resistance": {"support_levels": [168.49, 170.285, 164.075], "resistance_levels": [174.38, 178.67, 171.92, 185.04]}, "multi_timeframe_context": {"1h": {"trend_direction": "SIDEWAYS", "signal_strength": "NEUTRAL"}}, "risk_reward": {"risk_reward_ratio": 0, "stop_loss": 170.33, "take_profit": 170.33}, "volatility": 1.9622559304384355, "confidence_score": 53.125}, "output": {"signal": {"type": null, "strength": null}, "explanation": "VPA Analysis for AAPL on 2024-04-30 08:00 (1d):\n\n**Signal:** NEUTRAL (None)\n\n**Trend Context:** The primary trend is currently SLIGHT_UP (Price change: 2.06%, Volume trend: INCREASING). Recent price action shows a TREND_VALIDATION (BULLISH). \n\n**Current Candle Analysis:**\n- Candle Type: WIDE\n- Volume: AVERAGE\n- Signal: None (None)\n\n**Detected Patterns:**\n- Accumulation (Strength: 2): Sideways: False, High volume count: 2, Support tests: 14\n- Distribution (Strength: 2): Sideways: False, High volume count: 2, Resistance tests: 12\n\n**Support/Resistance:**\n- Support Levels: 168.49, 170.28, 164.07\n- Resistance Levels: 174.38, 178.67, 171.92, 185.04\n\n**Risk-Reward Analysis:**\n- Risk-Reward Ratio: 0.00\n- Suggested Stop Loss: 170.33\n- Suggested Take Profit: 170.33\n\n**Multi-Timeframe Context:**\n- 1h: SIDEWAYS trend, NEUTRAL signal\n\n**Confidence Score:** 53.1/100\n\n**Conclusion:** Based on the SLIGHT_UP trend, the AVERAGE volume on the WIDE candle, and the presence of accumulation, distribution, a None NEUTRAL signal is generated with a confidence score of 53.1/100.", "confidence_score": 53.125}}
{"input": {"timestamp": "2024-05-01 08:00", "ticker": "AAPL", "primary_timeframe": "1d", "vpa_metrics": {"volume_class": "AVERAGE", "candle_class": "NARROW_UPPER_WICK", "signal_type": null, "signal_strength": null}, "trend_analysis": {"trend_direction": "SIDEWAYS", "price_change_percent": 0.17, "volume_trend": "FLAT", "signal_type": "CONSOLIDATION", "signal_strength": "NEUTRAL"}, "pattern_analysis": {"accumulation": {"detected": true, "strength": 2, "details": "Sideways: False, High volume count: 2, Support tests: 14"}, "distribution": {"detected": true, "strength": 2, "details": "Sideways: False, High volume count: 2, Resistance tests: 11"}, "testing": {"detected": false, "strength": 1, "details": "Testing low: True, Testing high: True, Low volume: False"}, "buying_climax": {"detected": false, "strength": 1, "details": "Near high: False, Very high volume: False, Wide up candle: False, Upper wick: True"}, "selling_climax": {"detected": false, "strength": 2, "details": "Near low: True, Very high volume: False, Wide down candle: False, Lower wick: True"}}, "support_resistance": {"support_levels": [168.49, 170.285, 164.075], "resistance_levels": [174.38, 171.92, 178.67, 185.04]}, "multi_timeframe_context": {"1h": {"trend_direction": "SIDEWAYS", "signal_strength": "NEUTRAL"}}, "risk_reward": {"risk_reward_ratio": 0, "stop_loss": 169.3, "take_profit": 169.3}, "volatility": 1.989582491373145, "confidence_score": 50.0}, "output": {"signal": {"type": null, "strength": null}, "explanation": "VPA Analysis for AAPL on 2024-05-01 08:00 (1d):\n\n**Signal:** NEUTRAL (None)\n\n**Trend Context:** The primary trend is currently SIDEWAYS (Price change: 0.17%, Volume trend: FLAT). Recent price action shows a CONSOLIDATION (NEUTRAL). \n\n**Current Candle Analysis:**\n- Candle Type: NARROW_UPPER_WICK\n- Volume: AVERAGE\n- Signal: None (None)\n\n**Detected Patterns:**\n- Accumulation (Strength: 2): Sideways: False, High volume count: 2, Support tests: 14\n- Distribution (Strength: 2): Sideways: False, High volume count: 2, Resistance tests: 11\n\n**Support/Resistance:**\n- Support Levels: 168.49, 170.28, 164.07\n- Resistance Levels: 174.38, 171.92, 178.67, 185.04\n\n**Risk-Reward Analysis:**\n- Risk-Reward Ratio: 0.00\n- Suggested Stop Loss: 169.30\n- Suggested Take Profit: 169.30\n\n**Multi-Timeframe Context:**\n- 1h: SIDEWAYS trend, NEUTRAL signal\n\n**Confidence Score:** 50.0/100\n\n**Conclusion:** Based on the SIDEWAYS trend, the AVERAGE volume on the NARROW_UPPER_WICK candle, and the presence of accumulation, distribution, a None NEUTRAL signal is generated with a confidence score of 50.0/100.", "confidence_score": 50.0}}
{"input": {"timestamp": "2024-05-02 08:00", "ticker": "AAPL", "primary_timeframe": "1d", "vpa_metrics": {"volume_class": "HIGH", "candle_class": "NARROW_LOWER_WICK", "signal_type": "ANOMALY", "signal_strength": "BULLISH"}, "trend_analysis": {"trend_direction": "SIDEWAYS", "price_change_percent": 1.85, "volume_trend": "INCREASING", "signal_type": "CONSOLIDATION", "signal_strength": "NEUTRAL"}, "pattern_analysis": {"accumulation": {"detected": true, "strength": 2, "details": "Sideways: False, High volume count: 3, Support tests: 13"}, "distribution": {"detected": true, "strength": 2, "details": "Sideways: False, High volume count: 3, Resistance tests: 11"}, "testing": {"detected": false, "strength": 1, "details": "Testing low: True, Testing high: True, Low volume: False"}, "buying_climax": {"detected": true, "strength": 4, "details": "Near high: True, Very high volume: True, Wide up candle: False, Upper wick: True"}, "selling_climax": {"detected": true, "strength": 4, "details": "Near low: True, Very high volume: True, Wide down candle: False, Lower wick: True"}}, "support_resistance": {"support_levels": [168.49, 170.285, 164.075], "resistance_levels": [174.38, 171.92, 178.67]}, "multi_timeframe_context": {"1h": {"trend_direction": "SIDEWAYS", "signal_strength": "NEUTRAL"}}, "risk_reward": {"risk_reward_ratio": 0.4918032786885217, "stop_loss": 170.285, "take_profit": 174.38}, "volatility": 2.0241059505957275, "confidence_score": 52.08333333333334}, "output": {"signal": {"type": "ANOMALY", "strength": "BULLISH"}, "explanation": "VPA Analysis for AAPL on 2024-05-02 08:00 (1d):\n\n**Signal:** POTENTIAL_BUY (BULLISH)\n\n**Trend Context:** The primary trend is currently SIDEWAYS (Price change: 1.85%, Volume trend: INCREASING). Recent price action shows a CONSOLIDATION (NEUTRAL). \n\n**Current Candle Analysis:**\n- Candle Type: NARROW_LOWER_WICK\n- Volume: HIGH\n- Signal: ANOMALY (BULLISH)\n\n**Detected Patterns:**\n- Accumulation (Strength: 2): Sideways: False, High volume count: 3, Support tests: 13\n- Distribution (Strength: 2): Sideways: False, High volume count: 3, Resistance tests: 11\n- Buying Climax (Strength: 4): Near high: True, Very high volume: True, Wide up candle: False, Upper wick: True\n- Selling Climax (Strength: 4): Near low: True, Very high volume: True, Wide down candle: False, Lower wick: True\n\n**Support/Resistance:**\n- Support Levels: 168.49, 170.28, 164.07\n- Resistance Levels: 174.38, 171.92, 178.67\n\n**Risk-Reward Analysis:**\n- Risk-Reward Ratio: 0.49\n- Suggested Stop Loss: 170.28\n- Suggested Take Profit: 174.38\n\n**Multi-Timeframe Context:**\n- 1h: SIDEWAYS trend, NEUTRAL signal\n\n**Confidence Score:** 52.1/100\n\n**Conclusion:** Based on the SIDEWAYS trend, the HIGH volume on the NARROW_LOWER_WICK candle, and the presence of accumulation, distribution, buying_climax, selling_climax, a BULLISH POTENTIAL_BUY signal is generated with a confidence score of 52.1/100.", "confidence_score": 52.08333333333334}}
{"input": {"timestamp": "2024-05-03 08:00", "ticker": "AAPL", "primary_timeframe": "1d", "vpa_metrics": {"volume_class": "VERY_HIGH", "candle_class": "WIDE", "signal_type": "VALIDATION", "signal_strength": "BEARISH"}, "trend_analysis": {"trend_direction": "UP", "price_change_percent": 8.32, "volume_trend": "INCREASING", "signal_type": "TREND_VALIDATION", "signal_strength": "BULLISH"}, "pattern_analysis": {"accumulation": {"detected": true, "strength": 2, "details": "Sideways: False, High volume count: 4, Support tests: 12"}, "distribution": {"detected": true, "strength": 2, "details": "Sideways: False, High volume count: 4, Resistance tests: 10"}, "testing": {"detected": false, "strength": 0, "details": "Testing low: False, Testing high: False, Low volume: False"}, "buying_climax": {"detected": true, "strength": 4, "details": "Near high: True, Very high volume: True, Wide up candle: False, Upper wick: True"}, "selling_climax": {"detected": true, "strength": 3, "details": "Near low: False, Very high volume: True, Wide down candle: True, Lower wick: False"}}, "support_resistance": {"support_levels": [168.49, 170.285, 164.075], "resistance_levels": [174.38, 171.92, 178.67]}, "multi_timeframe_context": {"1h": {"trend_direction": "SIDEWAYS", "signal_strength": "NEUTRAL"}}, "risk_reward": {"risk_reward_ratio": 1.4281819173301322, "stop_loss": 192.549, "take_profit": 170.285}, "volatility": 2.272356510208883, "confidence_score": 50.0}, "output": {"signal": {"type": "VALIDATION", "strength": "BEARISH"}, "explanation": "VPA Analysis for AAPL on 2024-05-03 08:00 (1d):\n\n**Signal:** SELL (BEARISH)\n\n**Trend Context:** The primary trend is currently UP (Price change: 8.32%, Volume trend: INCREASING). Recent price action shows a TREND_VALIDATION (BULLISH). \n\n**Current Candle Analysis:**\n- Candle Type: WIDE\n- Volume: VERY_HIGH\n- Signal: VALIDATION (BEARISH)\n\n**Detected Patterns:**\n- Accumulation (Strength: 2): Sideways: False, High volume count: 4, Support tests: 12\n- Distribution (Strength: 2): Sideways: False, High volume count: 4, Resistance tests: 10\n- Buying Climax (Strength: 4): Near high: True, Very high volume: True, Wide up candle: False, Upper wick: True\n- Selling Climax (Strength: 3): Near low: False, Very high volume: True, Wide down candle: True, Lower wick: False\n\n**Support/Resistance:**\n- Support Levels: 168.49, 170.28, 164.07\n- Resistance Levels: 174.38, 171.92, 178.67\n\n**Risk-Reward Analysis:**\n- Risk-Reward Ratio: 1.43\n- Suggested Stop Loss: 192.55\n- Suggested Take Profit: 170.28\n\n**Multi-Timeframe Context:**\n- 1h: SIDEWAYS trend, NEUTRAL signal\n\n**Confidence Score:** 50.0/100\n\n**Conclusion:** Based on the UP trend, the VERY_HIGH volume on the WIDE candle, and the presence of accumulation, distribution, buying_climax, selling_climax, a BEARISH SELL signal is generated with a confidence score of 50.0/100.", "confidence_score": 50.0}}
{"input": {"timestamp": "2024-05-06 08:00", "ticker": "AAPL", "primary_timeframe": "1d", "vpa_metrics": {"volume_class": "AVERAGE", "candle_class": "NARROW_UPPER_WICK_LOWER_WICK", "signal_type": null, "signal_strength": null}, "trend_analysis": {"trend_direction": "SLIGHT_UP", "price_change_percent": 4.73, "volume_trend": "INCREASING", "signal_type": "TREND_VALIDATION", "signal_strength": "BULLISH"}, "pattern_analysis": {"accumulation": {"detected": true, "strength": 2, "details": "Sideways: False, High volume count: 4, Support tests: 11"}, "distribution": {"detected": true, "strength": 2, "details": "Sideways: False, High volume count: 4, Resistance tests: 9"}, "testing": {"detected": false, "strength": 0, "details": "Testing low: False, Testing high: False, Low volume: False"}, "buying_climax": {"detected": false, "strength": 2, "details": "Near high: True, Very high volume: False, Wide up candle: False, Upper wick: True"}, "selling_climax": {"detected": false, "strength": 1, "details": "Near low: False, Very high volume: False, Wide down candle: False, Lower wick: True"}}, "support_resistance": {"support_levels": [168.49, 170.285, 164.075], "resistance_levels": [174.38, 171.92, 178.67]}, "multi_timeframe_context": {"1h": {"trend_direction": "SIDEWAYS", "signal_strength": "NEUTRAL"}}, "risk_reward": {"risk_reward_ratio": 0, "stop_loss": 181.71, "take_profit": 181.71}, "volatility": 2.3526179655842574, "confidence_score": 53.125}, "output": {"signal": {"type": null, "strength": null}, "explanation": "VPA Analysis for AAPL on 2024-05-06 08:00 (1d):\n\n**Signal:** NEUTRAL (None)\n\n**Trend Context:** The primary trend is currently SLIGHT_UP (Price change: 4.73%, Volume trend: INCREASING). Recent price action shows a TREND_VALIDATION (BULLISH). \n\n**Current Candle Analysis:**\n- Candle Type: NARROW_UPPER_WICK_LOWER_WICK\n- Volume: AVERAGE\n- Signal: None (None)\n\n**Detected Patterns:**\n- Accumulation (Strength: 2): Sideways: False, High volume count: 4, Support tests: 11\n- Distribution (Strength: 2): Sideways: False, High volume count: 4, Resistance tests: 9\n\n**Support/Resistance:**\n- Support Levels: 168.49, 170.28, 164.07\n- Resistance Levels: 174.38, 171.92, 178.67\n\n**Risk-Reward Analysis:**\n- Risk-Reward Ratio: 0.00\n- Suggested Stop Loss: 181.71\n- Suggested Take Profit: 181.71\n\n**Multi-Timeframe Context:**\n- 1h: SIDEWAYS trend, NEUTRAL signal\n\n**Confidence Score:** 53.1/100\n\n**Conclusion:** Based on the SLIGHT_UP trend, the AVERAGE volume on the NARROW_UPPER_WICK_LOWER_WICK candle, and the presence of accumulation, distribution, a None NEUTRAL signal is generated with a confidence score of 53.1/100.", "confidence_score": 53.125}}
{"input": {"timestamp": "2024-05-07 08:00", "ticker": "AAPL", "primary_timeframe": "1d", "vpa_metrics": {"volume_class": "AVERAGE", "candle_class": "NEUTRAL", "signal_type": null, "signal_strength": null}, "trend_analysis": {"trend_direction": "UP", "price_change_percent": 7.09, "volume_trend": "INCREASING", "signal_type": "TREND_VALIDATION", "signal_strength": "BULLISH"}, "pattern_analysis": {"accumulation": {"detected": true, "strength": 2, "details": "Sideways: False, High volume count: 4, Support tests: 11"}, "distribution": {"detected": true, "strength": 2, "details": "Sideways: False, High volume count: 4, Resistance tests: 9"}, "testing": {"detected": false, "strength": 1, "details": "Testing low: True, Testing high: True, Low volume: False"}, "buying_climax": {"detected": false, "strength": 2, "details": "Near high: True, Very high volume: False, Wide up candle: False, Upper wick: True"}, "selling_climax": {"detected": false, "strength": 1, "details": "Near low: False, Very high volume: False, Wide down candle: False, Lower wick: True"}}, "support_resistance": {"support_levels": [168.49, 170.285, 164.075], "resistance_levels": [174.38, 171.92, 178.67, 187.0]}, "multi_timeframe_context": {"1h": {"trend_direction": "SIDEWAYS", "signal_strength": "NEUTRAL"}}, "risk_reward": {"risk_reward_ratio": 0, "stop_loss": 182.4, "take_profit": 182.4}, "volatility": 2.373150392428438, "confidence_score": 53.125}, "output": {"signal": {"type": null, "strength": null}, "explanation": "VPA Analysis for AAPL on 2024-05-07 08:00 (1d):\n\n**Signal:** NEUTRAL (None)\n\n**Trend Context:** The primary trend is currently UP (Price change: 7.09%, Volume trend: INCREASING). Recent price action shows a TREND_VALIDATION (BULLISH). \n\n**Current Candle Analysis:**\n- Candle Type: NEUTRAL\n- Volume: AVERAGE\n- Signal: None (None)\n\n**Detected Patterns:**\n- Accumulation (Strength: 2): Sideways: False, High volume count: 4, Support tests: 11\n- Distribution (Strength: 2): Sideways: False, High volume count: 4, Resistance tests: 9\n\n**Support/Resistance:**\n- Support Levels: 168.49, 170.28, 164.07\n- Resistance Levels: 174.38, 171.92, 178.67, 187.00\n\n**Risk-Reward Analysis:**\n- Risk-Reward Ratio: 0.00\n- Suggested Stop Loss: 182.40\n- Suggested Take Profit: 182.40\n\n**Multi-Timeframe Context:**\n- 1h: SIDEWAYS trend, NEUTRAL signal\n\n**Confidence Score:** 53.1/100\n\n**Conclusion:** Based on the UP trend, the AVERAGE volume on the NEUTRAL candle, and the presence of accumulation, distribution, a None NEUTRAL signal is generated with a confidence score of 53.1/100.", "confidence_score": 53.125}}
{"input": {"timestamp": "2024-05-08 08:00", "ticker": "AAPL", "primary_timeframe": "1d", "vpa_metrics": {"volume_class": "AVERAGE", "candle_class": "NARROW_UPPER_WICK_LOWER_WICK", "signal_type": null, "signal_strength": null}, "trend_analysis": {"trend_direction": "UP", "price_change_percent": 7.94, "volume_trend": "FLAT", "signal_type": null, "signal_strength": null}, "pattern_analysis": {"accumulation": {"detected": true, "strength": 2, "details": "Sideways: False, High volume count: 4, Support tests: 11"}, "distribution": {"detected": true, "strength": 2, "details": "Sideways: False, High volume count: 4, Resistance tests: 9"}, "testing": {"detected": false, "strength": 1, "details": "Testing low: True, Testing high: True, Low volume: False"}, "buying_climax": {"detected": false, "strength": 2, "details": "Near high: True, Very high volume: False, Wide up candle: False, Upper wick: True"}, "selling_climax": {"detected": false, "strength": 1, "details": "Near low: False, Very high volume: False, Wide down candle: False, Lower wick: True"}}, "support_resistance": {"support_levels": [168.49, 170.285, 164.075], "resistance_levels": [174.38, 171.92, 178.67, 187.0]}, "multi_timeframe_context": {"1h": {"trend_direction": "SIDEWAYS", "signal_strength": "NEUTRAL"}}, "risk_reward": {"risk_reward_ratio": 0, "stop_loss": 182.74, "take_profit": 182.74}, "volatility": 2.1941988329694753, "confidence_score": 50.0}, "output": {"signal": {"type": null, "strength": null}, "explanation": "VPA Analysis for AAPL on 2024-05-08 08:00 (1d):\n\n**Signal:** NEUTRAL (None)\n\n**Trend Context:** The primary trend is currently UP (Price change: 7.94%, Volume trend: FLAT). Recent price action shows a None (None). \n\n**Current Candle Analysis:**\n- Candle Type: NARROW_UPPER_WICK_LOWER_WICK\n- Volume: AVERAGE\n- Signal: None (None)\n\n**Detected Patterns:**\n- Accumulation (Strength: 2): Sideways: False, High volume count: 4, Support tests: 11\n- Distribution (Strength: 2): Sideways: False, High volume count: 4, Resistance tests: 9\n\n**Support/Resistance:**\n- Support Levels: 168.49, 170.28, 164.07\n- Resistance Levels: 174.38, 171.92, 178.67, 187.00\n\n**Risk-Reward Analysis:**\n- Risk-Reward Ratio: 0.00\n- Suggested Stop Loss: 182.74\n- Suggested Take Profit: 182.74\n\n**Multi-Timeframe Context:**\n- 1h: SIDEWAYS trend, NEUTRAL signal\n\n**Confidence Score:** 50.0/100\n\n**Conclusion:** Based on the UP trend, the AVERAGE volume on the NARROW_UPPER_WICK_LOWER_WICK candle, and the presence of accumulation, distribution, a None NEUTRAL signal is generated with a confidence score of 50.0/100.", "confidence_score": 50.0}}
{"input": {"timestamp": "2024-05-09 08:00", "ticker": "AAPL", "primary_timeframe": "1d", "vpa_metrics": {"volume_class": "AVERAGE", "candle_class": "WIDE", "signal_type": null, "signal_strength": null}, "trend_analysis": {"trend_direction": "UP", "price_change_percent": 6.67, "volume_trend": "DECREASING", "signal_type": "TREND_ANOMALY", "signal_strength": "BEARISH"}, "pattern_analysis": {"accumulation": {"detected": true, "strength": 2, "details": "Sideways: False, High volume count: 4, Support tests: 11"}, "distribution": {"detected": true, "strength": 2, "details": "Sideways: False, High volume count: 4, Resistance tests: 10"}, "testing": {"detected": false, "strength": 1, "details": "Testing low: True, Testing high: True, Low volume: False"}, "buying_climax": {"detected": false, "strength": 2, "details": "Near high: True, Very high volume: False, Wide up candle: True, Upper wick: False"}, "selling_climax": {"detected": false, "strength": 1, "details": "Near low: False, Very high volume: False, Wide down candle: False, Lower wick: True"}}, "support_resistance": {"support_levels": [168.49, 170.285, 164.075], "resistance_levels": [174.38, 171.92, 178.67, 187.0]}, "multi_timeframe_context": {"1h": {"trend_direction": "SIDEWAYS", "signal_strength": "NEUTRAL"}}, "risk_reward": {"risk_reward_ratio": 0, "stop_loss": 184.57, "take_profit": 184.57}, "volatility": 2.1268182375535725, "confidence_score": 46.875}, "output": {"signal": {"type": null, "strength": null}, "explanation": "VPA Analysis for AAPL on 2024-05-09 08:00 (1d):\n\n**Signal:** NEUTRAL (None)\n\n**Trend Context:** The primary trend is currently UP (Price change: 6.67%, Volume trend: DECREASING). Recent price action shows a TREND_ANOMALY (BEARISH). \n\n**Current Candle Analysis:**\n- Candle Type: WIDE\n- Volume: AVERAGE\n- Signal: None (None)\n\n**Detected Patterns:**\n- Accumulation (Strength: 2): Sideways: False, High volume count: 4, Support tests: 11\n- Distribution (Strength: 2): Sideways: False, High volume count: 4, Resistance tests: 10\n\n**Support/Resistance:**\n- Support Levels: 168.49, 170.28, 164.07\n- Resistance Levels: 174.38, 171.92, 178.67, 187.00\n\n**Risk-Reward Analysis:**\n- Risk-Reward Ratio: 0.00\n- Suggested Stop Loss: 184.57\n- Suggested Take Profit: 184.57\n\n**Multi-Timeframe Context:**\n- 1h: SIDEWAYS trend, NEUTRAL signal\n\n**Confidence Score:** 46.9/100\n\n**Conclusion:** Based on the UP trend, the AVERAGE volume on the WIDE candle, and the presence of accumulation, distribution, a None NEUTRAL signal is generated with a confidence score of 46.9/100.", "confidence_score": 46.875}}
{"input": {"timestamp": "2024-05-10 08:00", "ticker": "AAPL", "primary_timeframe": "1d", "vpa_metrics": {"volume_class": "AVERAGE", "candle_class": "WIDE", "signal_type": null, "signal_strength": null}, "trend_analysis": {"trend_direction": "SIDEWAYS", "price_change_percent": -0.18, "volume_trend": "DECREASING", "signal_type": "CONSOLIDATION", "signal_strength": "NEUTRAL"}, "pattern_analysis": {"accumulation": {"detected": true, "strength": 2, "details": "Sideways: False, High volume count: 3, Support tests: 12"}, "distribution": {"detected": true, "strength": 2, "details": "Sideways: False, High volume count: 3, Resistance tests: 11"}, "testing": {"detected": false, "strength": 1, "details": "Testing low: True, Testing high: True, Low volume: False"}, "buying_climax": {"detected": false, "strength": 2, "details": "Near high: True, Very high volume: False, Wide up candle: False, Upper wick: True"}, "selling_climax": {"detected": false, "strength": 2, "details": "Near low: False, Very high volume: False, Wide down candle: True, Lower wick: True"}}, "support_resistance": {"support_levels": [168.49, 170.285, 164.075], "resistance_levels": [174.38, 171.92, 178.67, 187.0]}, "multi_timeframe_context": {"1h": {"trend_direction": "SIDEWAYS", "signal_strength": "NEUTRAL"}}, "risk_reward": {"risk_reward_ratio": 0, "stop_loss": 183.05, "take_profit": 183.05}, "volatility": 2.110838281171378, "confidence_score": 50.0}, "output": {"signal": {"type": null, "strength": null}, "explanation": "VPA Analysis for AAPL on 2024-05-10 08:00 (1d):\n\n**Signal:** NEUTRAL (None)\n\n**Trend Context:** The primary trend is currently SIDEWAYS (Price change: -0.18%, Volume trend: DECREASING). Recent price action shows a CONSOLIDATION (NEUTRAL). \n\n**Current Candle Analysis:**\n- Candle Type: WIDE\n- Volume: AVERAGE\n- Signal: None (None)\n\n**Detected Patterns:**\n- Accumulation (Strength: 2): Sideways: False, High volume count: 3, Support tests: 12\n- Distribution (Strength: 2): Sideways: False, High volume count: 3, Resistance tests: 11\n\n**Support/Resistance:**\n- Support Levels: 168.49, 170.28, 164.07\n- Resistance Levels: 174.38, 171.92, 178.67, 187.00\n\n**Risk-Reward Analysis:**\n- Risk-Reward Ratio: 0.00\n- Suggested Stop Loss: 183.05\n- Suggested Take Profit: 183.05\n\n**Multi-Timeframe Context:**\n- 1h: SIDEWAYS trend, NEUTRAL signal\n\n**Confidence Score:** 50.0/100\n\n**Conclusion:** Based on the SIDEWAYS trend, the AVERAGE volume on the WIDE candle, and the presence of accumulation, distribution, a None NEUTRAL signal is generated with a confidence score of 50.0/100.", "confidence_score": 50.0}}
{"input": {"timestamp": "2024-05-13 08:00", "ticker": "AAPL", "primary_timeframe": "1d", "vpa_metrics": {"volume_class": "AVERAGE", "candle_class": "NEUTRAL", "signal_type": null, "signal_strength": null}, "trend_analysis": {"trend_direction": "SLIGHT_UP", "price_change_percent": 2.51, "volume_trend": "FLAT", "signal_type": null, "signal_strength": null}, "pattern_analysis": {"accumulation": {"detected": true, "strength": 2, "details": "Sideways: False, High volume count: 2, Support tests: 11"}, "distribution": {"detected": true, "strength": 2, "details": "Sideways: False, High volume count: 2, Resistance tests: 10"}, "testing": {"detected": false, "strength": 0, "details": "Testing low: False, Testing high: False, Low volume: False"}, "buying_climax": {"detected": false, "strength": 2, "details": "Near high: True, Very high volume: False, Wide up candle: False, Upper wick: True"}, "selling_climax": {"detected": false, "strength": 1, "details": "Near low: False, Very high volume: False, Wide down candle: False, Lower wick: True"}}, "support_resistance": {"support_levels": [168.49, 170.285, 164.075], "resistance_levels": [174.38, 171.92, 178.67, 187.0]}, "multi_timeframe_context": {"1h": {"trend_direction": "SIDEWAYS", "signal_strength": "NEUTRAL"}}, "risk_reward": {"risk_reward_ratio": 0, "stop_loss": 186.28, "take_profit": 186.28}, "volatility": 2.033551642688425, "confidence_score": 50.0}, "output": {"signal": {"type": null, "strength": null}, "explanation": "VPA Analysis for AAPL on 2024-05-13 08:00 (1d):\n\n**Signal:** NEUTRAL (None)\n\n**Trend Context:** The primary trend is currently SLIGHT_UP (Price change: 2.51%, Volume trend: FLAT). Recent price action shows a None (None). \n\n**Current Candle Analysis:**\n- Candle Type: NEUTRAL\n- Volume: AVERAGE\n- Signal: None (None)\n\n**Detected Patterns:**\n- Accumulation (Strength: 2): Sideways: False, High volume count: 2, Support tests: 11\n- Distribution (Strength: 2): Sideways: False, High volume count: 2, Resistance tests: 10\n\n**Support/Resistance:**\n- Support Levels: 168.49, 170.28, 164.07\n- Resistance Levels: 174.38, 171.92, 178.67, 187.00\n\n**Risk-Reward Analysis:**\n- Risk-Reward Ratio: 0.00\n- Suggested Stop Loss: 186.28\n- Suggested Take Profit: 186.28\n\n**Multi-Timeframe Context:**\n- 1h: SIDEWAYS trend, NEUTRAL signal\n\n**Confidence Score:** 50.0/100\n\n**Conclusion:** Based on the SLIGHT_UP trend, the AVERAGE volume on the NEUTRAL candle, and the presence of accumulation, distribution, a None NEUTRAL signal is generated with a confidence score of 50.0/100.", "confidence_score": 50.0}}
{"input": {"timestamp": "2024-05-14 08:00", "ticker": "AAPL", "primary_timeframe": "1d", "vpa_metrics": {"volume_class": "AVERAGE", "candle_class": "NARROW_UPPER_WICK_LOWER_WICK", "signal_type": null, "signal_strength": null}, "trend_analysis": {"trend_direction": "SLIGHT_UP", "price_change_percent": 2.76, "volume_trend": "DECREASING", "signal_type": "TREND_ANOMALY", "signal_strength": "BEARISH"}, "pattern_analysis": {"accumulation": {"detected": true, "strength": 2, "details": "Sideways: False, High volume count: 2, Support tests: 12"}, "distribution": {"detected": true, "strength": 2, "details": "Sideways: False, High volume count: 2, Resistance tests: 11"}, "testing": {"detected": false, "strength": 1, "details": "Testing low: True, Testing high: True, Low volume: False"}, "buying_climax": {"detected": false, "strength": 2, "details": "Near high: True, Very high volume: False, Wide up candle: False, Upper wick: True"}, "selling_climax": {"detected": false, "strength": 1, "details": "Near low: False, Very high volume: False, Wide down candle: False, Lower wick: True"}}, "support_resistance": {"support_levels": [168.49, 170.285, 164.075], "resistance_levels": [174.38, 171.92, 178.67, 187.0]}, "multi_timeframe_context": {"1h": {"trend_direction": "SIDEWAYS", "signal_strength": "NEUTRAL"}}, "risk_reward": {"risk_reward_ratio": 0, "stop_loss": 187.43, "take_profit": 187.43}, "volatility": 2.0033837193955906, "confidence_score": 46.875}, "output": {"signal": {"type": null, "strength": null}, "explanation": "VPA Analysis for AAPL on 2024-05-14 08:00 (1d):\n\n**Signal:** NEUTRAL (None)\n\n**Trend Context:** The primary trend is currently SLIGHT_UP (Price change: 2.76%, Volume trend: DECREASING). Recent price action shows a TREND_ANOMALY (BEARISH). \n\n**Current Candle Analysis:**\n- Candle Type: NARROW_UPPER_WICK_LOWER_WICK\n- Volume: AVERAGE\n- Signal: None (None)\n\n**Detected Patterns:**\n- Accumulation (Strength: 2): Sideways: False, High volume count: 2, Support tests: 12\n- Distribution (Strength: 2): Sideways: False, High volume count: 2, Resistance tests: 11\n\n**Support/Resistance:**\n- Support Levels: 168.49, 170.28, 164.07\n- Resistance Levels: 174.38, 171.92, 178.67, 187.00\n\n**Risk-Reward Analysis:**\n- Risk-Reward Ratio: 0.00\n- Suggested Stop Loss: 187.43\n- Suggested Take Profit: 187.43\n\n**Multi-Timeframe Context:**\n- 1h: SIDEWAYS trend, NEUTRAL signal\n\n**Confidence Score:** 46.9/100\n\n**Conclusion:** Based on the SLIGHT_UP trend, the AVERAGE volume on the NARROW_UPPER_WICK_LOWER_WICK candle, and the presence of accumulation, distribution, a None NEUTRAL signal is generated with a confidence score of 46.9/100.", "confidence_score": 46.875}}
{"input": {"timestamp": "2024-05-15 08:00", "ticker": "AAPL", "primary_timeframe": "1d", "vpa_metrics": {"volume_class": "AVERAGE", "candle_class": "WIDE", "signal_type": null, "signal_strength": null}, "trend_analysis": {"trend_direction": "SLIGHT_UP", "price_change_percent": 3.82, "volume_trend": "INCREASING", "signal_type": "TREND_VALIDATION", "signal_strength": "BULLISH"}, "pattern_analysis": {"accumulation": {"detected": true, "strength": 2, "details": "Sideways: False, High volume count: 2, Support tests: 12"}, "distribution": {"detected": true, "strength": 2, "details": "Sideways: False, High volume count: 2, Resistance tests: 11"}, "testing": {"detected": false, "strength": 1, "details": "Testing low: True, Testing high: False, Low volume: False"}, "buying_climax": {"detected": false, "strength": 2, "details": "Near high: True, Very high volume: False, Wide up candle: False, Upper wick: True"}, "selling_climax": {"detected": false, "strength": 1, "details": "Near low: False, Very high volume: False, Wide down candle: False, Lower wick: True"}}, "support_resistance": {"support_levels": [170.285, 168.2302, 164.075], "resistance_levels": [174.38, 171.92, 178.67, 187.0]}, "multi_timeframe_context": {"1h": {"trend_direction": "SIDEWAYS", "signal_strength": "NEUTRAL"}}, "risk_reward": {"risk_reward_ratio": 0, "stop_loss": 189.72, "take_profit": 189.72}, "volatility": 2.012214676476136, "confidence_score": 53.125}, "output": {"signal": {"type": null, "strength": null}, "explanation": "VPA Analysis for AAPL on 2024-05-15 08:00 (1d):\n\n**Signal:** NEUTRAL (None)\n\n**Trend Context:** The primary trend is currently SLIGHT_UP (Price change: 3.82%, Volume trend: INCREASING). Recent price action shows a TREND_VALIDATION (BULLISH). \n\n**Current Candle Analysis:**\n- Candle Type: WIDE\n- Volume: AVERAGE\n- Signal: None (None)\n\n**Detected Patterns:**\n- Accumulation (Strength: 2): Sideways: False, High volume count: 2, Support tests: 12\n- Distribution (Strength: 2): Sideways: False, High volume count: 2, Resistance tests: 11\n\n**Support/Resistance:**\n- Support Levels: 170.28, 168.23, 164.07\n- Resistance Levels: 174.38, 171.92, 178.67, 187.00\n\n**Risk-Reward Analysis:**\n- Risk-Reward Ratio: 0.00\n- Suggested Stop Loss: 189.72\n- Suggested Take Profit: 189.72\n\n**Multi-Timeframe Context:**\n- 1h: SIDEWAYS trend, NEUTRAL signal\n\n**Confidence Score:** 53.1/100\n\n**Conclusion:** Based on the SLIGHT_UP trend, the AVERAGE volume on the WIDE candle, and the presence of accumulation, distribution, a None NEUTRAL signal is generated with a confidence score of 53.1/100.", "confidence_score": 53.125}}
{"input": {"timestamp": "2024-05-16 08:00", "ticker": "AAPL", "primary_timeframe": "1d", "vpa_metrics": {"volume_class": "AVERAGE", "candle_class": "NARROW", "signal_type": null, "signal_strength": null}, "trend_analysis": {"trend_direction": "SLIGHT_UP", "price_change_percent": 2.86, "volume_trend": "FLAT", "signal_type": null, "signal_strength": null}, "pattern_analysis": {"accumulation": {"detected": true, "strength": 2, "details": "Sideways: False, High volume count: 2, Support tests: 11"}, "distribution": {"detected": true, "strength": 2, "details": "Sideways: False, High volume count: 2, Resistance tests: 12"}, "testing": {"detected": false, "strength": 1, "details": "Testing low: False, Testing high: True, Low volume: False"}, "buying_climax": {"detected": false, "strength": 2, "details": "Near high: True, Very high volume: False, Wide up candle: False, Upper wick: True"}, "selling_climax": {"detected": false, "strength": 1, "details": "Near low: False, Very high volume: False, Wide down candle: False, Lower wick: True"}}, "support_resistance": {"support_levels": [170.285, 168.2302, 164.075], "resistance_levels": [174.38, 171.92, 178.67, 187.0]}, "multi_timeframe_context": {"1h": {"trend_direction": "SIDEWAYS", "signal_strength": "NEUTRAL"}}, "risk_reward": {"risk_reward_ratio": 0, "stop_loss": 189.84, "take_profit": 189.84}, "volatility": 1.9685219686384097, "confidence_score": 50.0}, "output": {"signal": {"type": null, "strength": null}, "explanation": "VPA Analysis for AAPL on 2024-05-16 08:00 (1d):\n\n**Signal:** NEUTRAL (None)\n\n**Trend Context:** The primary trend is currently SLIGHT_UP (Price change: 2.86%, Volume trend: FLAT). Recent price action shows a None (None). \n\n**Current Candle Analysis:**\n- Candle Type: NARROW\n- Volume: AVERAGE\n- Signal: None (None)\n\n**Detected Patterns:**\n- Accumulation (Strength: 2): Sideways: False, High volume count: 2, Support tests: 11\n- Distribution (Strength: 2): Sideways: False, High volume count: 2, Resistance tests: 12\n\n**Support/Resistance:**\n- Support Levels: 170.28, 168.23, 164.07\n- Resistance Levels: 174.38, 171.92, 178.67, 187.00\n\n**Risk-Reward Analysis:**\n- Risk-Reward Ratio: 0.00\n- Suggested Stop Loss: 189.84\n- Suggested Take Profit: 189.84\n\n**Multi-Timeframe Context:**\n- 1h: SIDEWAYS trend, NEUTRAL signal\n\n**Confidence Score:** 50.0/100\n\n**Conclusion:** Based on the SLIGHT_UP trend, the AVERAGE volume on the NARROW candle, and the presence of accumulation, distribution, a None NEUTRAL signal is generated with a confidence score of 50.0/100.", "confidence_score": 50.0}}
{"input": {"timestamp": "2024-05-17 08:00", "ticker": "AAPL", "primary_timeframe": "1d", "vpa_metrics": {"volume_class": "AVERAGE", "candle_class": "NARROW_UPPER_WICK", "signal_type": null, "signal_strength": null}, "trend_analysis": {"trend_direction": "SLIGHT_UP", "price_change_percent": 3.73, "volume_trend": "DECREASING", "signal_type": "TREND_ANOMALY", "signal_strength": "BEARISH"}, "pattern_analysis": {"accumulation": {"detected": true, "strength": 2, "details": "Sideways: False, High volume count: 2, Support tests: 12"}, "distribution": {"detected": true, "strength": 2, "details": "Sideways: False, High volume count: 2, Resistance tests: 13"}, "testing": {"detected": false, "strength": 1, "details": "Testing low: True, Testing high: True, Low volume: False"}, "buying_climax": {"detected": false, "strength": 2, "details": "Near high: True, Very high volume: False, Wide up candle: False, Upper wick: True"}, "selling_climax": {"detected": false, "strength": 1, "details": "Near low: False, Very high volume: False, Wide down candle: False, Lower wick: True"}}, "support_resistance": {"support_levels": [170.285, 168.2302, 164.075], "resistance_levels": [173.6, 178.67, 187.0, 176.03]}, "multi_timeframe_context": {"1h": {"trend_direction": "SIDEWAYS", "signal_strength": "NEUTRAL"}}, "risk_reward": {"risk_reward_ratio": 0, "stop_loss": 189.87, "take_profit": 189.87}, "volatility": 1.9443719109750992, "confidence_score": 46.875}, "output": {"signal": {"type": null, "strength": null}, "explanation": "VPA Analysis for AAPL on 2024-05-17 08:00 (1d):\n\n**Signal:** NEUTRAL (None)\n\n**Trend Context:** The primary trend is currently SLIGHT_UP (Price change: 3.73%, Volume trend: DECREASING). Recent price action shows a TREND_ANOMALY (BEARISH). \n\n**Current Candle Analysis:**\n- Candle Type: NARROW_UPPER_WICK\n- Volume: AVERAGE\n- Signal: None (None)\n\n**Detected Patterns:**\n- Accumulation (Strength: 2): Sideways: False, High volume count: 2, Support tests: 12\n- Distribution (Strength: 2): Sideways: False, High volume count: 2, Resistance tests: 13\n\n**Support/Resistance:**\n- Support Levels: 170.28, 168.23, 164.07\n- Resistance Levels: 173.60, 178.67, 187.00, 176.03\n\n**Risk-Reward Analysis:**\n- Risk-Reward Ratio: 0.00\n- Suggested Stop Loss: 189.87\n- Suggested Take Profit: 189.87\n\n**Multi-Timeframe Context:**\n- 1h: SIDEWAYS trend, NEUTRAL signal\n\n**Confidence Score:** 46.9/100\n\n**Conclusion:** Based on the SLIGHT_UP trend, the AVERAGE volume on the NARROW_UPPER_WICK candle, and the presence of accumulation, distribution, a None NEUTRAL signal is generated with a confidence score of 46.9/100.", "confidence_score": 46.875}}
{"input": {"timestamp": "2024-05-20 08:00", "ticker": "AAPL", "primary_timeframe": "1d", "vpa_metrics": {"volume_class": "AVERAGE", "candle_class": "WIDE", "signal_type": null, "signal_strength": null}, "trend_analysis": {"trend_direction": "SLIGHT_UP", "price_change_percent": 2.56, "volume_trend": "DECREASING", "signal_type": "TREND_ANOMALY", "signal_strength": "BEARISH"}, "pattern_analysis": {"accumulation": {"detected": true, "strength": 2, "details": "Sideways: False, High volume count: 2, Support tests: 12"}, "distribution": {"detected": true, "strength": 2, "details": "Sideways: False, High volume count: 2, Resistance tests: 13"}, "testing": {"detected": false, "strength": 1, "details": "Testing low: True, Testing high: True, Low volume: False"}, "buying_climax": {"detected": false, "strength": 2, "details": "Near high: True, Very high volume: False, Wide up candle: False, Upper wick: True"}, "selling_climax": {"detected": false, "strength": 1, "details": "Near low: False, Very high volume: False, Wide down candle: False, Lower wick: True"}}, "support_resistance": {"support_levels": [170.285, 168.2302, 164.075], "resistance_levels": [173.6, 178.67, 187.0, 176.03]}, "multi_timeframe_context": {"1h": {"trend_direction": "SIDEWAYS", "signal_strength": "NEUTRAL"}}, "risk_reward": {"risk_reward_ratio": 0, "stop_loss": 191.04, "take_profit": 191.04}, "volatility": 1.953950123424138, "confidence_score": 46.875}, "output": {"signal": {"type": null, "strength": null}, "explanation": "VPA Analysis for AAPL on 2024-05-20 08:00 (1d):\n\n**Signal:** NEUTRAL (None)\n\n**Trend Context:** The primary trend is currently SLIGHT_UP (Price change: 2.56%, Volume trend: DECREASING). Recent price action shows a TREND_ANOMALY (BEARISH). \n\n**Current Candle Analysis:**\n- Candle Type: WIDE\n- Volume: AVERAGE\n- Signal: None (None)\n\n**Detected Patterns:**\n- Accumulation (Strength: 2): Sideways: False, High volume count: 2, Support tests: 12\n- Distribution (Strength: 2): Sideways: False, High volume count: 2, Resistance tests: 13\n\n**Support/Resistance:**\n- Support Levels: 170.28, 168.23, 164.07\n- Resistance Levels: 173.60, 178.67, 187.00, 176.03\n\n**Risk-Reward Analysis:**\n- Risk-Reward Ratio: 0.00\n- Suggested Stop Loss: 191.04\n- Suggested Take Profit: 191.04\n\n**Multi-Timeframe Context:**\n- 1h: SIDEWAYS trend, NEUTRAL signal\n\n**Confidence Score:** 46.9/100\n\n**Conclusion:** Based on the SLIGHT_UP trend, the AVERAGE volume on the WIDE candle, and the presence of accumulation, distribution, a None NEUTRAL signal is generated with a confidence score of 46.9/100.", "confidence_score": 46.875}}
{"input": {"timestamp": "2024-05-21 08:00", "ticker": "AAPL", "primary_timeframe": "1d", "vpa_metrics": {"volume_class": "AVERAGE", "candle_class": "NEUTRAL", "signal_type": null, "signal_strength": null}, "trend_analysis": {"trend_direction": "SLIGHT_UP", "price_change_percent": 2.62, "volume_trend": "DECREASING", "signal_type": "TREND_ANOMALY", "signal_strength": "BEARISH"}, "pattern_analysis": {"accumulation": {"detected": true, "strength": 2, "details": "Sideways: False, High volume count: 2, Support tests: 11"}, "distribution": {"detected": true, "strength": 2, "details": "Sideways: False, High volume count: 2, Resistance tests: 13"}, "testing": {"detected": false, "strength": 1, "details": "Testing low: True, Testing high: True, Low volume: False"}, "buying_climax": {"detected": true, "strength": 3, "details": "Near high: True, Very high volume: False, Wide up candle: True, Upper wick: True"}, "selling_climax": {"detected": false, "strength": 1, "details": "Near low: False, Very high volume: False, Wide down candle: False, Lower wick: True"}}, "support_resistance": {"support_levels": [170.285, 168.2302, 164.075], "resistance_levels": [173.6, 178.67, 187.0, 176.03]}, "multi_timeframe_context": {"1h": {"trend_direction": "SIDEWAYS", "signal_strength": "NEUTRAL"}}, "risk_reward": {"risk_reward_ratio": 0, "stop_loss": 192.35, "take_profit": 192.35}, "volatility": 1.9056161328718209, "confidence_score": 42.5}, "output": {"signal": {"type": null, "strength": null}, "explanation": "VPA Analysis for AAPL on 2024-05-21 08:00 (1d):\n\n**Signal:** NEUTRAL (None)\n\n**Trend Context:** The primary trend is currently SLIGHT_UP (Price change: 2.62%, Volume trend: DECREASING). Recent price action shows a TREND_ANOMALY (BEARISH). \n\n**Current Candle Analysis:**\n- Candle Type: NEUTRAL\n- Volume: AVERAGE\n- Signal: None (None)\n\n**Detected Patterns:**\n- Accumulation (Strength: 2): Sideways: False, High volume count: 2, Support tests: 11\n- Distribution (Strength: 2): Sideways: False, High volume count: 2, Resistance tests: 13\n- Buying Climax (Strength: 3): Near high: True, Very high volume: False, Wide up candle: True, Upper wick: True\n\n**Support/Resistance:**\n- Support Levels: 170.28, 168.23, 164.07\n- Resistance Levels: 173.60, 178.67, 187.00, 176.03\n\n**Risk-Reward Analysis:**\n- Risk-Reward Ratio: 0.00\n- Suggested Stop Loss: 192.35\n- Suggested Take Profit: 192.35\n\n**Multi-Timeframe Context:**\n- 1h: SIDEWAYS trend, NEUTRAL signal\n\n**Confidence Score:** 42.5/100\n\n**Conclusion:** Based on the SLIGHT_UP trend, the AVERAGE volume on the NEUTRAL candle, and the presence of accumulation, distribution, buying_climax, a None NEUTRAL signal is generated with a confidence score of 42.5/100.", "confidence_score": 42.5}}
{"input": {"timestamp": "2024-05-22 08:00", "ticker": "AAPL", "primary_timeframe": "1d", "vpa_metrics": {"volume_class": "LOW", "candle_class": "NEUTRAL", "signal_type": null, "signal_strength": null}, "trend_analysis": {"trend_direction": "SIDEWAYS", "price_change_percent": 0.62, "volume_trend": "DECREASING", "signal_type": "CONSOLIDATION", "signal_strength": "NEUTRAL"}, "pattern_analysis": {"accumulation": {"detected": true, "strength": 2, "details": "Sideways: False, High volume count: 2, Support tests: 11"}, "distribution": {"detected": true, "strength": 2, "details": "Sideways: False, High volume count: 2, Resistance tests: 14"}, "testing": {"detected": true, "strength": 2, "details": "Testing low: True, Testing high: True, Low volume: True"}, "buying_climax": {"detected": false, "strength": 2, "details": "Near high: True, Very high volume: False, Wide up candle: False, Upper wick: True"}, "selling_climax": {"detected": false, "strength": 1, "details": "Near low: False, Very high volume: False, Wide down candle: False, Lower wick: True"}}, "support_resistance": {"support_levels": [170.285, 168.2302, 164.075, 189.01], "resistance_levels": [173.6, 178.67, 187.0, 176.03]}, "multi_timeframe_context": {"1h": {"trend_direction": "SIDEWAYS", "signal_strength": "NEUTRAL"}}, "risk_reward": {"risk_reward_ratio": 0, "stop_loss": 190.9, "take_profit": 190.9}, "volatility": 1.9226875465247717, "confidence_score": 50.0}, "output": {"signal": {"type": null, "strength": null}, "explanation": "VPA Analysis for AAPL on 2024-05-22 08:00 (1d):\n\n**Signal:** NEUTRAL (None)\n\n**Trend Context:** The primary trend is currently SIDEWAYS (Price change: 0.62%, Volume trend: DECREASING). Recent price action shows a CONSOLIDATION (NEUTRAL). \n\n**Current Candle Analysis:**\n- Candle Type: NEUTRAL\n- Volume: LOW\n- Signal: None (None)\n\n**Detected Patterns:**\n- Accumulation (Strength: 2): Sideways: False, High volume count: 2, Support tests: 11\n- Distribution (Strength: 2): Sideways: False, High volume count: 2, Resistance tests: 14\n- Testing (Strength: 2): Testing low: True, Testing high: True, Low volume: True\n\n**Support/Resistance:**\n- Support Levels: 170.28, 168.23, 164.07, 189.01\n- Resistance Levels: 173.60, 178.67, 187.00, 176.03\n\n**Risk-Reward Analysis:**\n- Risk-Reward Ratio: 0.00\n- Suggested Stop Loss: 190.90\n- Suggested Take Profit: 190.90\n\n**Multi-Timeframe Context:**\n- 1h: SIDEWAYS trend, NEUTRAL signal\n\n**Confidence Score:** 50.0/100\n\n**Conclusion:** Based on the SIDEWAYS trend, the LOW volume on the NEUTRAL candle, and the presence of accumulation, distribution, testing, a None NEUTRAL signal is generated with a confidence score of 50.0/100.", "confidence_score": 50.0}}
{"input": {"timestamp": "2024-05-23 08:00", "ticker": "AAPL", "primary_timeframe": "1d", "vpa_metrics": {"volume_class": "AVERAGE", "candle_class": "WIDE", "signal_type": null, "signal_strength": null}, "trend_analysis": {"trend_direction": "SIDEWAYS", "price_change_percent": -1.56, "volume_trend": "FLAT", "signal_type": "CONSOLIDATION", "signal_strength": "NEUTRAL"}, "pattern_analysis": {"accumulation": {"detected": true, "strength": 2, "details": "Sideways: False, High volume count: 2, Support tests: 11"}, "distribution": {"detected": true, "strength": 2, "details": "Sideways: False, High volume count: 2, Resistance tests: 14"}, "testing": {"detected": false, "strength": 1, "details": "Testing low: False, Testing high: True, Low volume: False"}, "buying_climax": {"detected": false, "strength": 1, "details": "Near high: False, Very high volume: False, Wide up candle: False, Upper wick: True"}, "selling_climax": {"detected": false, "strength": 1, "details": "Near low: False, Very high volume: False, Wide down candle: True, Lower wick: False"}}, "support_resistance": {"support_levels": [168.2302, 164.075, 189.01], "resistance_levels": [173.6, 178.67, 187.0, 176.03]}, "multi_timeframe_context": {"1h": {"trend_direction": "SIDEWAYS", "signal_strength": "NEUTRAL"}}, "risk_reward": {"risk_reward_ratio": 0, "stop_loss": 186.88, "take_profit": 186.88}, "volatility": 2.0264284426820476, "confidence_score": 50.0}, "output": {"signal": {"type": null, "strength": null}, "explanation": "VPA Analysis for AAPL on 2024-05-23 08:00 (1d):\n\n**Signal:** NEUTRAL (None)\n\n**Trend Context:** The primary trend is currently SIDEWAYS (Price change: -1.56%, Volume trend: FLAT). Recent price action shows a CONSOLIDATION (NEUTRAL). \n\n**Current Candle Analysis:**\n- Candle Type: WIDE\n- Volume: AVERAGE\n- Signal: None (None)\n\n**Detected Patterns:**\n- Accumulation (Strength: 2): Sideways: False, High volume count: 2, Support tests: 11\n- Distribution (Strength: 2): Sideways: False, High volume count: 2, Resistance tests: 14\n\n**Support/Resistance:**\n- Support Levels: 168.23, 164.07, 189.01\n- Resistance Levels: 173.60, 178.67, 187.00, 176.03\n\n**Risk-Reward Analysis:**\n- Risk-Reward Ratio: 0.00\n- Suggested Stop Loss: 186.88\n- Suggested Take Profit: 186.88\n\n**Multi-Timeframe Context:**\n- 1h: SIDEWAYS trend, NEUTRAL signal\n\n**Confidence Score:** 50.0/100\n\n**Conclusion:** Based on the SIDEWAYS trend, the AVERAGE volume on the WIDE candle, and the presence of accumulation, distribution, a None NEUTRAL signal is generated with a confidence score of 50.0/100.", "confidence_score": 50.0}}
{"input": {"timestamp": "2024-05-24 08:00", "ticker": "AAPL", "primary_timeframe": "1d", "vpa_metrics": {"volume_class": "LOW", "candle_class": "NEUTRAL", "signal_type": null, "signal_strength": null}, "trend_analysis": {"trend_direction": "SIDEWAYS", "price_change_percent": 0.06, "volume_trend": "DECREASING", "signal_type": "CONSOLIDATION", "signal_strength": "NEUTRAL"}, "pattern_analysis": {"accumulation": {"detected": true, "strength": 2, "details": "Sideways: False, High volume count: 2, Support tests: 11"}, "distribution": {"detected": true, "strength": 2, "details": "Sideways: False, High volume count: 2, Resistance tests: 14"}, "testing": {"detected": true, "strength": 2, "details": "Testing low: True, Testing high: True, Low volume: True"}, "buying_climax": {"detected": false, "strength": 2, "details": "Near high: True, Very high volume: False, Wide up candle: False, Upper wick: True"}, "selling_climax": {"detected": false, "strength": 1, "details": "Near low: False, Very high volume: False, Wide down candle: False, Lower wick: True"}}, "support_resistance": {"support_levels": [168.2302, 164.075, 189.01], "resistance_levels": [173.6, 178.67, 187.0, 176.03, 192.8231]}, "multi_timeframe_context": {"1h": {"trend_direction": "SIDEWAYS", "signal_strength": "NEUTRAL"}}, "risk_reward": {"risk_reward_ratio": 0, "stop_loss": 189.98, "take_profit": 189.98}, "volatility": 1.909419828125953, "confidence_score": 50.0}, "output": {"signal": {"type": null, "strength": null}, "explanation": "VPA Analysis for AAPL on 2024-05-24 08:00 (1d):\n\n**Signal:** NEUTRAL (None)\n\n**Trend Context:** The primary trend is currently SIDEWAYS (Price change: 0.06%, Volume trend: DECREASING). Recent price action shows a CONSOLIDATION (NEUTRAL). \n\n**Current Candle Analysis:**\n- Candle Type: NEUTRAL\n- Volume: LOW\n- Signal: None (None)\n\n**Detected Patterns:**\n- Accumulation (Strength: 2): Sideways: False, High volume count: 2, Support tests: 11\n- Distribution (Strength: 2): Sideways: False, High volume count: 2, Resistance tests: 14\n- Testing (Strength: 2): Testing low: True, Testing high: True, Low volume: True\n\n**Support/Resistance:**\n- Support Levels: 168.23, 164.07, 189.01\n- Resistance Levels: 173.60, 178.67, 187.00, 176.03, 192.82\n\n**Risk-Reward Analysis:**\n- Risk-Reward Ratio: 0.00\n- Suggested Stop Loss: 189.98\n- Suggested Take Profit: 189.98\n\n**Multi-Timeframe Context:**\n- 1h: SIDEWAYS trend, NEUTRAL signal\n\n**Confidence Score:** 50.0/100\n\n**Conclusion:** Based on the SIDEWAYS trend, the LOW volume on the NEUTRAL candle, and the presence of accumulation, distribution, testing, a None NEUTRAL signal is generated with a confidence score of 50.0/100.", "confidence_score": 50.0}}
{"input": {"timestamp": "2024-05-28 08:00", "ticker": "AAPL", "primary_timeframe": "1d", "vpa_metrics": {"volume_class": "AVERAGE", "candle_class": "NEUTRAL", "signal_type": null, "signal_strength": null}, "trend_analysis": {"trend_direction": "SIDEWAYS", "price_change_percent": -0.55, "volume_trend": "INCREASING", "signal_type": "CONSOLIDATION", "signal_strength": "NEUTRAL"}, "pattern_analysis": {"accumulation": {"detected": true, "strength": 2, "details": "Sideways: False, High volume count: 2, Support tests: 12"}, "distribution": {"detected": true, "strength": 2, "details": "Sideways: False, High volume count: 2, Resistance tests: 14"}, "testing": {"detected": false, "strength": 1, "details": "Testing low: True, Testing high: True, Low volume: False"}, "buying_climax": {"detected": false, "strength": 2, "details": "Near high: True, Very high volume: False, Wide up candle: False, Upper wick: True"}, "selling_climax": {"detected": false, "strength": 1, "details": "Near low: False, Very high volume: False, Wide down candle: False, Lower wick: True"}}, "support_resistance": {"support_levels": [168.2302, 164.075, 189.01, 186.625], "resistance_levels": [173.6, 178.67, 187.0, 192.8231, 176.03]}, "multi_timeframe_context": {"1h": {"trend_direction": "SIDEWAYS", "signal_strength": "NEUTRAL"}}, "risk_reward": {"risk_reward_ratio": 0, "stop_loss": 189.99, "take_profit": 189.99}, "volatility": 1.879123832002239, "confidence_score": 50.0}, "output": {"signal": {"type": null, "strength": null}, "explanation": "VPA Analysis for AAPL on 2024-05-28 08:00 (1d):\n\n**Signal:** NEUTRAL (None)\n\n**Trend Context:** The primary trend is currently SIDEWAYS (Price change: -0.55%, Volume trend: INCREASING). Recent price action shows a CONSOLIDATION (NEUTRAL). \n\n**Current Candle Analysis:**\n- Candle Type: NEUTRAL\n- Volume: AVERAGE\n- Signal: None (None)\n\n**Detected Patterns:**\n- Accumulation (Strength: 2): Sideways: False, High volume count: 2, Support tests: 12\n- Distribution (Strength: 2): Sideways: False, High volume count: 2, Resistance tests: 14\n\n**Support/Resistance:**\n- Support Levels: 168.23, 164.07, 189.01, 186.62\n- Resistance Levels: 173.60, 178.67, 187.00, 192.82, 176.03\n\n**Risk-Reward Analysis:**\n- Risk-Reward Ratio: 0.00\n- Suggested Stop Loss: 189.99\n- Suggested Take Profit: 189.99\n\n**Multi-Timeframe Context:**\n- 1h: SIDEWAYS trend, NEUTRAL signal\n\n**Confidence Score:** 50.0/100\n\n**Conclusion:** Based on the SIDEWAYS trend, the AVERAGE volume on the NEUTRAL candle, and the presence of accumulation, distribution, a None NEUTRAL signal is generated with a confidence score of 50.0/100.", "confidence_score": 50.0}}
{"input": {"timestamp": "2024-05-29 08:00", "ticker": "AAPL", "primary_timeframe": "1d", "vpa_metrics": {"volume_class": "AVERAGE", "candle_class": "NARROW_UPPER_WICK", "signal_type": null, "signal_strength": null}, "trend_analysis": {"trend_direction": "SIDEWAYS", "price_change_percent": -1.07, "volume_trend": "INCREASING", "signal_type": "CONSOLIDATION", "signal_strength": "NEUTRAL"}, "pattern_analysis": {"accumulation": {"detected": true, "strength": 2, "details": "Sideways: False, High volume count: 2, Support tests: 13"}, "distribution": {"detected": true, "strength": 2, "details": "Sideways: False, High volume count: 2, Resistance tests: 14"}, "testing": {"detected": false, "strength": 1, "details": "Testing low: True, Testing high: True, Low volume: False"}, "buying_climax": {"detected": false, "strength": 2, "details": "Near high: True, Very high volume: False, Wide up candle: False, Upper wick: True"}, "selling_climax": {"detected": false, "strength": 1, "details": "Near low: False, Very high volume: False, Wide down candle: False, Lower wick: True"}}, "support_resistance": {"support_levels": [168.2302, 189.01, 164.075, 186.625], "resistance_levels": [173.6, 192.8231, 187.0, 178.36, 176.03]}, "multi_timeframe_context": {"1h": {"trend_direction": "SIDEWAYS", "signal_strength": "NEUTRAL"}}, "risk_reward": {"risk_reward_ratio": 0, "stop_loss": 190.29, "take_profit": 190.29}, "volatility": 1.8524302242283952, "confidence_score": 50.0}, "output": {"signal": {"type": null, "strength": null}, "explanation": "VPA Analysis for AAPL on 2024-05-29 08:00 (1d):\n\n**Signal:** NEUTRAL (None)\n\n**Trend Context:** The primary trend is currently SIDEWAYS (Price change: -1.07%, Volume trend: INCREASING). Recent price action shows a CONSOLIDATION (NEUTRAL). \n\n**Current Candle Analysis:**\n- Candle Type: NARROW_UPPER_WICK\n- Volume: AVERAGE\n- Signal: None (None)\n\n**Detected Patterns:**\n- Accumulation (Strength: 2): Sideways: False, High volume count: 2, Support tests: 13\n- Distribution (Strength: 2): Sideways: False, High volume count: 2, Resistance tests: 14\n\n**Support/Resistance:**\n- Support Levels: 168.23, 189.01, 164.07, 186.62\n- Resistance Levels: 173.60, 192.82, 187.00, 178.36, 176.03\n\n**Risk-Reward Analysis:**\n- Risk-Reward Ratio: 0.00\n- Suggested Stop Loss: 190.29\n- Suggested Take Profit: 190.29\n\n**Multi-Timeframe Context:**\n- 1h: SIDEWAYS trend, NEUTRAL signal\n\n**Confidence Score:** 50.0/100\n\n**Conclusion:** Based on the SIDEWAYS trend, the AVERAGE volume on the NARROW_UPPER_WICK candle, and the presence of accumulation, distribution, a None NEUTRAL signal is generated with a confidence score of 50.0/100.", "confidence_score": 50.0}}
{"input": {"timestamp": "2024-05-30 08:00", "ticker": "AAPL", "primary_timeframe": "1d", "vpa_metrics": {"volume_class": "AVERAGE", "candle_class": "NARROW_UPPER_WICK", "signal_type": null, "signal_strength": null}, "trend_analysis": {"trend_direction": "SIDEWAYS", "price_change_percent": 0.2, "volume_trend": "INCREASING", "signal_type": "CONSOLIDATION", "signal_strength": "NEUTRAL"}, "pattern_analysis": {"accumulation": {"detected": true, "strength": 2, "details": "Sideways: False, High volume count: 2, Support tests: 13"}, "distribution": {"detected": true, "strength": 2, "details": "Sideways: False, High volume count: 2, Resistance tests: 15"}, "testing": {"detected": false, "strength": 1, "details": "Testing low: True, Testing high: True, Low volume: False"}, "buying_climax": {"detected": false, "strength": 2, "details": "Near high: True, Very high volume: False, Wide up candle: False, Upper wick: True"}, "selling_climax": {"detected": false, "strength": 1, "details": "Near low: False, Very high volume: False, Wide down candle: False, Lower wick: True"}}, "support_resistance": {"support_levels": [168.2302, 189.01, 164.075, 186.625], "resistance_levels": [192.8231, 173.6, 187.0, 178.36, 176.03]}, "multi_timeframe_context": {"1h": {"trend_direction": "SIDEWAYS", "signal_strength": "NEUTRAL"}}, "risk_reward": {"risk_reward_ratio": 0, "stop_loss": 191.29, "take_profit": 191.29}, "volatility": 1.7815276337112866, "confidence_score": 50.0}, "output": {"signal": {"type": null, "strength": null}, "explanation": "VPA Analysis for AAPL on 2024-05-30 08:00 (1d):\n\n**Signal:** NEUTRAL (None)\n\n**Trend Context:** The primary trend is currently SIDEWAYS (Price change: 0.2%, Volume trend: INCREASING). Recent price action shows a CONSOLIDATION (NEUTRAL). \n\n**Current Candle Analysis:**\n- Candle Type: NARROW_UPPER_WICK\n- Volume: AVERAGE\n- Signal: None (None)\n\n**Detected Patterns:**\n- Accumulation (Strength: 2): Sideways: False, High volume count: 2, Support tests: 13\n- Distribution (Strength: 2): Sideways: False, High volume count: 2, Resistance tests: 15\n\n**Support/Resistance:**\n- Support Levels: 168.23, 189.01, 164.07, 186.62\n- Resistance Levels: 192.82, 173.60, 187.00, 178.36, 176.03\n\n**Risk-Reward Analysis:**\n- Risk-Reward Ratio: 0.00\n- Suggested Stop Loss: 191.29\n- Suggested Take Profit: 191.29\n\n**Multi-Timeframe Context:**\n- 1h: SIDEWAYS trend, NEUTRAL signal\n\n**Confidence Score:** 50.0/100\n\n**Conclusion:** Based on the SIDEWAYS trend, the AVERAGE volume on the NARROW_UPPER_WICK candle, and the presence of accumulation, distribution, a None NEUTRAL signal is generated with a confidence score of 50.0/100.", "confidence_score": 50.0}}
{"input": {"timestamp": "2024-05-31 08:00", "ticker": "AAPL", "primary_timeframe": "1d", "vpa_metrics": {"volume_class": "AVERAGE", "candle_class": "NEUTRAL_LOWER_WICK", "signal_type": null, "signal_strength": null}, "trend_analysis": {"trend_direction": "SLIGHT_UP", "price_change_percent": 2.87, "volume_trend": "INCREASING", "signal_type": "TREND_VALIDATION", "signal_strength": "BULLISH"}, "pattern_analysis": {"accumulation": {"detected": true, "strength": 2, "details": "Sideways: False, High volume count: 2, Support tests: 14"}, "distribution": {"detected": true, "strength": 2, "details": "Sideways: False, High volume count: 2, Resistance tests: 15"}, "testing": {"detected": false, "strength": 1, "details": "Testing low: True, Testing high: True, Low volume: False"}, "buying_climax": {"detected": false, "strength": 2, "details": "Near high: True, Very high volume: False, Wide up candle: False, Upper wick: True"}, "selling_climax": {"detected": false, "strength": 1, "details": "Near low: False, Very high volume: False, Wide down candle: False, Lower wick: True"}}, "support_resistance": {"support_levels": [168.2302, 189.01, 164.075, 186.625], "resistance_levels": [192.8231, 173.6, 187.0, 178.36, 176.03]}, "multi_timeframe_context": {"1h": {"trend_direction": "SIDEWAYS", "signal_strength": "NEUTRAL"}}, "risk_reward": {"risk_reward_ratio": 0, "stop_loss": 192.25, "take_profit": 192.25}, "volatility": 1.4630018479228002, "confidence_score": 53.125}, "output": {"signal": {"type": null, "strength": null}, "explanation": "VPA Analysis for AAPL on 2024-05-31 08:00 (1d):\n\n**Signal:** NEUTRAL (None)\n\n**Trend Context:** The primary trend is currently SLIGHT_UP (Price change: 2.87%, Volume trend: INCREASING). Recent price action shows a TREND_VALIDATION (BULLISH). \n\n**Current Candle Analysis:**\n- Candle Type: NEUTRAL_LOWER_WICK\n- Volume: AVERAGE\n- Signal: None (None)\n\n**Detected Patterns:**\n- Accumulation (Strength: 2): Sideways: False, High volume count: 2, Support tests: 14\n- Distribution (Strength: 2): Sideways: False, High volume count: 2, Resistance tests: 15\n\n**Support/Resistance:**\n- Support Levels: 168.23, 189.01, 164.07, 186.62\n- Resistance Levels: 192.82, 173.60, 187.00, 178.36, 176.03\n\n**Risk-Reward Analysis:**\n- Risk-Reward Ratio: 0.00\n- Suggested Stop Loss: 192.25\n- Suggested Take Profit: 192.25\n\n**Multi-Timeframe Context:**\n- 1h: SIDEWAYS trend, NEUTRAL signal\n\n**Confidence Score:** 53.1/100\n\n**Conclusion:** Based on the SLIGHT_UP trend, the AVERAGE volume on the NEUTRAL_LOWER_WICK candle, and the presence of accumulation, distribution, a None NEUTRAL signal is generated with a confidence score of 53.1/100.", "confidence_score": 53.125}}
{"input": {"timestamp": "2024-06-03 08:00", "ticker": "AAPL", "primary_timeframe": "1d", "vpa_metrics": {"volume_class": "AVERAGE", "candle_class": "NEUTRAL", "signal_type": null, "signal_strength": null}, "trend_analysis": {"trend_direction": "SLIGHT_UP", "price_change_percent": 2.13, "volume_trend": "INCREASING", "signal_type": "TREND_VALIDATION", "signal_strength": "BULLISH"}, "pattern_analysis": {"accumulation": {"detected": true, "strength": 2, "details": "Sideways: True, High volume count: 1, Support tests: 14"}, "distribution": {"detected": true, "strength": 2, "details": "Sideways: True, High volume count: 1, Resistance tests: 15"}, "testing": {"detected": false, "strength": 1, "details": "Testing low: True, Testing high: False, Low volume: False"}, "buying_climax": {"detected": false, "strength": 2, "details": "Near high: True, Very high volume: False, Wide up candle: False, Upper wick: True"}, "selling_climax": {"detected": false, "strength": 1, "details": "Near low: False, Very high volume: False, Wide down candle: False, Lower wick: True"}}, "support_resistance": {"support_levels": [168.2302, 189.01, 164.075, 186.625], "resistance_levels": [192.8231, 173.6, 187.0, 178.36, 176.03]}, "multi_timeframe_context": {"1h": {"trend_direction": "SIDEWAYS", "signal_strength": "NEUTRAL"}}, "risk_reward": {"risk_reward_ratio": 0, "stop_loss": 194.03, "take_profit": 194.03}, "volatility": 1.4213699997558729, "confidence_score": 53.125}, "output": {"signal": {"type": null, "strength": null}, "explanation": "VPA Analysis for AAPL on 2024-06-03 08:00 (1d):\n\n**Signal:** NEUTRAL (None)\n\n**Trend Context:** The primary trend is currently SLIGHT_UP (Price change: 2.13%, Volume trend: INCREASING). Recent price action shows a TREND_VALIDATION (BULLISH). \n\n**Current Candle Analysis:**\n- Candle Type: NEUTRAL\n- Volume: AVERAGE\n- Signal: None (None)\n\n**Detected Patterns:**\n- Accumulation (Strength: 2): Sideways: True, High volume count: 1, Support tests: 14\n- Distribution (Strength: 2): Sideways: True, High volume count: 1, Resistance tests: 15\n\n**Support/Resistance:**\n- Support Levels: 168.23, 189.01, 164.07, 186.62\n- Resistance Levels: 192.82, 173.60, 187.00, 178.36, 176.03\n\n**Risk-Reward Analysis:**\n- Risk-Reward Ratio: 0.00\n- Suggested Stop Loss: 194.03\n- Suggested Take Profit: 194.03\n\n**Multi-Timeframe Context:**\n- 1h: SIDEWAYS trend, NEUTRAL signal\n\n**Confidence Score:** 53.1/100\n\n**Conclusion:** Based on the SLIGHT_UP trend, the AVERAGE volume on the NEUTRAL candle, and the presence of accumulation, distribution, a None NEUTRAL signal is generated with a confidence score of 53.1/100.", "confidence_score": 53.125}}
{"input": {"timestamp": "2024-06-04 08:00", "ticker": "AAPL", "primary_timeframe": "1d", "vpa_metrics": {"volume_class": "AVERAGE", "candle_class": "NARROW_UPPER_WICK_LOWER_WICK", "signal_type": null, "signal_strength": null}, "trend_analysis": {"trend_direction": "SLIGHT_UP", "price_change_percent": 2.29, "volume_trend": "FLAT", "signal_type": null, "signal_strength": null}, "pattern_analysis": {"accumulation": {"detected": true, "strength": 2, "details": "Sideways: True, High volume count: 0, Support tests: 15"}, "distribution": {"detected": true, "strength": 2, "details": "Sideways: True, High volume count: 0, Resistance tests: 16"}, "testing": {"detected": false, "strength": 1, "details": "Testing low: True, Testing high: True, Low volume: False"}, "buying_climax": {"detected": false, "strength": 2, "details": "Near high: True, Very high volume: False, Wide up candle: False, Upper wick: True"}, "selling_climax": {"detected": false, "strength": 1, "details": "Near low: False, Very high volume: False, Wide down candle: False, Lower wick: True"}}, "support_resistance": {"support_levels": [168.2302, 189.01, 164.075, 186.625], "resistance_levels": [192.8231, 173.6, 187.0, 178.36, 176.03]}, "multi_timeframe_context": {"1h": {"trend_direction": "SIDEWAYS", "signal_strength": "NEUTRAL"}}, "risk_reward": {"risk_reward_ratio": 0, "stop_loss": 194.35, "take_profit": 194.35}, "volatility": 1.383981693363846, "confidence_score": 50.0}, "output": {"signal": {"type": null, "strength": null}, "explanation": "VPA Analysis for AAPL on 2024-06-04 08:00 (1d):\n\n**Signal:** NEUTRAL (None)\n\n**Trend Context:** The primary trend is currently SLIGHT_UP (Price change: 2.29%, Volume trend: FLAT). Recent price action shows a None (None). \n\n**Current Candle Analysis:**\n- Candle Type: NARROW_UPPER_WICK_LOWER_WICK\n- Volume: AVERAGE\n- Signal: None (None)\n\n**Detected Patterns:**\n- Accumulation (Strength: 2): Sideways: True, High volume count: 0, Support tests: 15\n- Distribution (Strength: 2): Sideways: True, High volume count: 0, Resistance tests: 16\n\n**Support/Resistance:**\n- Support Levels: 168.23, 189.01, 164.07, 186.62\n- Resistance Levels: 192.82, 173.60, 187.00, 178.36, 176.03\n\n**Risk-Reward Analysis:**\n- Risk-Reward Ratio: 0.00\n- Suggested Stop Loss: 194.35\n- Suggested Take Profit: 194.35\n\n**Multi-Timeframe Context:**\n- 1h: SIDEWAYS trend, NEUTRAL signal\n\n**Confidence Score:** 50.0/100\n\n**Conclusion:** Based on the SLIGHT_UP trend, the AVERAGE volume on the NARROW_UPPER_WICK_LOWER_WICK candle, and the presence of accumulation, distribution, a None NEUTRAL signal is generated with a confidence score of 50.0/100.", "confidence_score": 50.0}}
{"input": {"timestamp": "2024-06-05 08:00", "ticker": "AAPL", "primary_timeframe": "1d", "vpa_metrics": {"volume_class": "AVERAGE", "candle_class": "NARROW_UPPER_WICK", "signal_type": null, "signal_strength": null}, "trend_analysis": {"trend_direction": "SLIGHT_UP", "price_change_percent": 2.93, "volume_trend": "FLAT", "signal_type": null, "signal_strength": null}, "pattern_analysis": {"accumulation": {"detected": false, "strength": 1, "details": "Sideways: False, High volume count: 0, Support tests: 15"}, "distribution": {"detected": false, "strength": 1, "details": "Sideways: False, High volume count: 0, Resistance tests: 16"}, "testing": {"detected": false, "strength": 1, "details": "Testing low: True, Testing high: True, Low volume: False"}, "buying_climax": {"detected": false, "strength": 2, "details": "Near high: True, Very high volume: False, Wide up candle: False, Upper wick: True"}, "selling_climax": {"detected": false, "strength": 1, "details": "Near low: False, Very high volume: False, Wide down candle: False, Lower wick: True"}}, "support_resistance": {"support_levels": [168.2302, 189.01, 164.075, 186.625], "resistance_levels": [192.8231, 171.92, 187.0, 178.36, 176.03]}, "multi_timeframe_context": {"1h": {"trend_direction": "SIDEWAYS", "signal_strength": "NEUTRAL"}}, "risk_reward": {"risk_reward_ratio": 0, "stop_loss": 195.87, "take_profit": 195.87}, "volatility": 1.3982313725806341, "confidence_score": 50.0}, "output": {"signal": {"type": null, "strength": null}, "explanation": "VPA Analysis for AAPL on 2024-06-05 08:00 (1d):\n\n**Signal:** NEUTRAL (None)\n\n**Trend Context:** The primary trend is currently SLIGHT_UP (Price change: 2.93%, Volume trend: FLAT). Recent price action shows a None (None). \n\n**Current Candle Analysis:**\n- Candle Type: NARROW_UPPER_WICK\n- Volume: AVERAGE\n- Signal: None (None)\n\n**Detected Patterns:** None\n\n**Support/Resistance:**\n- Support Levels: 168.23, 189.01, 164.07, 186.62\n- Resistance Levels: 192.82, 171.92, 187.00, 178.36, 176.03\n\n**Risk-Reward Analysis:**\n- Risk-Reward Ratio: 0.00\n- Suggested Stop Loss: 195.87\n- Suggested Take Profit: 195.87\n\n**Multi-Timeframe Context:**\n- 1h: SIDEWAYS trend, NEUTRAL signal\n\n**Confidence Score:** 50.0/100\n\n**Conclusion:** Based on the SLIGHT_UP trend, the AVERAGE volume on the NARROW_UPPER_WICK candle, a None NEUTRAL signal is generated with a confidence score of 50.0/100.", "confidence_score": 50.0}}
{"input": {"timestamp": "2024-06-06 08:00", "ticker": "AAPL", "primary_timeframe": "1d", "vpa_metrics": {"volume_class": "AVERAGE", "candle_class": "NEUTRAL", "signal_type": null, "signal_strength": null}, "trend_analysis": {"trend_direction": "SIDEWAYS", "price_change_percent": 1.67, "volume_trend": "DECREASING", "signal_type": "CONSOLIDATION", "signal_strength": "NEUTRAL"}, "pattern_analysis": {"accumulation": {"detected": false, "strength": 1, "details": "Sideways: False, High volume count: 0, Support tests: 15"}, "distribution": {"detected": false, "strength": 1, "details": "Sideways: False, High volume count: 0, Resistance tests: 16"}, "testing": {"detected": false, "strength": 1, "details": "Testing low: True, Testing high: True, Low volume: False"}, "buying_climax": {"detected": false, "strength": 2, "details": "Near high: True, Very high volume: False, Wide up candle: False, Upper wick: True"}, "selling_climax": {"detected": false, "strength": 1, "details": "Near low: False, Very high volume: False, Wide down candle: False, Lower wick: True"}}, "support_resistance": {"support_levels": [168.2302, 189.01, 164.075, 186.625], "resistance_levels": [192.8231, 171.92, 187.0, 178.36, 176.03]}, "multi_timeframe_context": {"1h": {"trend_direction": "SIDEWAYS", "signal_strength": "NEUTRAL"}}, "risk_reward": {"risk_reward_ratio": 0, "stop_loss": 194.48, "take_profit": 194.48}, "volatility": 1.4022711035094964, "confidence_score": 50.0}, "output": {"signal": {"type": null, "strength": null}, "explanation": "VPA Analysis for AAPL on 2024-06-06 08:00 (1d):\n\n**Signal:** NEUTRAL (None)\n\n**Trend Context:** The primary trend is currently SIDEWAYS (Price change: 1.67%, Volume trend: DECREASING). Recent price action shows a CONSOLIDATION (NEUTRAL). \n\n**Current Candle Analysis:**\n- Candle Type: NEUTRAL\n- Volume: AVERAGE\n- Signal: None (None)\n\n**Detected Patterns:** None\n\n**Support/Resistance:**\n- Support Levels: 168.23, 189.01, 164.07, 186.62\n- Resistance Levels: 192.82, 171.92, 187.00, 178.36, 176.03\n\n**Risk-Reward Analysis:**\n- Risk-Reward Ratio: 0.00\n- Suggested Stop Loss: 194.48\n- Suggested Take Profit: 194.48\n\n**Multi-Timeframe Context:**\n- 1h: SIDEWAYS trend, NEUTRAL signal\n\n**Confidence Score:** 50.0/100\n\n**Conclusion:** Based on the SIDEWAYS trend, the AVERAGE volume on the NEUTRAL candle, a None NEUTRAL signal is generated with a confidence score of 50.0/100.", "confidence_score": 50.0}}
{"input": {"timestamp": "2024-06-07 08:00", "ticker": "AAPL", "primary_timeframe": "1d", "vpa_metrics": {"volume_class": "AVERAGE", "candle_class": "WIDE", "signal_type": null, "signal_strength": null}, "trend_analysis": {"trend_direction": "SLIGHT_UP", "price_change_percent": 2.41, "volume_trend": "DECREASING", "signal_type": "TREND_ANOMALY", "signal_strength": "BEARISH"}, "pattern_analysis": {"accumulation": {"detected": true, "strength": 2, "details": "Sideways: True, High volume count: 0, Support tests: 15"}, "distribution": {"detected": true, "strength": 2, "details": "Sideways: True, High volume count: 0, Resistance tests: 16"}, "testing": {"detected": false, "strength": 1, "details": "Testing low: True, Testing high: True, Low volume: False"}, "buying_climax": {"detected": false, "strength": 2, "details": "Near high: True, Very high volume: False, Wide up candle: True, Upper wick: False"}, "selling_climax": {"detected": false, "strength": 1, "details": "Near low: False, Very high volume: False, Wide down candle: False, Lower wick: True"}}, "support_resistance": {"support_levels": [168.2302, 189.01, 164.075, 186.625], "resistance_levels": [192.8231, 171.92, 187.0, 178.36, 176.03]}, "multi_timeframe_context": {"1h": {"trend_direction": "SIDEWAYS", "signal_strength": "NEUTRAL"}}, "risk_reward": {"risk_reward_ratio": 0, "stop_loss": 196.89, "take_profit": 196.89}, "volatility": 1.3808297980972575, "confidence_score": 46.875}, "output": {"signal": {"type": null, "strength": null}, "explanation": "VPA Analysis for AAPL on 2024-06-07 08:00 (1d):\n\n**Signal:** NEUTRAL (None)\n\n**Trend Context:** The primary trend is currently SLIGHT_UP (Price change: 2.41%, Volume trend: DECREASING). Recent price action shows a TREND_ANOMALY (BEARISH). \n\n**Current Candle Analysis:**\n- Candle Type: WIDE\n- Volume: AVERAGE\n- Signal: None (None)\n\n**Detected Patterns:**\n- Accumulation (Strength: 2): Sideways: True, High volume count: 0, Support tests: 15\n- Distribution (Strength: 2): Sideways: True, High volume count: 0, Resistance tests: 16\n\n**Support/Resistance:**\n- Support Levels: 168.23, 189.01, 164.07, 186.62\n- Resistance Levels: 192.82, 171.92, 187.00, 178.36, 176.03\n\n**Risk-Reward Analysis:**\n- Risk-Reward Ratio: 0.00\n- Suggested Stop Loss: 196.89\n- Suggested Take Profit: 196.89\n\n**Multi-Timeframe Context:**\n- 1h: SIDEWAYS trend, NEUTRAL signal\n\n**Confidence Score:** 46.9/100\n\n**Conclusion:** Based on the SLIGHT_UP trend, the AVERAGE volume on the WIDE candle, and the presence of accumulation, distribution, a None NEUTRAL signal is generated with a confidence score of 46.9/100.", "confidence_score": 46.875}}
{"input": {"timestamp": "2024-06-10 08:00", "ticker": "AAPL", "primary_timeframe": "1d", "vpa_metrics": {"volume_class": "HIGH", "candle_class": "WIDE", "signal_type": "VALIDATION", "signal_strength": "BEARISH"}, "trend_analysis": {"trend_direction": "SIDEWAYS", "price_change_percent": -0.47, "volume_trend": "INCREASING", "signal_type": "CONSOLIDATION", "signal_strength": "NEUTRAL"}, "pattern_analysis": {"accumulation": {"detected": true, "strength": 2, "details": "Sideways: True, High volume count: 1, Support tests: 14"}, "distribution": {"detected": true, "strength": 2, "details": "Sideways: True, High volume count: 1, Resistance tests: 16"}, "testing": {"detected": false, "strength": 1, "details": "Testing low: True, Testing high: True, Low volume: False"}, "buying_climax": {"detected": true, "strength": 4, "details": "Near high: True, Very high volume: True, Wide up candle: False, Upper wick: True"}, "selling_climax": {"detected": true, "strength": 5, "details": "Near low: True, Very high volume: True, Wide down candle: True, Lower wick: True"}}, "support_resistance": {"support_levels": [189.01, 167.11, 164.075, 169.11, 186.625], "resistance_levels": [192.8231, 171.92, 187.0, 178.36, 176.03]}, "multi_timeframe_context": {"1h": {"trend_direction": "SIDEWAYS", "signal_strength": "NEUTRAL"}}, "risk_reward": {"risk_reward_ratio": 0.42564208782104507, "stop_loss": 202.776, "take_profit": 189.01}, "volatility": 1.4377643570400767, "confidence_score": 47.91666666666666}, "output": {"signal": {"type": "VALIDATION", "strength": "BEARISH"}, "explanation": "VPA Analysis for AAPL on 2024-06-10 08:00 (1d):\n\n**Signal:** SELL (BEARISH)\n\n**Trend Context:** The primary trend is currently SIDEWAYS (Price change: -0.47%, Volume trend: INCREASING). Recent price action shows a CONSOLIDATION (NEUTRAL). \n\n**Current Candle Analysis:**\n- Candle Type: WIDE\n- Volume: HIGH\n- Signal: VALIDATION (BEARISH)\n\n**Detected Patterns:**\n- Accumulation (Strength: 2): Sideways: True, High volume count: 1, Support tests: 14\n- Distribution (Strength: 2): Sideways: True, High volume count: 1, Resistance tests: 16\n- Buying Climax (Strength: 4): Near high: True, Very high volume: True, Wide up candle: False, Upper wick: True\n- Selling Climax (Strength: 5): Near low: True, Very high volume: True, Wide down candle: True, Lower wick: True\n\n**Support/Resistance:**\n- Support Levels: 189.01, 167.11, 164.07, 169.11, 186.62\n- Resistance Levels: 192.82, 171.92, 187.00, 178.36, 176.03\n\n**Risk-Reward Analysis:**\n- Risk-Reward Ratio: 0.43\n- Suggested Stop Loss: 202.78\n- Suggested Take Profit: 189.01\n\n**Multi-Timeframe Context:**\n- 1h: SIDEWAYS trend, NEUTRAL signal\n\n**Confidence Score:** 47.9/100\n\n**Conclusion:** Based on the SIDEWAYS trend, the HIGH volume on the WIDE candle, and the presence of accumulation, distribution, buying_climax, selling_climax, a BEARISH SELL signal is generated with a confidence score of 47.9/100.", "confidence_score": 47.91666666666666}}
{"input": {"timestamp": "2024-06-11 08:00", "ticker": "AAPL", "primary_timeframe": "1d", "vpa_metrics": {"volume_class": "VERY_HIGH", "candle_class": "WIDE", "signal_type": "VALIDATION", "signal_strength": "BULLISH"}, "trend_analysis": {"trend_direction": "UP", "price_change_percent": 6.59, "volume_trend": "INCREASING", "signal_type": "TREND_VALIDATION", "signal_strength": "BULLISH"}, "pattern_analysis": {"accumulation": {"detected": true, "strength": 2, "details": "Sideways: False, High volume count: 2, Support tests: 15"}, "distribution": {"detected": true, "strength": 2, "details": "Sideways: False, High volume count: 2, Resistance tests: 16"}, "testing": {"detected": false, "strength": 1, "details": "Testing low: True, Testing high: False, Low volume: False"}, "buying_climax": {"detected": true, "strength": 4, "details": "Near high: True, Very high volume: True, Wide up candle: True, Upper wick: False"}, "selling_climax": {"detected": true, "strength": 3, "details": "Near low: False, Very high volume: True, Wide down candle: False, Lower wick: True"}}, "support_resistance": {"support_levels": [189.01, 167.11, 164.075, 169.11, 186.625], "resistance_levels": [192.8231, 171.92, 187.0, 178.36, 176.03]}, "multi_timeframe_context": {"1h": {"trend_direction": "SIDEWAYS", "signal_strength": "NEUTRAL"}}, "risk_reward": {"risk_reward_ratio": 1.1419514884233746, "stop_loss": 189.01, "take_profit": 227.86500000000004}, "volatility": 1.6457842651523842, "confidence_score": 54.16666666666667}, "output": {"signal": {"type": "VALIDATION", "strength": "BULLISH"}, "explanation": "VPA Analysis for AAPL on 2024-06-11 08:00 (1d):\n\n**Signal:** BUY (BULLISH)\n\n**Trend Context:** The primary trend is currently UP (Price change: 6.59%, Volume trend: INCREASING). Recent price action shows a TREND_VALIDATION (BULLISH). \n\n**Current Candle Analysis:**\n- Candle Type: WIDE\n- Volume: VERY_HIGH\n- Signal: VALIDATION (BULLISH)\n\n**Detected Patterns:**\n- Accumulation (Strength: 2): Sideways: False, High volume count: 2, Support tests: 15\n- Distribution (Strength: 2): Sideways: False, High volume count: 2, Resistance tests: 16\n- Buying Climax (Strength: 4): Near high: True, Very high volume: True, Wide up candle: True, Upper wick: False\n- Selling Climax (Strength: 3): Near low: False, Very high volume: True, Wide down candle: False, Lower wick: True\n\n**Support/Resistance:**\n- Support Levels: 189.01, 167.11, 164.07, 169.11, 186.62\n- Resistance Levels: 192.82, 171.92, 187.00, 178.36, 176.03\n\n**Risk-Reward Analysis:**\n- Risk-Reward Ratio: 1.14\n- Suggested Stop Loss: 189.01\n- Suggested Take Profit: 227.87\n\n**Multi-Timeframe Context:**\n- 1h: SIDEWAYS trend, NEUTRAL signal\n\n**Confidence Score:** 54.2/100\n\n**Conclusion:** Based on the UP trend, the VERY_HIGH volume on the WIDE candle, and the presence of accumulation, distribution, buying_climax, selling_climax, a BULLISH BUY signal is generated with a confidence score of 54.2/100.", "confidence_score": 54.16666666666667}}
{"input": {"timestamp": "2024-06-12 08:00", "ticker": "AAPL", "primary_timeframe": "1d", "vpa_metrics": {"volume_class": "VERY_HIGH", "candle_class": "WIDE", "signal_type": "VALIDATION", "signal_strength": "BULLISH"}, "trend_analysis": {"trend_direction": "UP", "price_change_percent": 8.78, "volume_trend": "INCREASING", "signal_type": "TREND_VALIDATION", "signal_strength": "BEARISH"}, "pattern_analysis": {"accumulation": {"detected": true, "strength": 2, "details": "Sideways: False, High volume count: 3, Support tests: 14"}, "distribution": {"detected": true, "strength": 2, "details": "Sideways: False, High volume count: 3, Resistance tests: 15"}, "testing": {"detected": false, "strength": 0, "details": "Testing low: False, Testing high: False, Low volume: False"}, "buying_climax": {"detected": true, "strength": 3, "details": "Near high: False, Very high volume: True, Wide up candle: False, Upper wick: True"}, "selling_climax": {"detected": true, "strength": 3, "details": "Near low: False, Very high volume: True, Wide down candle: False, Lower wick: True"}}, "support_resistance": {"support_levels": [189.01, 167.11, 164.075, 169.11, 186.625], "resistance_levels": [192.8231, 187.0, 178.36, 176.03]}, "multi_timeframe_context": {"1h": {"trend_direction": "SIDEWAYS", "signal_strength": "NEUTRAL"}}, "risk_reward": {"risk_reward_ratio": 0.8855777223607654, "stop_loss": 189.01, "take_profit": 234.377}, "volatility": 1.8475667744477378, "confidence_score": 50.0}, "output": {"signal": {"type": "VALIDATION", "strength": "BULLISH"}, "explanation": "VPA Analysis for AAPL on 2024-06-12 08:00 (1d):\n\n**Signal:** BUY (BULLISH)\n\n**Trend Context:** The primary trend is currently UP (Price change: 8.78%, Volume trend: INCREASING). Recent price action shows a TREND_VALIDATION (BEARISH). \n\n**Current Candle Analysis:**\n- Candle Type: WIDE\n- Volume: VERY_HIGH\n- Signal: VALIDATION (BULLISH)\n\n**Detected Patterns:**\n- Accumulation (Strength: 2): Sideways: False, High volume count: 3, Support tests: 14\n- Distribution (Strength: 2): Sideways: False, High volume count: 3, Resistance tests: 15\n- Buying Climax (Strength: 3): Near high: False, Very high volume: True, Wide up candle: False, Upper wick: True\n- Selling Climax (Strength: 3): Near low: False, Very high volume: True, Wide down candle: False, Lower wick: True\n\n**Support/Resistance:**\n- Support Levels: 189.01, 167.11, 164.07, 169.11, 186.62\n- Resistance Levels: 192.82, 187.00, 178.36, 176.03\n\n**Risk-Reward Analysis:**\n- Risk-Reward Ratio: 0.89\n- Suggested Stop Loss: 189.01\n- Suggested Take Profit: 234.38\n\n**Multi-Timeframe Context:**\n- 1h: SIDEWAYS trend, NEUTRAL signal\n\n**Confidence Score:** 50.0/100\n\n**Conclusion:** Based on the UP trend, the VERY_HIGH volume on the WIDE candle, and the presence of accumulation, distribution, buying_climax, selling_climax, a BULLISH BUY signal is generated with a confidence score of 50.0/100.", "confidence_score": 50.0}}
{"input": {"timestamp": "2024-06-13 08:00", "ticker": "AAPL", "primary_timeframe": "1d", "vpa_metrics": {"volume_class": "HIGH", "candle_class": "NARROW_UPPER_WICK_LOWER_WICK", "signal_type": "ANOMALY", "signal_strength": "NEUTRAL"}, "trend_analysis": {"trend_direction": "UP", "price_change_percent": 10.16, "volume_trend": "INCREASING", "signal_type": "TREND_VALIDATION", "signal_strength": "BEARISH"}, "pattern_analysis": {"accumulation": {"detected": true, "strength": 2, "details": "Sideways: False, High volume count: 4, Support tests: 13"}, "distribution": {"detected": true, "strength": 2, "details": "Sideways: False, High volume count: 4, Resistance tests: 15"}, "testing": {"detected": false, "strength": 0, "details": "Testing low: False, Testing high: False, Low volume: False"}, "buying_climax": {"detected": true, "strength": 4, "details": "Near high: True, Very high volume: True, Wide up candle: False, Upper wick: True"}, "selling_climax": {"detected": true, "strength": 3, "details": "Near low: False, Very high volume: True, Wide down candle: False, Lower wick: True"}}, "support_resistance": {"support_levels": [189.01, 167.11, 164.075, 169.11, 186.625], "resistance_levels": [192.8231, 187.0, 178.36, 176.03]}, "multi_timeframe_context": {"1h": {"trend_direction": "SIDEWAYS", "signal_strength": "NEUTRAL"}}, "risk_reward": {"risk_reward_ratio": 0, "stop_loss": 214.24, "take_profit": 214.24}, "volatility": 1.9287444479383697, "confidence_score": 47.91666666666666}, "output": {"signal": {"type": "ANOMALY", "strength": "NEUTRAL"}, "explanation": "VPA Analysis for AAPL on 2024-06-13 08:00 (1d):\n\n**Signal:** NEUTRAL (NEUTRAL)\n\n**Trend Context:** The primary trend is currently UP (Price change: 10.16%, Volume trend: INCREASING). Recent price action shows a TREND_VALIDATION (BEARISH). \n\n**Current Candle Analysis:**\n- Candle Type: NARROW_UPPER_WICK_LOWER_WICK\n- Volume: HIGH\n- Signal: ANOMALY (NEUTRAL)\n\n**Detected Patterns:**\n- Accumulation (Strength: 2): Sideways: False, High volume count: 4, Support tests: 13\n- Distribution (Strength: 2): Sideways: False, High volume count: 4, Resistance tests: 15\n- Buying Climax (Strength: 4): Near high: True, Very high volume: True, Wide up candle: False, Upper wick: True\n- Selling Climax (Strength: 3): Near low: False, Very high volume: True, Wide down candle: False, Lower wick: True\n\n**Support/Resistance:**\n- Support Levels: 189.01, 167.11, 164.07, 169.11, 186.62\n- Resistance Levels: 192.82, 187.00, 178.36, 176.03\n\n**Risk-Reward Analysis:**\n- Risk-Reward Ratio: 0.00\n- Suggested Stop Loss: 214.24\n- Suggested Take Profit: 214.24\n\n**Multi-Timeframe Context:**\n- 1h: SIDEWAYS trend, NEUTRAL signal\n\n**Confidence Score:** 47.9/100\n\n**Conclusion:** Based on the UP trend, the HIGH volume on the NARROW_UPPER_WICK_LOWER_WICK candle, and the presence of accumulation, distribution, buying_climax, selling_climax, a NEUTRAL NEUTRAL signal is generated with a confidence score of 47.9/100.", "confidence_score": 47.91666666666666}}
{"input": {"timestamp": "2024-06-14 08:00", "ticker": "AAPL", "primary_timeframe": "1d", "vpa_metrics": {"volume_class": "AVERAGE", "candle_class": "NEUTRAL", "signal_type": null, "signal_strength": null}, "trend_analysis": {"trend_direction": "UP", "price_change_percent": 7.92, "volume_trend": "INCREASING", "signal_type": "TREND_VALIDATION", "signal_strength": "BEARISH"}, "pattern_analysis": {"accumulation": {"detected": true, "strength": 2, "details": "Sideways: False, High volume count: 4, Support tests: 14"}, "distribution": {"detected": true, "strength": 2, "details": "Sideways: False, High volume count: 4, Resistance tests: 15"}, "testing": {"detected": false, "strength": 1, "details": "Testing low: True, Testing high: True, Low volume: False"}, "buying_climax": {"detected": false, "strength": 1, "details": "Near high: False, Very high volume: False, Wide up candle: False, Upper wick: True"}, "selling_climax": {"detected": false, "strength": 1, "details": "Near low: False, Very high volume: False, Wide down candle: False, Lower wick: True"}}, "support_resistance": {"support_levels": [189.01, 167.11, 164.075, 169.11, 186.625], "resistance_levels": [192.8231, 187.0, 178.36, 176.03, 220.2]}, "multi_timeframe_context": {"1h": {"trend_direction": "SIDEWAYS", "signal_strength": "NEUTRAL"}}, "risk_reward": {"risk_reward_ratio": 0, "stop_loss": 212.49, "take_profit": 212.49}, "volatility": 2.000111460353554, "confidence_score": 46.875}, "output": {"signal": {"type": null, "strength": null}, "explanation": "VPA Analysis for AAPL on 2024-06-14 08:00 (1d):\n\n**Signal:** NEUTRAL (None)\n\n**Trend Context:** The primary trend is currently UP (Price change: 7.92%, Volume trend: INCREASING). Recent price action shows a TREND_VALIDATION (BEARISH). \n\n**Current Candle Analysis:**\n- Candle Type: NEUTRAL\n- Volume: AVERAGE\n- Signal: None (None)\n\n**Detected Patterns:**\n- Accumulation (Strength: 2): Sideways: False, High volume count: 4, Support tests: 14\n- Distribution (Strength: 2): Sideways: False, High volume count: 4, Resistance tests: 15\n\n**Support/Resistance:**\n- Support Levels: 189.01, 167.11, 164.07, 169.11, 186.62\n- Resistance Levels: 192.82, 187.00, 178.36, 176.03, 220.20\n\n**Risk-Reward Analysis:**\n- Risk-Reward Ratio: 0.00\n- Suggested Stop Loss: 212.49\n- Suggested Take Profit: 212.49\n\n**Multi-Timeframe Context:**\n- 1h: SIDEWAYS trend, NEUTRAL signal\n\n**Confidence Score:** 46.9/100\n\n**Conclusion:** Based on the UP trend, the AVERAGE volume on the NEUTRAL candle, and the presence of accumulation, distribution, a None NEUTRAL signal is generated with a confidence score of 46.9/100.", "confidence_score": 46.875}}
{"input": {"timestamp": "2024-06-18 08:00", "ticker": "AAPL", "primary_timeframe": "1d", "vpa_metrics": {"volume_class": "AVERAGE", "candle_class": "WIDE", "signal_type": null, "signal_strength": null}, "trend_analysis": {"trend_direction": "SLIGHT_UP", "price_change_percent": 3.45, "volume_trend": "DECREASING", "signal_type": "TREND_ANOMALY", "signal_strength": "BEARISH"}, "pattern_analysis": {"accumulation": {"detected": true, "strength": 2, "details": "Sideways: False, High volume count: 5, Support tests: 14"}, "distribution": {"detected": true, "strength": 2, "details": "Sideways: False, High volume count: 5, Resistance tests: 14"}, "testing": {"detected": false, "strength": 1, "details": "Testing low: True, Testing high: True, Low volume: False"}, "buying_climax": {"detected": false, "strength": 2, "details": "Near high: True, Very high volume: False, Wide up candle: False, Upper wick: True"}, "selling_climax": {"detected": false, "strength": 1, "details": "Near low: False, Very high volume: False, Wide down candle: False, Lower wick: True"}}, "support_resistance": {"support_levels": [189.01, 164.075, 169.11, 186.625, 192.15], "resistance_levels": [192.8231, 187.0, 178.36, 176.03, 220.2]}, "multi_timeframe_context": {"1h": {"trend_direction": "SIDEWAYS", "signal_strength": "NEUTRAL"}}, "risk_reward": {"risk_reward_ratio": 0, "stop_loss": 214.29, "take_profit": 214.29}, "volatility": 2.164329695862224, "confidence_score": 46.875}, "output": {"signal": {"type": null, "strength": null}, "explanation": "VPA Analysis for AAPL on 2024-06-18 08:00 (1d):\n\n**Signal:** NEUTRAL (None)\n\n**Trend Context:** The primary trend is currently SLIGHT_UP (Price change: 3.45%, Volume trend: DECREASING). Recent price action shows a TREND_ANOMALY (BEARISH). \n\n**Current Candle Analysis:**\n- Candle Type: WIDE\n- Volume: AVERAGE\n- Signal: None (None)\n\n**Detected Patterns:**\n- Accumulation (Strength: 2): Sideways: False, High volume count: 5, Support tests: 14\n- Distribution (Strength: 2): Sideways: False, High volume count: 5, Resistance tests: 14\n\n**Support/Resistance:**\n- Support Levels: 189.01, 164.07, 169.11, 186.62, 192.15\n- Resistance Levels: 192.82, 187.00, 178.36, 176.03, 220.20\n\n**Risk-Reward Analysis:**\n- Risk-Reward Ratio: 0.00\n- Suggested Stop Loss: 214.29\n- Suggested Take Profit: 214.29\n\n**Multi-Timeframe Context:**\n- 1h: SIDEWAYS trend, NEUTRAL signal\n\n**Confidence Score:** 46.9/100\n\n**Conclusion:** Based on the SLIGHT_UP trend, the AVERAGE volume on the WIDE candle, and the presence of accumulation, distribution, a None NEUTRAL signal is generated with a confidence score of 46.9/100.", "confidence_score": 46.875}}
{"input": {"timestamp": "2024-06-20 08:00", "ticker": "AAPL", "primary_timeframe": "1d", "vpa_metrics": {"volume_class": "AVERAGE", "candle_class": "WIDE", "signal_type": null, "signal_strength": null}, "trend_analysis": {"trend_direction": "SIDEWAYS", "price_change_percent": -1.59, "volume_trend": "DECREASING", "signal_type": "CONSOLIDATION", "signal_strength": "NEUTRAL"}, "pattern_analysis": {"accumulation": {"detected": true, "strength": 2, "details": "Sideways: False, High volume count: 5, Support tests: 14"}, "distribution": {"detected": true, "strength": 2, "details": "Sideways: False, High volume count: 5, Resistance tests: 13"}, "testing": {"detected": false, "strength": 1, "details": "Testing low: False, Testing high: True, Low volume: False"}, "buying_climax": {"detected": false, "strength": 1, "details": "Near high: False, Very high volume: False, Wide up candle: False, Upper wick: True"}, "selling_climax": {"detected": false, "strength": 1, "details": "Near low: False, Very high volume: False, Wide down candle: True, Lower wick: False"}}, "support_resistance": {"support_levels": [189.01, 164.075, 169.11, 186.625, 192.15], "resistance_levels": [192.8231, 187.0, 218.95, 178.36, 176.03]}, "multi_timeframe_context": {"1h": {"trend_direction": "SIDEWAYS", "signal_strength": "NEUTRAL"}}, "risk_reward": {"risk_reward_ratio": 0, "stop_loss": 209.68, "take_profit": 209.68}, "volatility": 2.28437820036547, "confidence_score": 50.0}, "output": {"signal": {"type": null, "strength": null}, "explanation": "VPA Analysis for AAPL on 2024-06-20 08:00 (1d):\n\n**Signal:** NEUTRAL (None)\n\n**Trend Context:** The primary trend is currently SIDEWAYS (Price change: -1.59%, Volume trend: DECREASING). Recent price action shows a CONSOLIDATION (NEUTRAL). \n\n**Current Candle Analysis:**\n- Candle Type: WIDE\n- Volume: AVERAGE\n- Signal: None (None)\n\n**Detected Patterns:**\n- Accumulation (Strength: 2): Sideways: False, High volume count: 5, Support tests: 14\n- Distribution (Strength: 2): Sideways: False, High volume count: 5, Resistance tests: 13\n\n**Support/Resistance:**\n- Support Levels: 189.01, 164.07, 169.11, 186.62, 192.15\n- Resistance Levels: 192.82, 187.00, 218.95, 178.36, 176.03\n\n**Risk-Reward Analysis:**\n- Risk-Reward Ratio: 0.00\n- Suggested Stop Loss: 209.68\n- Suggested Take Profit: 209.68\n\n**Multi-Timeframe Context:**\n- 1h: SIDEWAYS trend, NEUTRAL signal\n\n**Confidence Score:** 50.0/100\n\n**Conclusion:** Based on the SIDEWAYS trend, the AVERAGE volume on the WIDE candle, and the presence of accumulation, distribution, a None NEUTRAL signal is generated with a confidence score of 50.0/100.", "confidence_score": 50.0}}
{"input": {"timestamp": "2024-06-21 08:00", "ticker": "AAPL", "primary_timeframe": "1d", "vpa_metrics": {"volume_class": "VERY_HIGH", "candle_class": "NEUTRAL", "signal_type": "VALIDATION", "signal_strength": "BEARISH"}, "trend_analysis": {"trend_direction": "SLIGHT_DOWN", "price_change_percent": -3.15, "volume_trend": "INCREASING", "signal_type": "TREND_VALIDATION", "signal_strength": "BEARISH"}, "pattern_analysis": {"accumulation": {"detected": true, "strength": 2, "details": "Sideways: False, High volume count: 6, Support tests: 14"}, "distribution": {"detected": true, "strength": 2, "details": "Sideways: False, High volume count: 6, Resistance tests: 12"}, "testing": {"detected": false, "strength": 1, "details": "Testing low: True, Testing high: False, Low volume: False"}, "buying_climax": {"detected": true, "strength": 3, "details": "Near high: False, Very high volume: True, Wide up candle: False, Upper wick: True"}, "selling_climax": {"detected": true, "strength": 3, "details": "Near low: False, Very high volume: True, Wide down candle: True, Lower wick: False"}}, "support_resistance": {"support_levels": [189.01, 164.075, 169.11, 186.625, 192.15], "resistance_levels": [192.8231, 187.0, 218.95, 176.03]}, "multi_timeframe_context": {"1h": {"trend_direction": "SIDEWAYS", "signal_strength": "NEUTRAL"}}, "risk_reward": {"risk_reward_ratio": 1.338568935427577, "stop_loss": 218.95, "take_profit": 192.15}, "volatility": 2.3187623499927708, "confidence_score": 45.83333333333333}, "output": {"signal": {"type": "VALIDATION", "strength": "BEARISH"}, "explanation": "VPA Analysis for AAPL on 2024-06-21 08:00 (1d):\n\n**Signal:** SELL (BEARISH)\n\n**Trend Context:** The primary trend is currently SLIGHT_DOWN (Price change: -3.15%, Volume trend: INCREASING). Recent price action shows a TREND_VALIDATION (BEARISH). \n\n**Current Candle Analysis:**\n- Candle Type: NEUTRAL\n- Volume: VERY_HIGH\n- Signal: VALIDATION (BEARISH)\n\n**Detected Patterns:**\n- Accumulation (Strength: 2): Sideways: False, High volume count: 6, Support tests: 14\n- Distribution (Strength: 2): Sideways: False, High volume count: 6, Resistance tests: 12\n- Buying Climax (Strength: 3): Near high: False, Very high volume: True, Wide up candle: False, Upper wick: True\n- Selling Climax (Strength: 3): Near low: False, Very high volume: True, Wide down candle: True, Lower wick: False\n\n**Support/Resistance:**\n- Support Levels: 189.01, 164.07, 169.11, 186.62, 192.15\n- Resistance Levels: 192.82, 187.00, 218.95, 176.03\n\n**Risk-Reward Analysis:**\n- Risk-Reward Ratio: 1.34\n- Suggested Stop Loss: 218.95\n- Suggested Take Profit: 192.15\n\n**Multi-Timeframe Context:**\n- 1h: SIDEWAYS trend, NEUTRAL signal\n\n**Confidence Score:** 45.8/100\n\n**Conclusion:** Based on the SLIGHT_DOWN trend, the VERY_HIGH volume on the NEUTRAL candle, and the presence of accumulation, distribution, buying_climax, selling_climax, a BEARISH SELL signal is generated with a confidence score of 45.8/100.", "confidence_score": 45.83333333333333}}
{"input": {"timestamp": "2024-06-24 08:00", "ticker": "AAPL", "primary_timeframe": "1d", "vpa_metrics": {"volume_class": "AVERAGE", "candle_class": "NARROW_UPPER_WICK_LOWER_WICK", "signal_type": null, "signal_strength": null}, "trend_analysis": {"trend_direction": "SLIGHT_DOWN", "price_change_percent": -2.05, "volume_trend": "INCREASING", "signal_type": "TREND_VALIDATION", "signal_strength": "BEARISH"}, "pattern_analysis": {"accumulation": {"detected": true, "strength": 2, "details": "Sideways: False, High volume count: 6, Support tests: 15"}, "distribution": {"detected": true, "strength": 2, "details": "Sideways: False, High volume count: 6, Resistance tests: 12"}, "testing": {"detected": false, "strength": 1, "details": "Testing low: True, Testing high: True, Low volume: False"}, "buying_climax": {"detected": false, "strength": 1, "details": "Near high: False, Very high volume: False, Wide up candle: False, Upper wick: True"}, "selling_climax": {"detected": false, "strength": 1, "details": "Near low: False, Very high volume: False, Wide down candle: False, Lower wick: True"}}, "support_resistance": {"support_levels": [189.01, 164.075, 169.11, 186.625, 192.15], "resistance_levels": [192.8231, 187.0, 218.95, 176.03]}, "multi_timeframe_context": {"1h": {"trend_direction": "SIDEWAYS", "signal_strength": "NEUTRAL"}}, "risk_reward": {"risk_reward_ratio": 0, "stop_loss": 208.14, "take_profit": 208.14}, "volatility": 2.372461855127874, "confidence_score": 46.875}, "output": {"signal": {"type": null, "strength": null}, "explanation": "VPA Analysis for AAPL on 2024-06-24 08:00 (1d):\n\n**Signal:** NEUTRAL (None)\n\n**Trend Context:** The primary trend is currently SLIGHT_DOWN (Price change: -2.05%, Volume trend: INCREASING). Recent price action shows a TREND_VALIDATION (BEARISH). \n\n**Current Candle Analysis:**\n- Candle Type: NARROW_UPPER_WICK_LOWER_WICK\n- Volume: AVERAGE\n- Signal: None (None)\n\n**Detected Patterns:**\n- Accumulation (Strength: 2): Sideways: False, High volume count: 6, Support tests: 15\n- Distribution (Strength: 2): Sideways: False, High volume count: 6, Resistance tests: 12\n\n**Support/Resistance:**\n- Support Levels: 189.01, 164.07, 169.11, 186.62, 192.15\n- Resistance Levels: 192.82, 187.00, 218.95, 176.03\n\n**Risk-Reward Analysis:**\n- Risk-Reward Ratio: 0.00\n- Suggested Stop Loss: 208.14\n- Suggested Take Profit: 208.14\n\n**Multi-Timeframe Context:**\n- 1h: SIDEWAYS trend, NEUTRAL signal\n\n**Confidence Score:** 46.9/100\n\n**Conclusion:** Based on the SLIGHT_DOWN trend, the AVERAGE volume on the NARROW_UPPER_WICK_LOWER_WICK candle, and the presence of accumulation, distribution, a None NEUTRAL signal is generated with a confidence score of 46.9/100.", "confidence_score": 46.875}}
{"input": {"timestamp": "2024-06-25 08:00", "ticker": "AAPL", "primary_timeframe": "1d", "vpa_metrics": {"volume_class": "AVERAGE", "candle_class": "NARROW_UPPER_WICK_LOWER_WICK", "signal_type": null, "signal_strength": null}, "trend_analysis": {"trend_direction": "SLIGHT_DOWN", "price_change_percent": -3.51, "volume_trend": "DECREASING", "signal_type": "TREND_ANOMALY", "signal_strength": "BULLISH"}, "pattern_analysis": {"accumulation": {"detected": true, "strength": 2, "details": "Sideways: False, High volume count: 6, Support tests: 15"}, "distribution": {"detected": true, "strength": 2, "details": "Sideways: False, High volume count: 6, Resistance tests: 12"}, "testing": {"detected": false, "strength": 1, "details": "Testing low: True, Testing high: True, Low volume: False"}, "buying_climax": {"detected": false, "strength": 1, "details": "Near high: False, Very high volume: False, Wide up candle: False, Upper wick: True"}, "selling_climax": {"detected": false, "strength": 1, "details": "Near low: False, Very high volume: False, Wide down candle: False, Lower wick: True"}}, "support_resistance": {"support_levels": [189.01, 164.075, 169.11, 186.625, 192.15], "resistance_levels": [192.8231, 187.0, 218.95, 176.03]}, "multi_timeframe_context": {"1h": {"trend_direction": "SIDEWAYS", "signal_strength": "NEUTRAL"}}, "risk_reward": {"risk_reward_ratio": 0, "stop_loss": 209.07, "take_profit": 209.07}, "volatility": 2.3452935682584273, "confidence_score": 53.125}, "output": {"signal": {"type": null, "strength": null}, "explanation": "VPA Analysis for AAPL on 2024-06-25 08:00 (1d):\n\n**Signal:** NEUTRAL (None)\n\n**Trend Context:** The primary trend is currently SLIGHT_DOWN (Price change: -3.51%, Volume trend: DECREASING). Recent price action shows a TREND_ANOMALY (BULLISH). \n\n**Current Candle Analysis:**\n- Candle Type: NARROW_UPPER_WICK_LOWER_WICK\n- Volume: AVERAGE\n- Signal: None (None)\n\n**Detected Patterns:**\n- Accumulation (Strength: 2): Sideways: False, High volume count: 6, Support tests: 15\n- Distribution (Strength: 2): Sideways: False, High volume count: 6, Resistance tests: 12\n\n**Support/Resistance:**\n- Support Levels: 189.01, 164.07, 169.11, 186.62, 192.15\n- Resistance Levels: 192.82, 187.00, 218.95, 176.03\n\n**Risk-Reward Analysis:**\n- Risk-Reward Ratio: 0.00\n- Suggested Stop Loss: 209.07\n- Suggested Take Profit: 209.07\n\n**Multi-Timeframe Context:**\n- 1h: SIDEWAYS trend, NEUTRAL signal\n\n**Confidence Score:** 53.1/100\n\n**Conclusion:** Based on the SLIGHT_DOWN trend, the AVERAGE volume on the NARROW_UPPER_WICK_LOWER_WICK candle, and the presence of accumulation, distribution, a None NEUTRAL signal is generated with a confidence score of 53.1/100.", "confidence_score": 53.125}}
{"input": {"timestamp": "2024-06-26 08:00", "ticker": "AAPL", "primary_timeframe": "1d", "vpa_metrics": {"volume_class": "AVERAGE", "candle_class": "NEUTRAL", "signal_type": null, "signal_strength": null}, "trend_analysis": {"trend_direction": "SIDEWAYS", "price_change_percent": -0.49, "volume_trend": "DECREASING", "signal_type": "CONSOLIDATION", "signal_strength": "NEUTRAL"}, "pattern_analysis": {"accumulation": {"detected": true, "strength": 2, "details": "Sideways: False, High volume count: 6, Support tests: 15"}, "distribution": {"detected": true, "strength": 2, "details": "Sideways: False, High volume count: 6, Resistance tests: 12"}, "testing": {"detected": false, "strength": 1, "details": "Testing low: True, Testing high: True, Low volume: False"}, "buying_climax": {"detected": false, "strength": 1, "details": "Near high: False, Very high volume: False, Wide up candle: False, Upper wick: True"}, "selling_climax": {"detected": false, "strength": 1, "details": "Near low: False, Very high volume: False, Wide down candle: False, Lower wick: True"}}, "support_resistance": {"support_levels": [189.01, 164.075, 169.11, 186.625, 192.15], "resistance_levels": [192.8231, 187.0, 218.95, 176.03]}, "multi_timeframe_context": {"1h": {"trend_direction": "SIDEWAYS", "signal_strength": "NEUTRAL"}}, "risk_reward": {"risk_reward_ratio": 0, "stop_loss": 213.25, "take_profit": 213.25}, "volatility": 2.3746726723020912, "confidence_score": 50.0}, "output": {"signal": {"type": null, "strength": null}, "explanation": "VPA Analysis for AAPL on 2024-06-26 08:00 (1d):\n\n**Signal:** NEUTRAL (None)\n\n**Trend Context:** The primary trend is currently SIDEWAYS (Price change: -0.49%, Volume trend: DECREASING). Recent price action shows a CONSOLIDATION (NEUTRAL). \n\n**Current Candle Analysis:**\n- Candle Type: NEUTRAL\n- Volume: AVERAGE\n- Signal: None (None)\n\n**Detected Patterns:**\n- Accumulation (Strength: 2): Sideways: False, High volume count: 6, Support tests: 15\n- Distribution (Strength: 2): Sideways: False, High volume count: 6, Resistance tests: 12\n\n**Support/Resistance:**\n- Support Levels: 189.01, 164.07, 169.11, 186.62, 192.15\n- Resistance Levels: 192.82, 187.00, 218.95, 176.03\n\n**Risk-Reward Analysis:**\n- Risk-Reward Ratio: 0.00\n- Suggested Stop Loss: 213.25\n- Suggested Take Profit: 213.25\n\n**Multi-Timeframe Context:**\n- 1h: SIDEWAYS trend, NEUTRAL signal\n\n**Confidence Score:** 50.0/100\n\n**Conclusion:** Based on the SIDEWAYS trend, the AVERAGE volume on the NEUTRAL candle, and the presence of accumulation, distribution, a None NEUTRAL signal is generated with a confidence score of 50.0/100.", "confidence_score": 50.0}}
{"input": {"timestamp": "2024-06-27 08:00", "ticker": "AAPL", "primary_timeframe": "1d", "vpa_metrics": {"volume_class": "AVERAGE", "candle_class": "NARROW_UPPER_WICK_LOWER_WICK", "signal_type": null, "signal_strength": null}, "trend_analysis": {"trend_direction": "SLIGHT_UP", "price_change_percent": 2.11, "volume_trend": "DECREASING", "signal_type": "TREND_ANOMALY", "signal_strength": "BEARISH"}, "pattern_analysis": {"accumulation": {"detected": true, "strength": 2, "details": "Sideways: False, High volume count: 6, Support tests: 15"}, "distribution": {"detected": true, "strength": 2, "details": "Sideways: False, High volume count: 6, Resistance tests: 12"}, "testing": {"detected": false, "strength": 1, "details": "Testing low: True, Testing high: True, Low volume: False"}, "buying_climax": {"detected": false, "strength": 2, "details": "Near high: True, Very high volume: False, Wide up candle: False, Upper wick: True"}, "selling_climax": {"detected": false, "strength": 1, "details": "Near low: False, Very high volume: False, Wide down candle: False, Lower wick: True"}}, "support_resistance": {"support_levels": [189.01, 164.075, 169.11, 186.625, 192.15], "resistance_levels": [192.8231, 187.0, 218.95, 176.03]}, "multi_timeframe_context": {"1h": {"trend_direction": "SIDEWAYS", "signal_strength": "NEUTRAL"}}, "risk_reward": {"risk_reward_ratio": 0, "stop_loss": 214.1, "take_profit": 214.1}, "volatility": 2.402106738120405, "confidence_score": 46.875}, "output": {"signal": {"type": null, "strength": null}, "explanation": "VPA Analysis for AAPL on 2024-06-27 08:00 (1d):\n\n**Signal:** NEUTRAL (None)\n\n**Trend Context:** The primary trend is currently SLIGHT_UP (Price change: 2.11%, Volume trend: DECREASING). Recent price action shows a TREND_ANOMALY (BEARISH). \n\n**Current Candle Analysis:**\n- Candle Type: NARROW_UPPER_WICK_LOWER_WICK\n- Volume: AVERAGE\n- Signal: None (None)\n\n**Detected Patterns:**\n- Accumulation (Strength: 2): Sideways: False, High volume count: 6, Support tests: 15\n- Distribution (Strength: 2): Sideways: False, High volume count: 6, Resistance tests: 12\n\n**Support/Resistance:**\n- Support Levels: 189.01, 164.07, 169.11, 186.62, 192.15\n- Resistance Levels: 192.82, 187.00, 218.95, 176.03\n\n**Risk-Reward Analysis:**\n- Risk-Reward Ratio: 0.00\n- Suggested Stop Loss: 214.10\n- Suggested Take Profit: 214.10\n\n**Multi-Timeframe Context:**\n- 1h: SIDEWAYS trend, NEUTRAL signal\n\n**Confidence Score:** 46.9/100\n\n**Conclusion:** Based on the SLIGHT_UP trend, the AVERAGE volume on the NARROW_UPPER_WICK_LOWER_WICK candle, and the presence of accumulation, distribution, a None NEUTRAL signal is generated with a confidence score of 46.9/100.", "confidence_score": 46.875}}
{"input": {"timestamp": "2024-06-28 08:00", "ticker": "AAPL", "primary_timeframe": "1d", "vpa_metrics": {"volume_class": "AVERAGE", "candle_class": "WIDE", "signal_type": null, "signal_strength": null}, "trend_analysis": {"trend_direction": "SIDEWAYS", "price_change_percent": 1.51, "volume_trend": "DECREASING", "signal_type": "CONSOLIDATION", "signal_strength": "NEUTRAL"}, "pattern_analysis": {"accumulation": {"detected": true, "strength": 2, "details": "Sideways: False, High volume count: 6, Support tests: 15"}, "distribution": {"detected": true, "strength": 2, "details": "Sideways: False, High volume count: 6, Resistance tests: 12"}, "testing": {"detected": false, "strength": 1, "details": "Testing low: True, Testing high: True, Low volume: False"}, "buying_climax": {"detected": false, "strength": 1, "details": "Near high: False, Very high volume: False, Wide up candle: False, Upper wick: True"}, "selling_climax": {"detected": false, "strength": 1, "details": "Near low: False, Very high volume: False, Wide down candle: True, Lower wick: False"}}, "support_resistance": {"support_levels": [189.01, 169.11, 186.625, 192.15, 206.59], "resistance_levels": [192.8231, 187.0, 218.95, 176.03]}, "multi_timeframe_context": {"1h": {"trend_direction": "SIDEWAYS", "signal_strength": "NEUTRAL"}}, "risk_reward": {"risk_reward_ratio": 0, "stop_loss": 210.62, "take_profit": 210.62}, "volatility": 2.5195113174637274, "confidence_score": 50.0}, "output": {"signal": {"type": null, "strength": null}, "explanation": "VPA Analysis for AAPL on 2024-06-28 08:00 (1d):\n\n**Signal:** NEUTRAL (None)\n\n**Trend Context:** The primary trend is currently SIDEWAYS (Price change: 1.51%, Volume trend: DECREASING). Recent price action shows a CONSOLIDATION (NEUTRAL). \n\n**Current Candle Analysis:**\n- Candle Type: WIDE\n- Volume: AVERAGE\n- Signal: None (None)\n\n**Detected Patterns:**\n- Accumulation (Strength: 2): Sideways: False, High volume count: 6, Support tests: 15\n- Distribution (Strength: 2): Sideways: False, High volume count: 6, Resistance tests: 12\n\n**Support/Resistance:**\n- Support Levels: 189.01, 169.11, 186.62, 192.15, 206.59\n- Resistance Levels: 192.82, 187.00, 218.95, 176.03\n\n**Risk-Reward Analysis:**\n- Risk-Reward Ratio: 0.00\n- Suggested Stop Loss: 210.62\n- Suggested Take Profit: 210.62\n\n**Multi-Timeframe Context:**\n- 1h: SIDEWAYS trend, NEUTRAL signal\n\n**Confidence Score:** 50.0/100\n\n**Conclusion:** Based on the SIDEWAYS trend, the AVERAGE volume on the WIDE candle, and the presence of accumulation, distribution, a None NEUTRAL signal is generated with a confidence score of 50.0/100.", "confidence_score": 50.0}}
{"input": {"timestamp": "2024-07-01 08:00", "ticker": "AAPL", "primary_timeframe": "1d", "vpa_metrics": {"volume_class": "AVERAGE", "candle_class": "WIDE", "signal_type": null, "signal_strength": null}, "trend_analysis": {"trend_direction": "SLIGHT_UP", "price_change_percent": 4.14, "volume_trend": "DECREASING", "signal_type": "TREND_ANOMALY", "signal_strength": "BEARISH"}, "pattern_analysis": {"accumulation": {"detected": true, "strength": 2, "details": "Sideways: False, High volume count: 6, Support tests: 15"}, "distribution": {"detected": true, "strength": 2, "details": "Sideways: False, High volume count: 6, Resistance tests: 12"}, "testing": {"detected": false, "strength": 1, "details": "Testing low: True, Testing high: True, Low volume: False"}, "buying_climax": {"detected": false, "strength": 2, "details": "Near high: True, Very high volume: False, Wide up candle: True, Upper wick: False"}, "selling_climax": {"detected": false, "strength": 1, "details": "Near low: False, Very high volume: False, Wide down candle: False, Lower wick: True"}}, "support_resistance": {"support_levels": [189.01, 169.11, 186.625, 192.15, 206.59], "resistance_levels": [192.8231, 187.0, 218.95, 176.03]}, "multi_timeframe_context": {"1h": {"trend_direction": "SIDEWAYS", "signal_strength": "NEUTRAL"}}, "risk_reward": {"risk_reward_ratio": 0, "stop_loss": 216.75, "take_profit": 216.75}, "volatility": 2.5490268924907404, "confidence_score": 46.875}, "output": {"signal": {"type": null, "strength": null}, "explanation": "VPA Analysis for AAPL on 2024-07-01 08:00 (1d):\n\n**Signal:** NEUTRAL (None)\n\n**Trend Context:** The primary trend is currently SLIGHT_UP (Price change: 4.14%, Volume trend: DECREASING). Recent price action shows a TREND_ANOMALY (BEARISH). \n\n**Current Candle Analysis:**\n- Candle Type: WIDE\n- Volume: AVERAGE\n- Signal: None (None)\n\n**Detected Patterns:**\n- Accumulation (Strength: 2): Sideways: False, High volume count: 6, Support tests: 15\n- Distribution (Strength: 2): Sideways: False, High volume count: 6, Resistance tests: 12\n\n**Support/Resistance:**\n- Support Levels: 189.01, 169.11, 186.62, 192.15, 206.59\n- Resistance Levels: 192.82, 187.00, 218.95, 176.03\n\n**Risk-Reward Analysis:**\n- Risk-Reward Ratio: 0.00\n- Suggested Stop Loss: 216.75\n- Suggested Take Profit: 216.75\n\n**Multi-Timeframe Context:**\n- 1h: SIDEWAYS trend, NEUTRAL signal\n\n**Confidence Score:** 46.9/100\n\n**Conclusion:** Based on the SLIGHT_UP trend, the AVERAGE volume on the WIDE candle, and the presence of accumulation, distribution, a None NEUTRAL signal is generated with a confidence score of 46.9/100.", "confidence_score": 46.875}}
{"input": {"timestamp": "2024-07-02 08:00", "ticker": "AAPL", "primary_timeframe": "1d", "vpa_metrics": {"volume_class": "AVERAGE", "candle_class": "WIDE", "signal_type": null, "signal_strength": null}, "trend_analysis": {"trend_direction": "UP", "price_change_percent": 5.36, "volume_trend": "FLAT", "signal_type": null, "signal_strength": null}, "pattern_analysis": {"accumulation": {"detected": true, "strength": 2, "details": "Sideways: False, High volume count: 6, Support tests: 15"}, "distribution": {"detected": true, "strength": 2, "details": "Sideways: False, High volume count: 6, Resistance tests: 12"}, "testing": {"detected": false, "strength": 0, "details": "Testing low: False, Testing high: False, Low volume: False"}, "buying_climax": {"detected": false, "strength": 2, "details": "Near high: True, Very high volume: False, Wide up candle: True, Upper wick: False"}, "selling_climax": {"detected": false, "strength": 1, "details": "Near low: False, Very high volume: False, Wide down candle: False, Lower wick: True"}}, "support_resistance": {"support_levels": [189.01, 169.11, 186.625, 192.15, 206.59], "resistance_levels": [192.8231, 187.0, 220.2, 176.03]}, "multi_timeframe_context": {"1h": {"trend_direction": "SIDEWAYS", "signal_strength": "NEUTRAL"}}, "risk_reward": {"risk_reward_ratio": 0, "stop_loss": 220.27, "take_profit": 220.27}, "volatility": 2.579836229698956, "confidence_score": 50.0}, "output": {"signal": {"type": null, "strength": null}, "explanation": "VPA Analysis for AAPL on 2024-07-02 08:00 (1d):\n\n**Signal:** NEUTRAL (None)\n\n**Trend Context:** The primary trend is currently UP (Price change: 5.36%, Volume trend: FLAT). Recent price action shows a None (None). \n\n**Current Candle Analysis:**\n- Candle Type: WIDE\n- Volume: AVERAGE\n- Signal: None (None)\n\n**Detected Patterns:**\n- Accumulation (Strength: 2): Sideways: False, High volume count: 6, Support tests: 15\n- Distribution (Strength: 2): Sideways: False, High volume count: 6, Resistance tests: 12\n\n**Support/Resistance:**\n- Support Levels: 189.01, 169.11, 186.62, 192.15, 206.59\n- Resistance Levels: 192.82, 187.00, 220.20, 176.03\n\n**Risk-Reward Analysis:**\n- Risk-Reward Ratio: 0.00\n- Suggested Stop Loss: 220.27\n- Suggested Take Profit: 220.27\n\n**Multi-Timeframe Context:**\n- 1h: SIDEWAYS trend, NEUTRAL signal\n\n**Confidence Score:** 50.0/100\n\n**Conclusion:** Based on the UP trend, the AVERAGE volume on the WIDE candle, and the presence of accumulation, distribution, a None NEUTRAL signal is generated with a confidence score of 50.0/100.", "confidence_score": 50.0}}
{"input": {"timestamp": "2024-07-03 08:00", "ticker": "AAPL", "primary_timeframe": "1d", "vpa_metrics": {"volume_class": "LOW", "candle_class": "NARROW", "signal_type": "VALIDATION", "signal_strength": "NEUTRAL"}, "trend_analysis": {"trend_direction": "SLIGHT_UP", "price_change_percent": 3.89, "volume_trend": "DECREASING", "signal_type": "TREND_ANOMALY", "signal_strength": "BEARISH"}, "pattern_analysis": {"accumulation": {"detected": true, "strength": 2, "details": "Sideways: False, High volume count: 6, Support tests: 14"}, "distribution": {"detected": true, "strength": 2, "details": "Sideways: False, High volume count: 6, Resistance tests: 12"}, "testing": {"detected": true, "strength": 2, "details": "Testing low: False, Testing high: True, Low volume: True"}, "buying_climax": {"detected": false, "strength": 2, "details": "Near high: True, Very high volume: False, Wide up candle: True, Upper wick: False"}, "selling_climax": {"detected": false, "strength": 1, "details": "Near low: False, Very high volume: False, Wide down candle: False, Lower wick: True"}}, "support_resistance": {"support_levels": [189.01, 169.11, 186.625, 192.15, 206.59], "resistance_levels": [192.8231, 187.0, 220.2, 176.03]}, "multi_timeframe_context": {"1h": {"trend_direction": "SIDEWAYS", "signal_strength": "NEUTRAL"}}, "risk_reward": {"risk_reward_ratio": 0, "stop_loss": 221.55, "take_profit": 221.55}, "volatility": 2.564218603380487, "confidence_score": 46.875}, "output": {"signal": {"type": "VALIDATION", "strength": "NEUTRAL"}, "explanation": "VPA Analysis for AAPL on 2024-07-03 08:00 (1d):\n\n**Signal:** NEUTRAL (NEUTRAL)\n\n**Trend Context:** The primary trend is currently SLIGHT_UP (Price change: 3.89%, Volume trend: DECREASING). Recent price action shows a TREND_ANOMALY (BEARISH). \n\n**Current Candle Analysis:**\n- Candle Type: NARROW\n- Volume: LOW\n- Signal: VALIDATION (NEUTRAL)\n\n**Detected Patterns:**\n- Accumulation (Strength: 2): Sideways: False, High volume count: 6, Support tests: 14\n- Distribution (Strength: 2): Sideways: False, High volume count: 6, Resistance tests: 12\n- Testing (Strength: 2): Testing low: False, Testing high: True, Low volume: True\n\n**Support/Resistance:**\n- Support Levels: 189.01, 169.11, 186.62, 192.15, 206.59\n- Resistance Levels: 192.82, 187.00, 220.20, 176.03\n\n**Risk-Reward Analysis:**\n- Risk-Reward Ratio: 0.00\n- Suggested Stop Loss: 221.55\n- Suggested Take Profit: 221.55\n\n**Multi-Timeframe Context:**\n- 1h: SIDEWAYS trend, NEUTRAL signal\n\n**Confidence Score:** 46.9/100\n\n**Conclusion:** Based on the SLIGHT_UP trend, the LOW volume on the NARROW candle, and the presence of accumulation, distribution, testing, a NEUTRAL NEUTRAL signal is generated with a confidence score of 46.9/100.", "confidence_score": 46.875}}
{"input": {"timestamp": "2024-07-05 08:00", "ticker": "AAPL", "primary_timeframe": "1d", "vpa_metrics": {"volume_class": "AVERAGE", "candle_class": "WIDE", "signal_type": null, "signal_strength": null}, "trend_analysis": {"trend_direction": "UP", "price_change_percent": 5.72, "volume_trend": "INCREASING", "signal_type": "TREND_VALIDATION", "signal_strength": "BULLISH"}, "pattern_analysis": {"accumulation": {"detected": true, "strength": 2, "details": "Sideways: False, High volume count: 6, Support tests: 13"}, "distribution": {"detected": true, "strength": 2, "details": "Sideways: False, High volume count: 6, Resistance tests: 11"}, "testing": {"detected": false, "strength": 0, "details": "Testing low: False, Testing high: False, Low volume: False"}, "buying_climax": {"detected": false, "strength": 2, "details": "Near high: True, Very high volume: False, Wide up candle: True, Upper wick: False"}, "selling_climax": {"detected": false, "strength": 1, "details": "Near low: False, Very high volume: False, Wide down candle: False, Lower wick: True"}}, "support_resistance": {"support_levels": [189.01, 169.11, 186.625, 192.15, 206.59], "resistance_levels": [192.8231, 187.0, 220.2, 176.03]}, "multi_timeframe_context": {"1h": {"trend_direction": "SIDEWAYS", "signal_strength": "NEUTRAL"}}, "risk_reward": {"risk_reward_ratio": 0, "stop_loss": 226.34, "take_profit": 226.34}, "volatility": 2.56971347251224, "confidence_score": 53.125}, "output": {"signal": {"type": null, "strength": null}, "explanation": "VPA Analysis for AAPL on 2024-07-05 08:00 (1d):\n\n**Signal:** NEUTRAL (None)\n\n**Trend Context:** The primary trend is currently UP (Price change: 5.72%, Volume trend: INCREASING). Recent price action shows a TREND_VALIDATION (BULLISH). \n\n**Current Candle Analysis:**\n- Candle Type: WIDE\n- Volume: AVERAGE\n- Signal: None (None)\n\n**Detected Patterns:**\n- Accumulation (Strength: 2): Sideways: False, High volume count: 6, Support tests: 13\n- Distribution (Strength: 2): Sideways: False, High volume count: 6, Resistance tests: 11\n\n**Support/Resistance:**\n- Support Levels: 189.01, 169.11, 186.62, 192.15, 206.59\n- Resistance Levels: 192.82, 187.00, 220.20, 176.03\n\n**Risk-Reward Analysis:**\n- Risk-Reward Ratio: 0.00\n- Suggested Stop Loss: 226.34\n- Suggested Take Profit: 226.34\n\n**Multi-Timeframe Context:**\n- 1h: SIDEWAYS trend, NEUTRAL signal\n\n**Confidence Score:** 53.1/100\n\n**Conclusion:** Based on the UP trend, the AVERAGE volume on the WIDE candle, and the presence of accumulation, distribution, a None NEUTRAL signal is generated with a confidence score of 53.1/100.", "confidence_score": 53.125}}
{"input": {"timestamp": "2024-07-08 08:00", "ticker": "AAPL", "primary_timeframe": "1d", "vpa_metrics": {"volume_class": "AVERAGE", "candle_class": "NARROW_LOWER_WICK", "signal_type": null, "signal_strength": null}, "trend_analysis": {"trend_direction": "UP", "price_change_percent": 8.17, "volume_trend": "DECREASING", "signal_type": "TREND_ANOMALY", "signal_strength": "BEARISH"}, "pattern_analysis": {"accumulation": {"detected": true, "strength": 2, "details": "Sideways: False, High volume count: 6, Support tests: 13"}, "distribution": {"detected": true, "strength": 2, "details": "Sideways: False, High volume count: 6, Resistance tests: 11"}, "testing": {"detected": false, "strength": 1, "details": "Testing low: True, Testing high: True, Low volume: False"}, "buying_climax": {"detected": false, "strength": 1, "details": "Near high: True, Very high volume: False, Wide up candle: False, Upper wick: False"}, "selling_climax": {"detected": false, "strength": 1, "details": "Near low: False, Very high volume: False, Wide down candle: False, Lower wick: True"}}, "support_resistance": {"support_levels": [189.01, 169.11, 186.625, 192.15, 206.59], "resistance_levels": [192.8231, 187.0, 220.2, 176.03]}, "multi_timeframe_context": {"1h": {"trend_direction": "SIDEWAYS", "signal_strength": "NEUTRAL"}}, "risk_reward": {"risk_reward_ratio": 0, "stop_loss": 227.82, "take_profit": 227.82}, "volatility": 2.594603773061833, "confidence_score": 46.875}, "output": {"signal": {"type": null, "strength": null}, "explanation": "VPA Analysis for AAPL on 2024-07-08 08:00 (1d):\n\n**Signal:** NEUTRAL (None)\n\n**Trend Context:** The primary trend is currently UP (Price change: 8.17%, Volume trend: DECREASING). Recent price action shows a TREND_ANOMALY (BEARISH). \n\n**Current Candle Analysis:**\n- Candle Type: NARROW_LOWER_WICK\n- Volume: AVERAGE\n- Signal: None (None)\n\n**Detected Patterns:**\n- Accumulation (Strength: 2): Sideways: False, High volume count: 6, Support tests: 13\n- Distribution (Strength: 2): Sideways: False, High volume count: 6, Resistance tests: 11\n\n**Support/Resistance:**\n- Support Levels: 189.01, 169.11, 186.62, 192.15, 206.59\n- Resistance Levels: 192.82, 187.00, 220.20, 176.03\n\n**Risk-Reward Analysis:**\n- Risk-Reward Ratio: 0.00\n- Suggested Stop Loss: 227.82\n- Suggested Take Profit: 227.82\n\n**Multi-Timeframe Context:**\n- 1h: SIDEWAYS trend, NEUTRAL signal\n\n**Confidence Score:** 46.9/100\n\n**Conclusion:** Based on the UP trend, the AVERAGE volume on the NARROW_LOWER_WICK candle, and the presence of accumulation, distribution, a None NEUTRAL signal is generated with a confidence score of 46.9/100.", "confidence_score": 46.875}}
{"input": {"timestamp": "2024-07-09 08:00", "ticker": "AAPL", "primary_timeframe": "1d", "vpa_metrics": {"volume_class": "AVERAGE", "candle_class": "NARROW_LOWER_WICK", "signal_type": null, "signal_strength": null}, "trend_analysis": {"trend_direction": "UP", "price_change_percent": 5.5, "volume_trend": "DECREASING", "signal_type": "TREND_ANOMALY", "signal_strength": "BEARISH"}, "pattern_analysis": {"accumulation": {"detected": true, "strength": 2, "details": "Sideways: False, High volume count: 6, Support tests: 12"}, "distribution": {"detected": true, "strength": 2, "details": "Sideways: False, High volume count: 6, Resistance tests: 11"}, "testing": {"detected": false, "strength": 1, "details": "Testing low: False, Testing high: True, Low volume: False"}, "buying_climax": {"detected": false, "strength": 2, "details": "Near high: True, Very high volume: False, Wide up candle: False, Upper wick: True"}, "selling_climax": {"detected": false, "strength": 1, "details": "Near low: False, Very high volume: False, Wide down candle: False, Lower wick: True"}}, "support_resistance": {"support_levels": [189.01, 169.11, 186.625, 192.15, 206.59], "resistance_levels": [192.8231, 187.0, 220.2]}, "multi_timeframe_context": {"1h": {"trend_direction": "SIDEWAYS", "signal_strength": "NEUTRAL"}}, "risk_reward": {"risk_reward_ratio": 0, "stop_loss": 228.68, "take_profit": 228.68}, "volatility": 2.5360052659197376, "confidence_score": 46.875}, "output": {"signal": {"type": null, "strength": null}, "explanation": "VPA Analysis for AAPL on 2024-07-09 08:00 (1d):\n\n**Signal:** NEUTRAL (None)\n\n**Trend Context:** The primary trend is currently UP (Price change: 5.5%, Volume trend: DECREASING). Recent price action shows a TREND_ANOMALY (BEARISH). \n\n**Current Candle Analysis:**\n- Candle Type: NARROW_LOWER_WICK\n- Volume: AVERAGE\n- Signal: None (None)\n\n**Detected Patterns:**\n- Accumulation (Strength: 2): Sideways: False, High volume count: 6, Support tests: 12\n- Distribution (Strength: 2): Sideways: False, High volume count: 6, Resistance tests: 11\n\n**Support/Resistance:**\n- Support Levels: 189.01, 169.11, 186.62, 192.15, 206.59\n- Resistance Levels: 192.82, 187.00, 220.20\n\n**Risk-Reward Analysis:**\n- Risk-Reward Ratio: 0.00\n- Suggested Stop Loss: 228.68\n- Suggested Take Profit: 228.68\n\n**Multi-Timeframe Context:**\n- 1h: SIDEWAYS trend, NEUTRAL signal\n\n**Confidence Score:** 46.9/100\n\n**Conclusion:** Based on the UP trend, the AVERAGE volume on the NARROW_LOWER_WICK candle, and the presence of accumulation, distribution, a None NEUTRAL signal is generated with a confidence score of 46.9/100.", "confidence_score": 46.875}}
{"input": {"timestamp": "2024-07-10 08:00", "ticker": "AAPL", "primary_timeframe": "1d", "vpa_metrics": {"volume_class": "AVERAGE", "candle_class": "NEUTRAL", "signal_type": null, "signal_strength": null}, "trend_analysis": {"trend_direction": "UP", "price_change_percent": 5.77, "volume_trend": "FLAT", "signal_type": null, "signal_strength": null}, "pattern_analysis": {"accumulation": {"detected": true, "strength": 2, "details": "Sideways: False, High volume count: 6, Support tests: 12"}, "distribution": {"detected": true, "strength": 2, "details": "Sideways: False, High volume count: 6, Resistance tests: 10"}, "testing": {"detected": false, "strength": 0, "details": "Testing low: False, Testing high: False, Low volume: False"}, "buying_climax": {"detected": false, "strength": 2, "details": "Near high: True, Very high volume: False, Wide up candle: True, Upper wick: False"}, "selling_climax": {"detected": false, "strength": 1, "details": "Near low: False, Very high volume: False, Wide down candle: False, Lower wick: True"}}, "support_resistance": {"support_levels": [189.01, 169.11, 186.625, 192.15, 206.59], "resistance_levels": [192.8231, 187.0, 220.2]}, "multi_timeframe_context": {"1h": {"trend_direction": "SIDEWAYS", "signal_strength": "NEUTRAL"}}, "risk_reward": {"risk_reward_ratio": 0, "stop_loss": 232.98, "take_profit": 232.98}, "volatility": 2.271426054190328, "confidence_score": 50.0}, "output": {"signal": {"type": null, "strength": null}, "explanation": "VPA Analysis for AAPL on 2024-07-10 08:00 (1d):\n\n**Signal:** NEUTRAL (None)\n\n**Trend Context:** The primary trend is currently UP (Price change: 5.77%, Volume trend: FLAT). Recent price action shows a None (None). \n\n**Current Candle Analysis:**\n- Candle Type: NEUTRAL\n- Volume: AVERAGE\n- Signal: None (None)\n\n**Detected Patterns:**\n- Accumulation (Strength: 2): Sideways: False, High volume count: 6, Support tests: 12\n- Distribution (Strength: 2): Sideways: False, High volume count: 6, Resistance tests: 10\n\n**Support/Resistance:**\n- Support Levels: 189.01, 169.11, 186.62, 192.15, 206.59\n- Resistance Levels: 192.82, 187.00, 220.20\n\n**Risk-Reward Analysis:**\n- Risk-Reward Ratio: 0.00\n- Suggested Stop Loss: 232.98\n- Suggested Take Profit: 232.98\n\n**Multi-Timeframe Context:**\n- 1h: SIDEWAYS trend, NEUTRAL signal\n\n**Confidence Score:** 50.0/100\n\n**Conclusion:** Based on the UP trend, the AVERAGE volume on the NEUTRAL candle, and the presence of accumulation, distribution, a None NEUTRAL signal is generated with a confidence score of 50.0/100.", "confidence_score": 50.0}}
{"input": {"timestamp": "2024-07-11 08:00", "ticker": "AAPL", "primary_timeframe": "1d", "vpa_metrics": {"volume_class": "AVERAGE", "candle_class": "WIDE", "signal_type": null, "signal_strength": null}, "trend_analysis": {"trend_direction": "SLIGHT_UP", "price_change_percent": 2.72, "volume_trend": "INCREASING", "signal_type": "TREND_VALIDATION", "signal_strength": "BULLISH"}, "pattern_analysis": {"accumulation": {"detected": true, "strength": 2, "details": "Sideways: False, High volume count: 5, Support tests: 11"}, "distribution": {"detected": true, "strength": 2, "details": "Sideways: False, High volume count: 5, Resistance tests: 11"}, "testing": {"detected": false, "strength": 1, "details": "Testing low: True, Testing high: True, Low volume: False"}, "buying_climax": {"detected": false, "strength": 2, "details": "Near high: True, Very high volume: False, Wide up candle: False, Upper wick: True"}, "selling_climax": {"detected": false, "strength": 1, "details": "Near low: False, Very high volume: False, Wide down candle: False, Lower wick: True"}}, "support_resistance": {"support_levels": [189.01, 186.625, 192.15, 206.59, 210.3], "resistance_levels": [192.8231, 187.0, 220.2]}, "multi_timeframe_context": {"1h": {"trend_direction": "SIDEWAYS", "signal_strength": "NEUTRAL"}}, "risk_reward": {"risk_reward_ratio": 0, "stop_loss": 227.57, "take_profit": 227.57}, "volatility": 2.184577099469681, "confidence_score": 53.125}, "output": {"signal": {"type": null, "strength": null}, "explanation": "VPA Analysis for AAPL on 2024-07-11 08:00 (1d):\n\n**Signal:** NEUTRAL (None)\n\n**Trend Context:** The primary trend is currently SLIGHT_UP (Price change: 2.72%, Volume trend: INCREASING). Recent price action shows a TREND_VALIDATION (BULLISH). \n\n**Current Candle Analysis:**\n- Candle Type: WIDE\n- Volume: AVERAGE\n- Signal: None (None)\n\n**Detected Patterns:**\n- Accumulation (Strength: 2): Sideways: False, High volume count: 5, Support tests: 11\n- Distribution (Strength: 2): Sideways: False, High volume count: 5, Resistance tests: 11\n\n**Support/Resistance:**\n- Support Levels: 189.01, 186.62, 192.15, 206.59, 210.30\n- Resistance Levels: 192.82, 187.00, 220.20\n\n**Risk-Reward Analysis:**\n- Risk-Reward Ratio: 0.00\n- Suggested Stop Loss: 227.57\n- Suggested Take Profit: 227.57\n\n**Multi-Timeframe Context:**\n- 1h: SIDEWAYS trend, NEUTRAL signal\n\n**Confidence Score:** 53.1/100\n\n**Conclusion:** Based on the SLIGHT_UP trend, the AVERAGE volume on the WIDE candle, and the presence of accumulation, distribution, a None NEUTRAL signal is generated with a confidence score of 53.1/100.", "confidence_score": 53.125}}
{"input": {"timestamp": "2024-07-12 08:00", "ticker": "AAPL", "primary_timeframe": "1d", "vpa_metrics": {"volume_class": "AVERAGE", "candle_class": "NEUTRAL", "signal_type": null, "signal_strength": null}, "trend_analysis": {"trend_direction": "SIDEWAYS", "price_change_percent": 1.86, "volume_trend": "DECREASING", "signal_type": "CONSOLIDATION", "signal_strength": "NEUTRAL"}, "pattern_analysis": {"accumulation": {"detected": true, "strength": 2, "details": "Sideways: False, High volume count: 4, Support tests: 11"}, "distribution": {"detected": true, "strength": 2, "details": "Sideways: False, High volume count: 4, Resistance tests: 12"}, "testing": {"detected": false, "strength": 1, "details": "Testing low: True, Testing high: True, Low volume: False"}, "buying_climax": {"detected": false, "strength": 2, "details": "Near high: True, Very high volume: False, Wide up candle: False, Upper wick: True"}, "selling_climax": {"detected": false, "strength": 1, "details": "Near low: False, Very high volume: False, Wide down candle: False, Lower wick: True"}}, "support_resistance": {"support_levels": [189.01, 186.625, 192.15, 206.59, 210.3], "resistance_levels": [192.8231, 233.08, 187.0, 220.2]}, "multi_timeframe_context": {"1h": {"trend_direction": "SIDEWAYS", "signal_strength": "NEUTRAL"}}, "risk_reward": {"risk_reward_ratio": 0, "stop_loss": 230.54, "take_profit": 230.54}, "volatility": 2.154607260756208, "confidence_score": 50.0}, "output": {"signal": {"type": null, "strength": null}, "explanation": "VPA Analysis for AAPL on 2024-07-12 08:00 (1d):\n\n**Signal:** NEUTRAL (None)\n\n**Trend Context:** The primary trend is currently SIDEWAYS (Price change: 1.86%, Volume trend: DECREASING). Recent price action shows a CONSOLIDATION (NEUTRAL). \n\n**Current Candle Analysis:**\n- Candle Type: NEUTRAL\n- Volume: AVERAGE\n- Signal: None (None)\n\n**Detected Patterns:**\n- Accumulation (Strength: 2): Sideways: False, High volume count: 4, Support tests: 11\n- Distribution (Strength: 2): Sideways: False, High volume count: 4, Resistance tests: 12\n\n**Support/Resistance:**\n- Support Levels: 189.01, 186.62, 192.15, 206.59, 210.30\n- Resistance Levels: 192.82, 233.08, 187.00, 220.20\n\n**Risk-Reward Analysis:**\n- Risk-Reward Ratio: 0.00\n- Suggested Stop Loss: 230.54\n- Suggested Take Profit: 230.54\n\n**Multi-Timeframe Context:**\n- 1h: SIDEWAYS trend, NEUTRAL signal\n\n**Confidence Score:** 50.0/100\n\n**Conclusion:** Based on the SIDEWAYS trend, the AVERAGE volume on the NEUTRAL candle, and the presence of accumulation, distribution, a None NEUTRAL signal is generated with a confidence score of 50.0/100.", "confidence_score": 50.0}}
{"input": {"timestamp": "2024-07-15 08:00", "ticker": "AAPL", "primary_timeframe": "1d", "vpa_metrics": {"volume_class": "AVERAGE", "candle_class": "NEUTRAL", "signal_type": null, "signal_strength": null}, "trend_analysis": {"trend_direction": "SLIGHT_UP", "price_change_percent": 2.89, "volume_trend": "FLAT", "signal_type": null, "signal_strength": null}, "pattern_analysis": {"accumulation": {"detected": true, "strength": 2, "details": "Sideways: False, High volume count: 3, Support tests: 11"}, "distribution": {"detected": true, "strength": 2, "details": "Sideways: False, High volume count: 3, Resistance tests: 12"}, "testing": {"detected": false, "strength": 0, "details": "Testing low: False, Testing high: False, Low volume: False"}, "buying_climax": {"detected": false, "strength": 2, "details": "Near high: True, Very high volume: False, Wide up candle: False, Upper wick: True"}, "selling_climax": {"detected": false, "strength": 1, "details": "Near low: False, Very high volume: False, Wide down candle: False, Lower wick: True"}}, "support_resistance": {"support_levels": [189.01, 186.625, 192.15, 206.59, 210.3], "resistance_levels": [192.8231, 233.08, 220.2]}, "multi_timeframe_context": {"1h": {"trend_direction": "SIDEWAYS", "signal_strength": "NEUTRAL"}}, "risk_reward": {"risk_reward_ratio": 0, "stop_loss": 234.4, "take_profit": 234.4}, "volatility": 2.1824456619364088, "confidence_score": 50.0}, "output": {"signal": {"type": null, "strength": null}, "explanation": "VPA Analysis for AAPL on 2024-07-15 08:00 (1d):\n\n**Signal:** NEUTRAL (None)\n\n**Trend Context:** The primary trend is currently SLIGHT_UP (Price change: 2.89%, Volume trend: FLAT). Recent price action shows a None (None). \n\n**Current Candle Analysis:**\n- Candle Type: NEUTRAL\n- Volume: AVERAGE\n- Signal: None (None)\n\n**Detected Patterns:**\n- Accumulation (Strength: 2): Sideways: False, High volume count: 3, Support tests: 11\n- Distribution (Strength: 2): Sideways: False, High volume count: 3, Resistance tests: 12\n\n**Support/Resistance:**\n- Support Levels: 189.01, 186.62, 192.15, 206.59, 210.30\n- Resistance Levels: 192.82, 233.08, 220.20\n\n**Risk-Reward Analysis:**\n- Risk-Reward Ratio: 0.00\n- Suggested Stop Loss: 234.40\n- Suggested Take Profit: 234.40\n\n**Multi-Timeframe Context:**\n- 1h: SIDEWAYS trend, NEUTRAL signal\n\n**Confidence Score:** 50.0/100\n\n**Conclusion:** Based on the SLIGHT_UP trend, the AVERAGE volume on the NEUTRAL candle, and the presence of accumulation, distribution, a None NEUTRAL signal is generated with a confidence score of 50.0/100.", "confidence_score": 50.0}}
{"input": {"timestamp": "2024-07-16 08:00", "ticker": "AAPL", "primary_timeframe": "1d", "vpa_metrics": {"volume_class": "LOW", "candle_class": "NARROW_UPPER_WICK_LOWER_WICK", "signal_type": "VALIDATION", "signal_strength": "NEUTRAL"}, "trend_analysis": {"trend_direction": "SLIGHT_UP", "price_change_percent": 2.68, "volume_trend": "DECREASING", "signal_type": "TREND_ANOMALY", "signal_strength": "BEARISH"}, "pattern_analysis": {"accumulation": {"detected": true, "strength": 2, "details": "Sideways: False, High volume count: 2, Support tests: 11"}, "distribution": {"detected": true, "strength": 2, "details": "Sideways: False, High volume count: 2, Resistance tests: 12"}, "testing": {"detected": true, "strength": 2, "details": "Testing low: True, Testing high: True, Low volume: True"}, "buying_climax": {"detected": false, "strength": 2, "details": "Near high: True, Very high volume: False, Wide up candle: False, Upper wick: True"}, "selling_climax": {"detected": false, "strength": 1, "details": "Near low: False, Very high volume: False, Wide down candle: False, Lower wick: True"}}, "support_resistance": {"support_levels": [189.01, 186.625, 192.15, 206.59, 210.3], "resistance_levels": [192.8231, 233.08, 220.2]}, "multi_timeframe_context": {"1h": {"trend_direction": "SIDEWAYS", "signal_strength": "NEUTRAL"}}, "risk_reward": {"risk_reward_ratio": 0, "stop_loss": 234.82, "take_profit": 234.82}, "volatility": 2.122059898063016, "confidence_score": 46.875}, "output": {"signal": {"type": "VALIDATION", "strength": "NEUTRAL"}, "explanation": "VPA Analysis for AAPL on 2024-07-16 08:00 (1d):\n\n**Signal:** NEUTRAL (NEUTRAL)\n\n**Trend Context:** The primary trend is currently SLIGHT_UP (Price change: 2.68%, Volume trend: DECREASING). Recent price action shows a TREND_ANOMALY (BEARISH). \n\n**Current Candle Analysis:**\n- Candle Type: NARROW_UPPER_WICK_LOWER_WICK\n- Volume: LOW\n- Signal: VALIDATION (NEUTRAL)\n\n**Detected Patterns:**\n- Accumulation (Strength: 2): Sideways: False, High volume count: 2, Support tests: 11\n- Distribution (Strength: 2): Sideways: False, High volume count: 2, Resistance tests: 12\n- Testing (Strength: 2): Testing low: True, Testing high: True, Low volume: True\n\n**Support/Resistance:**\n- Support Levels: 189.01, 186.62, 192.15, 206.59, 210.30\n- Resistance Levels: 192.82, 233.08, 220.20\n\n**Risk-Reward Analysis:**\n- Risk-Reward Ratio: 0.00\n- Suggested Stop Loss: 234.82\n- Suggested Take Profit: 234.82\n\n**Multi-Timeframe Context:**\n- 1h: SIDEWAYS trend, NEUTRAL signal\n\n**Confidence Score:** 46.9/100\n\n**Conclusion:** Based on the SLIGHT_UP trend, the LOW volume on the NARROW_UPPER_WICK_LOWER_WICK candle, and the presence of accumulation, distribution, testing, a NEUTRAL NEUTRAL signal is generated with a confidence score of 46.9/100.", "confidence_score": 46.875}}
{"input": {"timestamp": "2024-07-17 08:00", "ticker": "AAPL", "primary_timeframe": "1d", "vpa_metrics": {"volume_class": "AVERAGE", "candle_class": "NARROW_UPPER_WICK_LOWER_WICK", "signal_type": null, "signal_strength": null}, "trend_analysis": {"trend_direction": "SIDEWAYS", "price_change_percent": -1.76, "volume_trend": "FLAT", "signal_type": "CONSOLIDATION", "signal_strength": "NEUTRAL"}, "pattern_analysis": {"accumulation": {"detected": true, "strength": 2, "details": "Sideways: False, High volume count: 2, Support tests: 10"}, "distribution": {"detected": true, "strength": 2, "details": "Sideways: False, High volume count: 2, Resistance tests: 12"}, "testing": {"detected": false, "strength": 1, "details": "Testing low: True, Testing high: True, Low volume: False"}, "buying_climax": {"detected": false, "strength": 1, "details": "Near high: False, Very high volume: False, Wide up candle: False, Upper wick: True"}, "selling_climax": {"detected": false, "strength": 1, "details": "Near low: False, Very high volume: False, Wide down candle: False, Lower wick: True"}}, "support_resistance": {"support_levels": [189.01, 225.77, 186.625, 192.15, 206.59], "resistance_levels": [192.8231, 233.08, 220.2, 237.23]}, "multi_timeframe_context": {"1h": {"trend_direction": "SIDEWAYS", "signal_strength": "NEUTRAL"}}, "risk_reward": {"risk_reward_ratio": 0, "stop_loss": 228.88, "take_profit": 228.88}, "volatility": 2.2357705255799396, "confidence_score": 50.0}, "output": {"signal": {"type": null, "strength": null}, "explanation": "VPA Analysis for AAPL on 2024-07-17 08:00 (1d):\n\n**Signal:** NEUTRAL (None)\n\n**Trend Context:** The primary trend is currently SIDEWAYS (Price change: -1.76%, Volume trend: FLAT). Recent price action shows a CONSOLIDATION (NEUTRAL). \n\n**Current Candle Analysis:**\n- Candle Type: NARROW_UPPER_WICK_LOWER_WICK\n- Volume: AVERAGE\n- Signal: None (None)\n\n**Detected Patterns:**\n- Accumulation (Strength: 2): Sideways: False, High volume count: 2, Support tests: 10\n- Distribution (Strength: 2): Sideways: False, High volume count: 2, Resistance tests: 12\n\n**Support/Resistance:**\n- Support Levels: 189.01, 225.77, 186.62, 192.15, 206.59\n- Resistance Levels: 192.82, 233.08, 220.20, 237.23\n\n**Risk-Reward Analysis:**\n- Risk-Reward Ratio: 0.00\n- Suggested Stop Loss: 228.88\n- Suggested Take Profit: 228.88\n\n**Multi-Timeframe Context:**\n- 1h: SIDEWAYS trend, NEUTRAL signal\n\n**Confidence Score:** 50.0/100\n\n**Conclusion:** Based on the SIDEWAYS trend, the AVERAGE volume on the NARROW_UPPER_WICK_LOWER_WICK candle, and the presence of accumulation, distribution, a None NEUTRAL signal is generated with a confidence score of 50.0/100.", "confidence_score": 50.0}}
{"input": {"timestamp": "2024-07-18 08:00", "ticker": "AAPL", "primary_timeframe": "1d", "vpa_metrics": {"volume_class": "AVERAGE", "candle_class": "WIDE", "signal_type": null, "signal_strength": null}, "trend_analysis": {"trend_direction": "SIDEWAYS", "price_change_percent": -1.49, "volume_trend": "FLAT", "signal_type": "CONSOLIDATION", "signal_strength": "NEUTRAL"}, "pattern_analysis": {"accumulation": {"detected": false, "strength": 1, "details": "Sideways: False, High volume count: 1, Support tests: 9"}, "distribution": {"detected": false, "strength": 1, "details": "Sideways: False, High volume count: 1, Resistance tests: 12"}, "testing": {"detected": false, "strength": 1, "details": "Testing low: False, Testing high: True, Low volume: False"}, "buying_climax": {"detected": false, "strength": 1, "details": "Near high: False, Very high volume: False, Wide up candle: False, Upper wick: True"}, "selling_climax": {"detected": false, "strength": 2, "details": "Near low: False, Very high volume: False, Wide down candle: True, Lower wick: True"}}, "support_resistance": {"support_levels": [189.01, 225.77, 186.625, 192.15, 206.59], "resistance_levels": [192.8231, 233.08, 220.2, 237.23]}, "multi_timeframe_context": {"1h": {"trend_direction": "SIDEWAYS", "signal_strength": "NEUTRAL"}}, "risk_reward": {"risk_reward_ratio": 0, "stop_loss": 224.18, "take_profit": 224.18}, "volatility": 2.346737349216558, "confidence_score": 50.0}, "output": {"signal": {"type": null, "strength": null}, "explanation": "VPA Analysis for AAPL on 2024-07-18 08:00 (1d):\n\n**Signal:** NEUTRAL (None)\n\n**Trend Context:** The primary trend is currently SIDEWAYS (Price change: -1.49%, Volume trend: FLAT). Recent price action shows a CONSOLIDATION (NEUTRAL). \n\n**Current Candle Analysis:**\n- Candle Type: WIDE\n- Volume: AVERAGE\n- Signal: None (None)\n\n**Detected Patterns:** None\n\n**Support/Resistance:**\n- Support Levels: 189.01, 225.77, 186.62, 192.15, 206.59\n- Resistance Levels: 192.82, 233.08, 220.20, 237.23\n\n**Risk-Reward Analysis:**\n- Risk-Reward Ratio: 0.00\n- Suggested Stop Loss: 224.18\n- Suggested Take Profit: 224.18\n\n**Multi-Timeframe Context:**\n- 1h: SIDEWAYS trend, NEUTRAL signal\n\n**Confidence Score:** 50.0/100\n\n**Conclusion:** Based on the SIDEWAYS trend, the AVERAGE volume on the WIDE candle, a None NEUTRAL signal is generated with a confidence score of 50.0/100.", "confidence_score": 50.0}}
{"input": {"timestamp": "2024-07-19 08:00", "ticker": "AAPL", "primary_timeframe": "1d", "vpa_metrics": {"volume_class": "AVERAGE", "candle_class": "NARROW_UPPER_WICK_LOWER_WICK", "signal_type": null, "signal_strength": null}, "trend_analysis": {"trend_direction": "SLIGHT_DOWN", "price_change_percent": -2.7, "volume_trend": "FLAT", "signal_type": null, "signal_strength": null}, "pattern_analysis": {"accumulation": {"detected": false, "strength": 1, "details": "Sideways: False, High volume count: 1, Support tests: 10"}, "distribution": {"detected": false, "strength": 1, "details": "Sideways: False, High volume count: 1, Resistance tests: 12"}, "testing": {"detected": false, "strength": 1, "details": "Testing low: True, Testing high: False, Low volume: False"}, "buying_climax": {"detected": false, "strength": 1, "details": "Near high: False, Very high volume: False, Wide up candle: False, Upper wick: True"}, "selling_climax": {"detected": false, "strength": 1, "details": "Near low: False, Very high volume: False, Wide down candle: False, Lower wick: True"}}, "support_resistance": {"support_levels": [189.01, 225.77, 186.625, 192.15, 206.59], "resistance_levels": [192.8231, 233.08, 220.2, 237.23]}, "multi_timeframe_context": {"1h": {"trend_direction": "SIDEWAYS", "signal_strength": "NEUTRAL"}}, "risk_reward": {"risk_reward_ratio": 0, "stop_loss": 224.31, "take_profit": 224.31}, "volatility": 2.3159302562947413, "confidence_score": 50.0}, "output": {"signal": {"type": null, "strength": null}, "explanation": "VPA Analysis for AAPL on 2024-07-19 08:00 (1d):\n\n**Signal:** NEUTRAL (None)\n\n**Trend Context:** The primary trend is currently SLIGHT_DOWN (Price change: -2.7%, Volume trend: FLAT). Recent price action shows a None (None). \n\n**Current Candle Analysis:**\n- Candle Type: NARROW_UPPER_WICK_LOWER_WICK\n- Volume: AVERAGE\n- Signal: None (None)\n\n**Detected Patterns:** None\n\n**Support/Resistance:**\n- Support Levels: 189.01, 225.77, 186.62, 192.15, 206.59\n- Resistance Levels: 192.82, 233.08, 220.20, 237.23\n\n**Risk-Reward Analysis:**\n- Risk-Reward Ratio: 0.00\n- Suggested Stop Loss: 224.31\n- Suggested Take Profit: 224.31\n\n**Multi-Timeframe Context:**\n- 1h: SIDEWAYS trend, NEUTRAL signal\n\n**Confidence Score:** 50.0/100\n\n**Conclusion:** Based on the SLIGHT_DOWN trend, the AVERAGE volume on the NARROW_UPPER_WICK_LOWER_WICK candle, a None NEUTRAL signal is generated with a confidence score of 50.0/100.", "confidence_score": 50.0}}
{"input": {"timestamp": "2024-07-22 08:00", "ticker": "AAPL", "primary_timeframe": "1d", "vpa_metrics": {"volume_class": "AVERAGE", "candle_class": "WIDE", "signal_type": null, "signal_strength": null}, "trend_analysis": {"trend_direction": "SLIGHT_DOWN", "price_change_percent": -4.45, "volume_trend": "DECREASING", "signal_type": "TREND_ANOMALY", "signal_strength": "BULLISH"}, "pattern_analysis": {"accumulation": {"detected": false, "strength": 1, "details": "Sideways: False, High volume count: 1, Support tests: 10"}, "distribution": {"detected": false, "strength": 1, "details": "Sideways: False, High volume count: 1, Resistance tests: 13"}, "testing": {"detected": false, "strength": 1, "details": "Testing low: True, Testing high: True, Low volume: False"}, "buying_climax": {"detected": false, "strength": 1, "details": "Near high: False, Very high volume: False, Wide up candle: False, Upper wick: True"}, "selling_climax": {"detected": false, "strength": 2, "details": "Near low: False, Very high volume: False, Wide down candle: True, Lower wick: True"}}, "support_resistance": {"support_levels": [189.01, 222.27, 225.77, 186.625, 192.15], "resistance_levels": [192.8231, 233.08, 220.2, 237.23]}, "multi_timeframe_context": {"1h": {"trend_direction": "SIDEWAYS", "signal_strength": "NEUTRAL"}}, "risk_reward": {"risk_reward_ratio": 0, "stop_loss": 223.96, "take_profit": 223.96}, "volatility": 2.2861789229279657, "confidence_score": 54.166666666666664}, "output": {"signal": {"type": null, "strength": null}, "explanation": "VPA Analysis for AAPL on 2024-07-22 08:00 (1d):\n\n**Signal:** NEUTRAL (None)\n\n**Trend Context:** The primary trend is currently SLIGHT_DOWN (Price change: -4.45%, Volume trend: DECREASING). Recent price action shows a TREND_ANOMALY (BULLISH). \n\n**Current Candle Analysis:**\n- Candle Type: WIDE\n- Volume: AVERAGE\n- Signal: None (None)\n\n**Detected Patterns:** None\n\n**Support/Resistance:**\n- Support Levels: 189.01, 222.27, 225.77, 186.62, 192.15\n- Resistance Levels: 192.82, 233.08, 220.20, 237.23\n\n**Risk-Reward Analysis:**\n- Risk-Reward Ratio: 0.00\n- Suggested Stop Loss: 223.96\n- Suggested Take Profit: 223.96\n\n**Multi-Timeframe Context:**\n- 1h: SIDEWAYS trend, NEUTRAL signal\n\n**Confidence Score:** 54.2/100\n\n**Conclusion:** Based on the SLIGHT_DOWN trend, the AVERAGE volume on the WIDE candle, a None NEUTRAL signal is generated with a confidence score of 54.2/100.", "confidence_score": 54.166666666666664}}
{"input": {"timestamp": "2024-07-23 08:00", "ticker": "AAPL", "primary_timeframe": "1d", "vpa_metrics": {"volume_class": "LOW", "candle_class": "NARROW_UPPER_WICK_LOWER_WICK", "signal_type": "VALIDATION", "signal_strength": "NEUTRAL"}, "trend_analysis": {"trend_direction": "SLIGHT_DOWN", "price_change_percent": -4.18, "volume_trend": "FLAT", "signal_type": null, "signal_strength": null}, "pattern_analysis": {"accumulation": {"detected": false, "strength": 1, "details": "Sideways: False, High volume count: 0, Support tests: 10"}, "distribution": {"detected": false, "strength": 1, "details": "Sideways: False, High volume count: 0, Resistance tests: 13"}, "testing": {"detected": true, "strength": 2, "details": "Testing low: True, Testing high: True, Low volume: True"}, "buying_climax": {"detected": false, "strength": 1, "details": "Near high: False, Very high volume: False, Wide up candle: False, Upper wick: True"}, "selling_climax": {"detected": false, "strength": 1, "details": "Near low: False, Very high volume: False, Wide down candle: False, Lower wick: True"}}, "support_resistance": {"support_levels": [189.01, 222.27, 225.77, 186.625, 192.15], "resistance_levels": [192.8231, 233.08, 220.2, 237.23]}, "multi_timeframe_context": {"1h": {"trend_direction": "SIDEWAYS", "signal_strength": "NEUTRAL"}}, "risk_reward": {"risk_reward_ratio": 0, "stop_loss": 225.01, "take_profit": 225.01}, "volatility": 2.2993691508447567, "confidence_score": 50.0}, "output": {"signal": {"type": "VALIDATION", "strength": "NEUTRAL"}, "explanation": "VPA Analysis for AAPL on 2024-07-23 08:00 (1d):\n\n**Signal:** NEUTRAL (NEUTRAL)\n\n**Trend Context:** The primary trend is currently SLIGHT_DOWN (Price change: -4.18%, Volume trend: FLAT). Recent price action shows a None (None). \n\n**Current Candle Analysis:**\n- Candle Type: NARROW_UPPER_WICK_LOWER_WICK\n- Volume: LOW\n- Signal: VALIDATION (NEUTRAL)\n\n**Detected Patterns:**\n- Testing (Strength: 2): Testing low: True, Testing high: True, Low volume: True\n\n**Support/Resistance:**\n- Support Levels: 189.01, 222.27, 225.77, 186.62, 192.15\n- Resistance Levels: 192.82, 233.08, 220.20, 237.23\n\n**Risk-Reward Analysis:**\n- Risk-Reward Ratio: 0.00\n- Suggested Stop Loss: 225.01\n- Suggested Take Profit: 225.01\n\n**Multi-Timeframe Context:**\n- 1h: SIDEWAYS trend, NEUTRAL signal\n\n**Confidence Score:** 50.0/100\n\n**Conclusion:** Based on the SLIGHT_DOWN trend, the LOW volume on the NARROW_UPPER_WICK_LOWER_WICK candle, and the presence of testing, a NEUTRAL NEUTRAL signal is generated with a confidence score of 50.0/100.", "confidence_score": 50.0}}
{"input": {"timestamp": "2024-07-24 08:00", "ticker": "AAPL", "primary_timeframe": "1d", "vpa_metrics": {"volume_class": "AVERAGE", "candle_class": "WIDE", "signal_type": null, "signal_strength": null}, "trend_analysis": {"trend_direction": "SLIGHT_DOWN", "price_change_percent": -4.52, "volume_trend": "FLAT", "signal_type": null, "signal_strength": null}, "pattern_analysis": {"accumulation": {"detected": false, "strength": 1, "details": "Sideways: False, High volume count: 0, Support tests: 9"}, "distribution": {"detected": false, "strength": 1, "details": "Sideways: False, High volume count: 0, Resistance tests: 13"}, "testing": {"detected": false, "strength": 1, "details": "Testing low: False, Testing high: True, Low volume: False"}, "buying_climax": {"detected": false, "strength": 1, "details": "Near high: False, Very high volume: False, Wide up candle: False, Upper wick: True"}, "selling_climax": {"detected": true, "strength": 3, "details": "Near low: True, Very high volume: False, Wide down candle: True, Lower wick: True"}}, "support_resistance": {"support_levels": [189.01, 222.27, 225.77, 186.625, 192.15], "resistance_levels": [192.8231, 233.08, 220.2, 237.23]}, "multi_timeframe_context": {"1h": {"trend_direction": "SIDEWAYS", "signal_strength": "NEUTRAL"}}, "risk_reward": {"risk_reward_ratio": 0, "stop_loss": 218.54, "take_profit": 218.54}, "volatility": 2.4177773068160455, "confidence_score": 56.25}, "output": {"signal": {"type": null, "strength": null}, "explanation": "VPA Analysis for AAPL on 2024-07-24 08:00 (1d):\n\n**Signal:** NEUTRAL (None)\n\n**Trend Context:** The primary trend is currently SLIGHT_DOWN (Price change: -4.52%, Volume trend: FLAT). Recent price action shows a None (None). \n\n**Current Candle Analysis:**\n- Candle Type: WIDE\n- Volume: AVERAGE\n- Signal: None (None)\n\n**Detected Patterns:**\n- Selling Climax (Strength: 3): Near low: True, Very high volume: False, Wide down candle: True, Lower wick: True\n\n**Support/Resistance:**\n- Support Levels: 189.01, 222.27, 225.77, 186.62, 192.15\n- Resistance Levels: 192.82, 233.08, 220.20, 237.23\n\n**Risk-Reward Analysis:**\n- Risk-Reward Ratio: 0.00\n- Suggested Stop Loss: 218.54\n- Suggested Take Profit: 218.54\n\n**Multi-Timeframe Context:**\n- 1h: SIDEWAYS trend, NEUTRAL signal\n\n**Confidence Score:** 56.2/100\n\n**Conclusion:** Based on the SLIGHT_DOWN trend, the AVERAGE volume on the WIDE candle, and the presence of selling_climax, a None NEUTRAL signal is generated with a confidence score of 56.2/100.", "confidence_score": 56.25}}
{"input": {"timestamp": "2024-07-25 08:00", "ticker": "AAPL", "primary_timeframe": "1d", "vpa_metrics": {"volume_class": "AVERAGE", "candle_class": "NARROW_LOWER_WICK", "signal_type": null, "signal_strength": null}, "trend_analysis": {"trend_direction": "SLIGHT_DOWN", "price_change_percent": -2.98, "volume_trend": "DECREASING", "signal_type": "TREND_ANOMALY", "signal_strength": "BULLISH"}, "pattern_analysis": {"accumulation": {"detected": false, "strength": 1, "details": "Sideways: False, High volume count: 0, Support tests: 8"}, "distribution": {"detected": false, "strength": 1, "details": "Sideways: False, High volume count: 0, Resistance tests: 13"}, "testing": {"detected": false, "strength": 0, "details": "Testing low: False, Testing high: False, Low volume: False"}, "buying_climax": {"detected": false, "strength": 1, "details": "Near high: False, Very high volume: False, Wide up candle: False, Upper wick: True"}, "selling_climax": {"detected": false, "strength": 2, "details": "Near low: True, Very high volume: False, Wide down candle: False, Lower wick: True"}}, "support_resistance": {"support_levels": [189.01, 222.27, 225.77, 186.625, 192.15], "resistance_levels": [192.8231, 220.2, 233.08, 237.23]}, "multi_timeframe_context": {"1h": {"trend_direction": "SIDEWAYS", "signal_strength": "NEUTRAL"}}, "risk_reward": {"risk_reward_ratio": 0, "stop_loss": 217.49, "take_profit": 217.49}, "volatility": 2.4981886644516003, "confidence_score": 54.166666666666664}, "output": {"signal": {"type": null, "strength": null}, "explanation": "VPA Analysis for AAPL on 2024-07-25 08:00 (1d):\n\n**Signal:** NEUTRAL (None)\n\n**Trend Context:** The primary trend is currently SLIGHT_DOWN (Price change: -2.98%, Volume trend: DECREASING). Recent price action shows a TREND_ANOMALY (BULLISH). \n\n**Current Candle Analysis:**\n- Candle Type: NARROW_LOWER_WICK\n- Volume: AVERAGE\n- Signal: None (None)\n\n**Detected Patterns:** None\n\n**Support/Resistance:**\n- Support Levels: 189.01, 222.27, 225.77, 186.62, 192.15\n- Resistance Levels: 192.82, 220.20, 233.08, 237.23\n\n**Risk-Reward Analysis:**\n- Risk-Reward Ratio: 0.00\n- Suggested Stop Loss: 217.49\n- Suggested Take Profit: 217.49\n\n**Multi-Timeframe Context:**\n- 1h: SIDEWAYS trend, NEUTRAL signal\n\n**Confidence Score:** 54.2/100\n\n**Conclusion:** Based on the SLIGHT_DOWN trend, the AVERAGE volume on the NARROW_LOWER_WICK candle, a None NEUTRAL signal is generated with a confidence score of 54.2/100.", "confidence_score": 54.166666666666664}}
{"input": {"timestamp": "2024-07-26 08:00", "ticker": "AAPL", "primary_timeframe": "1d", "vpa_metrics": {"volume_class": "AVERAGE", "candle_class": "NARROW_LOWER_WICK", "signal_type": null, "signal_strength": null}, "trend_analysis": {"trend_direction": "SLIGHT_DOWN", "price_change_percent": -2.83, "volume_trend": "DECREASING", "signal_type": "TREND_ANOMALY", "signal_strength": "BULLISH"}, "pattern_analysis": {"accumulation": {"detected": false, "strength": 1, "details": "Sideways: False, High volume count: 0, Support tests: 8"}, "distribution": {"detected": false, "strength": 1, "details": "Sideways: False, High volume count: 0, Resistance tests: 13"}, "testing": {"detected": false, "strength": 1, "details": "Testing low: True, Testing high: True, Low volume: False"}, "buying_climax": {"detected": false, "strength": 1, "details": "Near high: False, Very high volume: False, Wide up candle: False, Upper wick: True"}, "selling_climax": {"detected": false, "strength": 2, "details": "Near low: True, Very high volume: False, Wide down candle: False, Lower wick: True"}}, "support_resistance": {"support_levels": [189.01, 222.27, 225.77, 186.625, 192.15], "resistance_levels": [192.8231, 220.2, 233.08, 237.23]}, "multi_timeframe_context": {"1h": {"trend_direction": "SIDEWAYS", "signal_strength": "NEUTRAL"}}, "risk_reward": {"risk_reward_ratio": 0, "stop_loss": 217.96, "take_profit": 217.96}, "volatility": 2.437504225787444, "confidence_score": 54.166666666666664}, "output": {"signal": {"type": null, "strength": null}, "explanation": "VPA Analysis for AAPL on 2024-07-26 08:00 (1d):\n\n**Signal:** NEUTRAL (None)\n\n**Trend Context:** The primary trend is currently SLIGHT_DOWN (Price change: -2.83%, Volume trend: DECREASING). Recent price action shows a TREND_ANOMALY (BULLISH). \n\n**Current Candle Analysis:**\n- Candle Type: NARROW_LOWER_WICK\n- Volume: AVERAGE\n- Signal: None (None)\n\n**Detected Patterns:** None\n\n**Support/Resistance:**\n- Support Levels: 189.01, 222.27, 225.77, 186.62, 192.15\n- Resistance Levels: 192.82, 220.20, 233.08, 237.23\n\n**Risk-Reward Analysis:**\n- Risk-Reward Ratio: 0.00\n- Suggested Stop Loss: 217.96\n- Suggested Take Profit: 217.96\n\n**Multi-Timeframe Context:**\n- 1h: SIDEWAYS trend, NEUTRAL signal\n\n**Confidence Score:** 54.2/100\n\n**Conclusion:** Based on the SLIGHT_DOWN trend, the AVERAGE volume on the NARROW_LOWER_WICK candle, a None NEUTRAL signal is generated with a confidence score of 54.2/100.", "confidence_score": 54.166666666666664}}
{"input": {"timestamp": "2024-07-29 08:00", "ticker": "AAPL", "primary_timeframe": "1d", "vpa_metrics": {"volume_class": "LOW", "candle_class": "NARROW", "signal_type": "VALIDATION", "signal_strength": "NEUTRAL"}, "trend_analysis": {"trend_direction": "SLIGHT_DOWN", "price_change_percent": -2.55, "volume_trend": "DECREASING", "signal_type": "TREND_ANOMALY", "signal_strength": "BULLISH"}, "pattern_analysis": {"accumulation": {"detected": false, "strength": 1, "details": "Sideways: False, High volume count: 0, Support tests: 8"}, "distribution": {"detected": false, "strength": 1, "details": "Sideways: False, High volume count: 0, Resistance tests: 13"}, "testing": {"detected": true, "strength": 2, "details": "Testing low: True, Testing high: True, Low volume: True"}, "buying_climax": {"detected": false, "strength": 1, "details": "Near high: False, Very high volume: False, Wide up candle: False, Upper wick: True"}, "selling_climax": {"detected": false, "strength": 2, "details": "Near low: True, Very high volume: False, Wide down candle: False, Lower wick: True"}}, "support_resistance": {"support_levels": [189.01, 222.27, 225.77, 186.625, 192.15], "resistance_levels": [192.8231, 220.2, 233.08, 237.23]}, "multi_timeframe_context": {"1h": {"trend_direction": "SIDEWAYS", "signal_strength": "NEUTRAL"}}, "risk_reward": {"risk_reward_ratio": 0, "stop_loss": 218.24, "take_profit": 218.24}, "volatility": 2.3538282335236915, "confidence_score": 54.166666666666664}, "output": {"signal": {"type": "VALIDATION", "strength": "NEUTRAL"}, "explanation": "VPA Analysis for AAPL on 2024-07-29 08:00 (1d):\n\n**Signal:** NEUTRAL (NEUTRAL)\n\n**Trend Context:** The primary trend is currently SLIGHT_DOWN (Price change: -2.55%, Volume trend: DECREASING). Recent price action shows a TREND_ANOMALY (BULLISH). \n\n**Current Candle Analysis:**\n- Candle Type: NARROW\n- Volume: LOW\n- Signal: VALIDATION (NEUTRAL)\n\n**Detected Patterns:**\n- Testing (Strength: 2): Testing low: True, Testing high: True, Low volume: True\n\n**Support/Resistance:**\n- Support Levels: 189.01, 222.27, 225.77, 186.62, 192.15\n- Resistance Levels: 192.82, 220.20, 233.08, 237.23\n\n**Risk-Reward Analysis:**\n- Risk-Reward Ratio: 0.00\n- Suggested Stop Loss: 218.24\n- Suggested Take Profit: 218.24\n\n**Multi-Timeframe Context:**\n- 1h: SIDEWAYS trend, NEUTRAL signal\n\n**Confidence Score:** 54.2/100\n\n**Conclusion:** Based on the SLIGHT_DOWN trend, the LOW volume on the NARROW candle, and the presence of testing, a NEUTRAL NEUTRAL signal is generated with a confidence score of 54.2/100.", "confidence_score": 54.166666666666664}}
{"input": {"timestamp": "2024-07-30 08:00", "ticker": "AAPL", "primary_timeframe": "1d", "vpa_metrics": {"volume_class": "AVERAGE", "candle_class": "NARROW_UPPER_WICK_LOWER_WICK", "signal_type": null, "signal_strength": null}, "trend_analysis": {"trend_direction": "SLIGHT_DOWN", "price_change_percent": -2.76, "volume_trend": "FLAT", "signal_type": null, "signal_strength": null}, "pattern_analysis": {"accumulation": {"detected": false, "strength": 1, "details": "Sideways: False, High volume count: 0, Support tests: 8"}, "distribution": {"detected": false, "strength": 1, "details": "Sideways: False, High volume count: 0, Resistance tests: 13"}, "testing": {"detected": false, "strength": 1, "details": "Testing low: True, Testing high: True, Low volume: False"}, "buying_climax": {"detected": false, "strength": 1, "details": "Near high: False, Very high volume: False, Wide up candle: False, Upper wick: True"}, "selling_climax": {"detected": false, "strength": 2, "details": "Near low: True, Very high volume: False, Wide down candle: False, Lower wick: True"}}, "support_resistance": {"support_levels": [222.27, 225.77, 186.625, 192.15, 206.59], "resistance_levels": [220.2, 192.8231, 233.08, 237.23]}, "multi_timeframe_context": {"1h": {"trend_direction": "SIDEWAYS", "signal_strength": "NEUTRAL"}}, "risk_reward": {"risk_reward_ratio": 0, "stop_loss": 218.8, "take_profit": 218.8}, "volatility": 2.3219450591744435, "confidence_score": 50.0}, "output": {"signal": {"type": null, "strength": null}, "explanation": "VPA Analysis for AAPL on 2024-07-30 08:00 (1d):\n\n**Signal:** NEUTRAL (None)\n\n**Trend Context:** The primary trend is currently SLIGHT_DOWN (Price change: -2.76%, Volume trend: FLAT). Recent price action shows a None (None). \n\n**Current Candle Analysis:**\n- Candle Type: NARROW_UPPER_WICK_LOWER_WICK\n- Volume: AVERAGE\n- Signal: None (None)\n\n**Detected Patterns:** None\n\n**Support/Resistance:**\n- Support Levels: 222.27, 225.77, 186.62, 192.15, 206.59\n- Resistance Levels: 220.20, 192.82, 233.08, 237.23\n\n**Risk-Reward Analysis:**\n- Risk-Reward Ratio: 0.00\n- Suggested Stop Loss: 218.80\n- Suggested Take Profit: 218.80\n\n**Multi-Timeframe Context:**\n- 1h: SIDEWAYS trend, NEUTRAL signal\n\n**Confidence Score:** 50.0/100\n\n**Conclusion:** Based on the SLIGHT_DOWN trend, the AVERAGE volume on the NARROW_UPPER_WICK_LOWER_WICK candle, a None NEUTRAL signal is generated with a confidence score of 50.0/100.", "confidence_score": 50.0}}
{"input": {"timestamp": "2025-02-13 09:00", "ticker": "AAPL", "primary_timeframe": "1d", "vpa_metrics": {"volume_class": "AVERAGE", "candle_class": "NEUTRAL", "signal_type": null, "signal_strength": null}, "trend_analysis": {"trend_direction": "SLIGHT_UP", "price_change_percent": 3.56, "volume_trend": "INCREASING", "signal_type": "TREND_VALIDATION", "signal_strength": "BULLISH"}, "pattern_analysis": {"accumulation": {"detected": false, "strength": 1, "details": "Sideways: False, High volume count: 0, Support tests: 8"}, "distribution": {"detected": false, "strength": 1, "details": "Sideways: False, High volume count: 0, Resistance tests: 10"}, "testing": {"detected": false, "strength": 0, "details": "Testing low: False, Testing high: False, Low volume: False"}, "buying_climax": {"detected": false, "strength": 2, "details": "Near high: True, Very high volume: False, Wide up candle: True, Upper wick: False"}, "selling_climax": {"detected": false, "strength": 1, "details": "Near low: False, Very high volume: False, Wide down candle: False, Lower wick: True"}}, "support_resistance": {"support_levels": [241.75, 229.72, 245.69, 219.38, 225.7], "resistance_levels": [250.8, 238.96, 260.1, 247.19]}, "multi_timeframe_context": {"1h": {"trend_direction": "SIDEWAYS", "signal_strength": "NEUTRAL"}}, "risk_reward": {"risk_reward_ratio": 0, "stop_loss": 241.53, "take_profit": 241.53}, "volatility": 2.7505551233692227, "confidence_score": 54.166666666666664}, "output": {"signal": {"type": null, "strength": null}, "explanation": "VPA Analysis for AAPL on 2025-02-13 09:00 (1d):\n\n**Signal:** NEUTRAL (None)\n\n**Trend Context:** The primary trend is currently SLIGHT_UP (Price change: 3.56%, Volume trend: INCREASING). Recent price action shows a TREND_VALIDATION (BULLISH). \n\n**Current Candle Analysis:**\n- Candle Type: NEUTRAL\n- Volume: AVERAGE\n- Signal: None (None)\n\n**Detected Patterns:** None\n\n**Support/Resistance:**\n- Support Levels: 241.75, 229.72, 245.69, 219.38, 225.70\n- Resistance Levels: 250.80, 238.96, 260.10, 247.19\n\n**Risk-Reward Analysis:**\n- Risk-Reward Ratio: 0.00\n- Suggested Stop Loss: 241.53\n- Suggested Take Profit: 241.53\n\n**Multi-Timeframe Context:**\n- 1h: SIDEWAYS trend, NEUTRAL signal\n\n**Confidence Score:** 54.2/100\n\n**Conclusion:** Based on the SLIGHT_UP trend, the AVERAGE volume on the NEUTRAL candle, a None NEUTRAL signal is generated with a confidence score of 54.2/100.", "confidence_score": 54.166666666666664}}
{"input": {"timestamp": "2025-02-14 09:00", "ticker": "AAPL", "primary_timeframe": "1d", "vpa_metrics": {"volume_class": "AVERAGE", "candle_class": "NEUTRAL", "signal_type": null, "signal_strength": null}, "trend_analysis": {"trend_direction": "UP", "price_change_percent": 7.46, "volume_trend": "FLAT", "signal_type": null, "signal_strength": null}, "pattern_analysis": {"accumulation": {"detected": false, "strength": 1, "details": "Sideways: False, High volume count: 0, Support tests: 8"}, "distribution": {"detected": false, "strength": 1, "details": "Sideways: False, High volume count: 0, Resistance tests: 9"}, "testing": {"detected": false, "strength": 0, "details": "Testing low: False, Testing high: False, Low volume: False"}, "buying_climax": {"detected": true, "strength": 3, "details": "Near high: True, Very high volume: False, Wide up candle: True, Upper wick: True"}, "selling_climax": {"detected": false, "strength": 1, "details": "Near low: False, Very high volume: False, Wide down candle: False, Lower wick: True"}}, "support_resistance": {"support_levels": [241.75, 229.72, 245.69, 219.38, 225.7], "resistance_levels": [250.8, 238.96, 260.1, 247.19]}, "multi_timeframe_context": {"1h": {"trend_direction": "SIDEWAYS", "signal_strength": "NEUTRAL"}}, "risk_reward": {"risk_reward_ratio": 0, "stop_loss": 244.6, "take_profit": 244.6}, "volatility": 2.7274368464087444, "confidence_score": 43.75}, "output": {"signal": {"type": null, "strength": null}, "explanation": "VPA Analysis for AAPL on 2025-02-14 09:00 (1d):\n\n**Signal:** NEUTRAL (None)\n\n**Trend Context:** The primary trend is currently UP (Price change: 7.46%, Volume trend: FLAT). Recent price action shows a None (None). \n\n**Current Candle Analysis:**\n- Candle Type: NEUTRAL\n- Volume: AVERAGE\n- Signal: None (None)\n\n**Detected Patterns:**\n- Buying Climax (Strength: 3): Near high: True, Very high volume: False, Wide up candle: True, Upper wick: True\n\n**Support/Resistance:**\n- Support Levels: 241.75, 229.72, 245.69, 219.38, 225.70\n- Resistance Levels: 250.80, 238.96, 260.10, 247.19\n\n**Risk-Reward Analysis:**\n- Risk-Reward Ratio: 0.00\n- Suggested Stop Loss: 244.60\n- Suggested Take Profit: 244.60\n\n**Multi-Timeframe Context:**\n- 1h: SIDEWAYS trend, NEUTRAL signal\n\n**Confidence Score:** 43.8/100\n\n**Conclusion:** Based on the UP trend, the AVERAGE volume on the NEUTRAL candle, and the presence of buying_climax, a None NEUTRAL signal is generated with a confidence score of 43.8/100.", "confidence_score": 43.75}}
{"input": {"timestamp": "2025-02-18 09:00", "ticker": "AAPL", "primary_timeframe": "1d", "vpa_metrics": {"volume_class": "AVERAGE", "candle_class": "NARROW_UPPER_WICK_LOWER_WICK", "signal_type": null, "signal_strength": null}, "trend_analysis": {"trend_direction": "UP", "price_change_percent": 7.39, "volume_trend": "INCREASING", "signal_type": "TREND_VALIDATION", "signal_strength": "BULLISH"}, "pattern_analysis": {"accumulation": {"detected": false, "strength": 1, "details": "Sideways: False, High volume count: 0, Support tests: 8"}, "distribution": {"detected": false, "strength": 1, "details": "Sideways: False, High volume count: 0, Resistance tests: 10"}, "testing": {"detected": false, "strength": 1, "details": "Testing low: True, Testing high: True, Low volume: False"}, "buying_climax": {"detected": false, "strength": 2, "details": "Near high: True, Very high volume: False, Wide up candle: False, Upper wick: True"}, "selling_climax": {"detected": false, "strength": 1, "details": "Near low: False, Very high volume: False, Wide down candle: False, Lower wick: True"}}, "support_resistance": {"support_levels": [241.75, 229.72, 245.69, 219.38, 225.7], "resistance_levels": [250.8, 238.96, 260.1, 247.19]}, "multi_timeframe_context": {"1h": {"trend_direction": "SIDEWAYS", "signal_strength": "NEUTRAL"}}, "risk_reward": {"risk_reward_ratio": 0, "stop_loss": 244.47, "take_profit": 244.47}, "volatility": 2.5725877462093076, "confidence_score": 54.166666666666664}, "output": {"signal": {"type": null, "strength": null}, "explanation": "VPA Analysis for AAPL on 2025-02-18 09:00 (1d):\n\n**Signal:** NEUTRAL (None)\n\n**Trend Context:** The primary trend is currently UP (Price change: 7.39%, Volume trend: INCREASING). Recent price action shows a TREND_VALIDATION (BULLISH). \n\n**Current Candle Analysis:**\n- Candle Type: NARROW_UPPER_WICK_LOWER_WICK\n- Volume: AVERAGE\n- Signal: None (None)\n\n**Detected Patterns:** None\n\n**Support/Resistance:**\n- Support Levels: 241.75, 229.72, 245.69, 219.38, 225.70\n- Resistance Levels: 250.80, 238.96, 260.10, 247.19\n\n**Risk-Reward Analysis:**\n- Risk-Reward Ratio: 0.00\n- Suggested Stop Loss: 244.47\n- Suggested Take Profit: 244.47\n\n**Multi-Timeframe Context:**\n- 1h: SIDEWAYS trend, NEUTRAL signal\n\n**Confidence Score:** 54.2/100\n\n**Conclusion:** Based on the UP trend, the AVERAGE volume on the NARROW_UPPER_WICK_LOWER_WICK candle, a None NEUTRAL signal is generated with a confidence score of 54.2/100.", "confidence_score": 54.166666666666664}}
{"input": {"timestamp": "2025-02-19 09:00", "ticker": "AAPL", "primary_timeframe": "1d", "vpa_metrics": {"volume_class": "AVERAGE", "candle_class": "NARROW_UPPER_WICK_LOWER_WICK", "signal_type": null, "signal_strength": null}, "trend_analysis": {"trend_direction": "UP", "price_change_percent": 5.27, "volume_trend": "DECREASING", "signal_type": "TREND_ANOMALY", "signal_strength": "BEARISH"}, "pattern_analysis": {"accumulation": {"detected": false, "strength": 1, "details": "Sideways: False, High volume count: 0, Support tests: 9"}, "distribution": {"detected": false, "strength": 1, "details": "Sideways: False, High volume count: 0, Resistance tests: 11"}, "testing": {"detected": false, "strength": 1, "details": "Testing low: True, Testing high: True, Low volume: False"}, "buying_climax": {"detected": false, "strength": 2, "details": "Near high: True, Very high volume: False, Wide up candle: False, Upper wick: True"}, "selling_climax": {"detected": false, "strength": 1, "details": "Near low: False, Very high volume: False, Wide down candle: False, Lower wick: True"}}, "support_resistance": {"support_levels": [241.75, 229.72, 245.69, 219.38, 225.7], "resistance_levels": [250.8, 238.96, 247.19, 260.1]}, "multi_timeframe_context": {"1h": {"trend_direction": "SIDEWAYS", "signal_strength": null}}, "risk_reward": {"risk_reward_ratio": 0, "stop_loss": 244.87, "take_profit": 244.87}, "volatility": 2.536566126387148, "confidence_score": 45.83333333333333}, "output": {"signal": {"type": null, "strength": null}, "explanation": "VPA Analysis for AAPL on 2025-02-19 09:00 (1d):\n\n**Signal:** NEUTRAL (None)\n\n**Trend Context:** The primary trend is currently UP (Price change: 5.27%, Volume trend: DECREASING). Recent price action shows a TREND_ANOMALY (BEARISH). \n\n**Current Candle Analysis:**\n- Candle Type: NARROW_UPPER_WICK_LOWER_WICK\n- Volume: AVERAGE\n- Signal: None (None)\n\n**Detected Patterns:** None\n\n**Support/Resistance:**\n- Support Levels: 241.75, 229.72, 245.69, 219.38, 225.70\n- Resistance Levels: 250.80, 238.96, 247.19, 260.10\n\n**Risk-Reward Analysis:**\n- Risk-Reward Ratio: 0.00\n- Suggested Stop Loss: 244.87\n- Suggested Take Profit: 244.87\n\n**Multi-Timeframe Context:**\n- 1h: SIDEWAYS trend, None signal\n\n**Confidence Score:** 45.8/100\n\n**Conclusion:** Based on the UP trend, the AVERAGE volume on the NARROW_UPPER_WICK_LOWER_WICK candle, a None NEUTRAL signal is generated with a confidence score of 45.8/100.", "confidence_score": 45.83333333333333}}
{"input": {"timestamp": "2025-02-20 09:00", "ticker": "AAPL", "primary_timeframe": "1d", "vpa_metrics": {"volume_class": "AVERAGE", "candle_class": "NARROW", "signal_type": null, "signal_strength": null}, "trend_analysis": {"trend_direction": "SLIGHT_UP", "price_change_percent": 3.78, "volume_trend": "DECREASING", "signal_type": "TREND_ANOMALY", "signal_strength": "BEARISH"}, "pattern_analysis": {"accumulation": {"detected": false, "strength": 1, "details": "Sideways: False, High volume count: 0, Support tests: 9"}, "distribution": {"detected": false, "strength": 1, "details": "Sideways: False, High volume count: 0, Resistance tests: 11"}, "testing": {"detected": false, "strength": 1, "details": "Testing low: True, Testing high: True, Low volume: False"}, "buying_climax": {"detected": false, "strength": 2, "details": "Near high: True, Very high volume: False, Wide up candle: False, Upper wick: True"}, "selling_climax": {"detected": false, "strength": 1, "details": "Near low: False, Very high volume: False, Wide down candle: False, Lower wick: True"}}, "support_resistance": {"support_levels": [241.8201, 229.72, 245.69, 219.38, 225.7], "resistance_levels": [250.8, 238.96, 247.19, 260.1]}, "multi_timeframe_context": {"1h": {"trend_direction": "SIDEWAYS", "signal_strength": "NEUTRAL"}}, "risk_reward": {"risk_reward_ratio": 0, "stop_loss": 245.83, "take_profit": 245.83}, "volatility": 2.478702655022619, "confidence_score": 45.83333333333333}, "output": {"signal": {"type": null, "strength": null}, "explanation": "VPA Analysis for AAPL on 2025-02-20 09:00 (1d):\n\n**Signal:** NEUTRAL (None)\n\n**Trend Context:** The primary trend is currently SLIGHT_UP (Price change: 3.78%, Volume trend: DECREASING). Recent price action shows a TREND_ANOMALY (BEARISH). \n\n**Current Candle Analysis:**\n- Candle Type: NARROW\n- Volume: AVERAGE\n- Signal: None (None)\n\n**Detected Patterns:** None\n\n**Support/Resistance:**\n- Support Levels: 241.82, 229.72, 245.69, 219.38, 225.70\n- Resistance Levels: 250.80, 238.96, 247.19, 260.10\n\n**Risk-Reward Analysis:**\n- Risk-Reward Ratio: 0.00\n- Suggested Stop Loss: 245.83\n- Suggested Take Profit: 245.83\n\n**Multi-Timeframe Context:**\n- 1h: SIDEWAYS trend, NEUTRAL signal\n\n**Confidence Score:** 45.8/100\n\n**Conclusion:** Based on the SLIGHT_UP trend, the AVERAGE volume on the NARROW candle, a None NEUTRAL signal is generated with a confidence score of 45.8/100.", "confidence_score": 45.83333333333333}}
{"input": {"timestamp": "2025-02-21 09:00", "ticker": "AAPL", "primary_timeframe": "1d", "vpa_metrics": {"volume_class": "AVERAGE", "candle_class": "NARROW_UPPER_WICK", "signal_type": null, "signal_strength": null}, "trend_analysis": {"trend_direction": "SIDEWAYS", "price_change_percent": 1.66, "volume_trend": "FLAT", "signal_type": "CONSOLIDATION", "signal_strength": "NEUTRAL"}, "pattern_analysis": {"accumulation": {"detected": false, "strength": 1, "details": "Sideways: False, High volume count: 0, Support tests: 10"}, "distribution": {"detected": false, "strength": 1, "details": "Sideways: False, High volume count: 0, Resistance tests: 12"}, "testing": {"detected": false, "strength": 1, "details": "Testing low: True, Testing high: True, Low volume: False"}, "buying_climax": {"detected": false, "strength": 2, "details": "Near high: True, Very high volume: False, Wide up candle: False, Upper wick: True"}, "selling_climax": {"detected": false, "strength": 1, "details": "Near low: False, Very high volume: False, Wide down candle: False, Lower wick: True"}}, "support_resistance": {"support_levels": [241.8201, 245.69, 229.72, 219.38, 225.7], "resistance_levels": [250.8, 238.96, 247.19, 260.1]}, "multi_timeframe_context": {"1h": {"trend_direction": "SIDEWAYS", "signal_strength": "NEUTRAL"}}, "risk_reward": {"risk_reward_ratio": 0, "stop_loss": 245.55, "take_profit": 245.55}, "volatility": 2.4654534932321637, "confidence_score": 56.25}, "output": {"signal": {"type": null, "strength": null}, "explanation": "VPA Analysis for AAPL on 2025-02-21 09:00 (1d):\n\n**Signal:** NEUTRAL (None)\n\n**Trend Context:** The primary trend is currently SIDEWAYS (Price change: 1.66%, Volume trend: FLAT). Recent price action shows a CONSOLIDATION (NEUTRAL). \n\n**Current Candle Analysis:**\n- Candle Type: NARROW_UPPER_WICK\n- Volume: AVERAGE\n- Signal: None (None)\n\n**Detected Patterns:** None\n\n**Support/Resistance:**\n- Support Levels: 241.82, 245.69, 229.72, 219.38, 225.70\n- Resistance Levels: 250.80, 238.96, 247.19, 260.10\n\n**Risk-Reward Analysis:**\n- Risk-Reward Ratio: 0.00\n- Suggested Stop Loss: 245.55\n- Suggested Take Profit: 245.55\n\n**Multi-Timeframe Context:**\n- 1h: SIDEWAYS trend, NEUTRAL signal\n\n**Confidence Score:** 56.2/100\n\n**Conclusion:** Based on the SIDEWAYS trend, the AVERAGE volume on the NARROW_UPPER_WICK candle, a None NEUTRAL signal is generated with a confidence score of 56.2/100.", "confidence_score": 56.25}}
{"input": {"timestamp": "2025-02-24 09:00", "ticker": "AAPL", "primary_timeframe": "1d", "vpa_metrics": {"volume_class": "AVERAGE", "candle_class": "NARROW", "signal_type": null, "signal_strength": null}, "trend_analysis": {"trend_direction": "SIDEWAYS", "price_change_percent": 1.02, "volume_trend": "INCREASING", "signal_type": "CONSOLIDATION", "signal_strength": "NEUTRAL"}, "pattern_analysis": {"accumulation": {"detected": false, "strength": 1, "details": "Sideways: False, High volume count: 0, Support tests: 10"}, "distribution": {"detected": false, "strength": 1, "details": "Sideways: False, High volume count: 0, Resistance tests: 12"}, "testing": {"detected": false, "strength": 1, "details": "Testing low: True, Testing high: True, Low volume: False"}, "buying_climax": {"detected": false, "strength": 2, "details": "Near high: True, Very high volume: False, Wide up candle: False, Upper wick: True"}, "selling_climax": {"detected": false, "strength": 1, "details": "Near low: False, Very high volume: False, Wide down candle: False, Lower wick: True"}}, "support_resistance": {"support_levels": [241.8201, 245.69, 229.72, 219.38, 225.7], "resistance_levels": [238.96, 247.19, 260.1]}, "multi_timeframe_context": {"1h": {"trend_direction": "SIDEWAYS", "signal_strength": "NEUTRAL"}}, "risk_reward": {"risk_reward_ratio": 0, "stop_loss": 247.1, "take_profit": 247.1}, "volatility": 2.3449807237640847, "confidence_score": 50.0}, "output": {"signal": {"type": null, "strength": null}, "explanation": "VPA Analysis for AAPL on 2025-02-24 09:00 (1d):\n\n**Signal:** NEUTRAL (None)\n\n**Trend Context:** The primary trend is currently SIDEWAYS (Price change: 1.02%, Volume trend: INCREASING). Recent price action shows a CONSOLIDATION (NEUTRAL). \n\n**Current Candle Analysis:**\n- Candle Type: NARROW\n- Volume: AVERAGE\n- Signal: None (None)\n\n**Detected Patterns:** None\n\n**Support/Resistance:**\n- Support Levels: 241.82, 245.69, 229.72, 219.38, 225.70\n- Resistance Levels: 238.96, 247.19, 260.10\n\n**Risk-Reward Analysis:**\n- Risk-Reward Ratio: 0.00\n- Suggested Stop Loss: 247.10\n- Suggested Take Profit: 247.10\n\n**Multi-Timeframe Context:**\n- 1h: SIDEWAYS trend, NEUTRAL signal\n\n**Confidence Score:** 50.0/100\n\n**Conclusion:** Based on the SIDEWAYS trend, the AVERAGE volume on the NARROW candle, a None NEUTRAL signal is generated with a confidence score of 50.0/100.", "confidence_score": 50.0}}
{"input": {"timestamp": "2025-02-25 09:00", "ticker": "AAPL", "primary_timeframe": "1d", "vpa_metrics": {"volume_class": "AVERAGE", "candle_class": "NARROW_UPPER_WICK_LOWER_WICK", "signal_type": null, "signal_strength": null}, "trend_analysis": {"trend_direction": "SIDEWAYS", "price_change_percent": 1.05, "volume_trend": "FLAT", "signal_type": "CONSOLIDATION", "signal_strength": "NEUTRAL"}, "pattern_analysis": {"accumulation": {"detected": false, "strength": 1, "details": "Sideways: False, High volume count: 0, Support tests: 11"}, "distribution": {"detected": false, "strength": 1, "details": "Sideways: False, High volume count: 0, Resistance tests: 13"}, "testing": {"detected": false, "strength": 1, "details": "Testing low: True, Testing high: True, Low volume: False"}, "buying_climax": {"detected": false, "strength": 2, "details": "Near high: True, Very high volume: False, Wide up candle: False, Upper wick: True"}, "selling_climax": {"detected": false, "strength": 1, "details": "Near low: False, Very high volume: False, Wide down candle: False, Lower wick: True"}}, "support_resistance": {"support_levels": [245.69, 241.8201, 229.72, 219.38, 225.7], "resistance_levels": [238.96, 247.19, 260.1]}, "multi_timeframe_context": {"1h": {"trend_direction": "SIDEWAYS", "signal_strength": null}}, "risk_reward": {"risk_reward_ratio": 0, "stop_loss": 247.04, "take_profit": 247.04}, "volatility": 2.2339126840741756, "confidence_score": 50.0}, "output": {"signal": {"type": null, "strength": null}, "explanation": "VPA Analysis for AAPL on 2025-02-25 09:00 (1d):\n\n**Signal:** NEUTRAL (None)\n\n**Trend Context:** The primary trend is currently SIDEWAYS (Price change: 1.05%, Volume trend: FLAT). Recent price action shows a CONSOLIDATION (NEUTRAL). \n\n**Current Candle Analysis:**\n- Candle Type: NARROW_UPPER_WICK_LOWER_WICK\n- Volume: AVERAGE\n- Signal: None (None)\n\n**Detected Patterns:** None\n\n**Support/Resistance:**\n- Support Levels: 245.69, 241.82, 229.72, 219.38, 225.70\n- Resistance Levels: 238.96, 247.19, 260.10\n\n**Risk-Reward Analysis:**\n- Risk-Reward Ratio: 0.00\n- Suggested Stop Loss: 247.04\n- Suggested Take Profit: 247.04\n\n**Multi-Timeframe Context:**\n- 1h: SIDEWAYS trend, None signal\n\n**Confidence Score:** 50.0/100\n\n**Conclusion:** Based on the SIDEWAYS trend, the AVERAGE volume on the NARROW_UPPER_WICK_LOWER_WICK candle, a None NEUTRAL signal is generated with a confidence score of 50.0/100.", "confidence_score": 50.0}}
{"input": {"timestamp": "2025-02-26 09:00", "ticker": "AAPL", "primary_timeframe": "1d", "vpa_metrics": {"volume_class": "AVERAGE", "candle_class": "NEUTRAL", "signal_type": null, "signal_strength": null}, "trend_analysis": {"trend_direction": "SIDEWAYS", "price_change_percent": -1.84, "volume_trend": "INCREASING", "signal_type": "CONSOLIDATION", "signal_strength": "NEUTRAL"}, "pattern_analysis": {"accumulation": {"detected": false, "strength": 1, "details": "Sideways: False, High volume count: 0, Support tests: 11"}, "distribution": {"detected": false, "strength": 1, "details": "Sideways: False, High volume count: 0, Resistance tests: 13"}, "testing": {"detected": false, "strength": 1, "details": "Testing low: False, Testing high: True, Low volume: False"}, "buying_climax": {"detected": false, "strength": 1, "details": "Near high: False, Very high volume: False, Wide up candle: False, Upper wick: True"}, "selling_climax": {"detected": true, "strength": 3, "details": "Near low: True, Very high volume: False, Wide down candle: True, Lower wick: True"}}, "support_resistance": {"support_levels": [245.69, 241.8201, 229.72, 219.38, 225.7], "resistance_levels": [238.96, 247.19, 260.1]}, "multi_timeframe_context": {"1h": {"trend_direction": "SIDEWAYS", "signal_strength": "NEUTRAL"}}, "risk_reward": {"risk_reward_ratio": 0, "stop_loss": 240.36, "take_profit": 240.36}, "volatility": 2.3412140561088197, "confidence_score": 56.25}, "output": {"signal": {"type": null, "strength": null}, "explanation": "VPA Analysis for AAPL on 2025-02-26 09:00 (1d):\n\n**Signal:** NEUTRAL (None)\n\n**Trend Context:** The primary trend is currently SIDEWAYS (Price change: -1.84%, Volume trend: INCREASING). Recent price action shows a CONSOLIDATION (NEUTRAL). \n\n**Current Candle Analysis:**\n- Candle Type: NEUTRAL\n- Volume: AVERAGE\n- Signal: None (None)\n\n**Detected Patterns:**\n- Selling Climax (Strength: 3): Near low: True, Very high volume: False, Wide down candle: True, Lower wick: True\n\n**Support/Resistance:**\n- Support Levels: 245.69, 241.82, 229.72, 219.38, 225.70\n- Resistance Levels: 238.96, 247.19, 260.10\n\n**Risk-Reward Analysis:**\n- Risk-Reward Ratio: 0.00\n- Suggested Stop Loss: 240.36\n- Suggested Take Profit: 240.36\n\n**Multi-Timeframe Context:**\n- 1h: SIDEWAYS trend, NEUTRAL signal\n\n**Confidence Score:** 56.2/100\n\n**Conclusion:** Based on the SIDEWAYS trend, the AVERAGE volume on the NEUTRAL candle, and the presence of selling_climax, a None NEUTRAL signal is generated with a confidence score of 56.2/100.", "confidence_score": 56.25}}
{"input": {"timestamp": "2025-02-27 09:00", "ticker": "AAPL", "primary_timeframe": "1d", "vpa_metrics": {"volume_class": "AVERAGE", "candle_class": "NEUTRAL", "signal_type": null, "signal_strength": null}, "trend_analysis": {"trend_direction": "SLIGHT_DOWN", "price_change_percent": -3.47, "volume_trend": "INCREASING", "signal_type": "TREND_VALIDATION", "signal_strength": "BEARISH"}, "pattern_analysis": {"accumulation": {"detected": false, "strength": 1, "details": "Sideways: False, High volume count: 0, Support tests: 12"}, "distribution": {"detected": false, "strength": 1, "details": "Sideways: False, High volume count: 0, Resistance tests: 12"}, "testing": {"detected": false, "strength": 1, "details": "Testing low: True, Testing high: False, Low volume: False"}, "buying_climax": {"detected": false, "strength": 1, "details": "Near high: False, Very high volume: False, Wide up candle: False, Upper wick: True"}, "selling_climax": {"detected": false, "strength": 1, "details": "Near low: True, Very high volume: False, Wide down candle: False, Lower wick: False"}}, "support_resistance": {"support_levels": [245.69, 241.8201, 229.72, 219.38, 225.7], "resistance_levels": [238.96, 247.19, 260.1, 250.0]}, "multi_timeframe_context": {"1h": {"trend_direction": "SIDEWAYS", "signal_strength": "NEUTRAL"}}, "risk_reward": {"risk_reward_ratio": 0, "stop_loss": 237.3, "take_profit": 237.3}, "volatility": 2.4117705768846904, "confidence_score": 45.83333333333333}, "output": {"signal": {"type": null, "strength": null}, "explanation": "VPA Analysis for AAPL on 2025-02-27 09:00 (1d):\n\n**Signal:** NEUTRAL (None)\n\n**Trend Context:** The primary trend is currently SLIGHT_DOWN (Price change: -3.47%, Volume trend: INCREASING). Recent price action shows a TREND_VALIDATION (BEARISH). \n\n**Current Candle Analysis:**\n- Candle Type: NEUTRAL\n- Volume: AVERAGE\n- Signal: None (None)\n\n**Detected Patterns:** None\n\n**Support/Resistance:**\n- Support Levels: 245.69, 241.82, 229.72, 219.38, 225.70\n- Resistance Levels: 238.96, 247.19, 260.10, 250.00\n\n**Risk-Reward Analysis:**\n- Risk-Reward Ratio: 0.00\n- Suggested Stop Loss: 237.30\n- Suggested Take Profit: 237.30\n\n**Multi-Timeframe Context:**\n- 1h: SIDEWAYS trend, NEUTRAL signal\n\n**Confidence Score:** 45.8/100\n\n**Conclusion:** Based on the SLIGHT_DOWN trend, the AVERAGE volume on the NEUTRAL candle, a None NEUTRAL signal is generated with a confidence score of 45.8/100.", "confidence_score": 45.83333333333333}}
{"input": {"timestamp": "2025-02-28 09:00", "ticker": "AAPL", "primary_timeframe": "1d", "vpa_metrics": {"volume_class": "AVERAGE", "candle_class": "WIDE", "signal_type": null, "signal_strength": null}, "trend_analysis": {"trend_direction": "SIDEWAYS", "price_change_percent": -1.51, "volume_trend": "FLAT", "signal_type": "CONSOLIDATION", "signal_strength": "NEUTRAL"}, "pattern_analysis": {"accumulation": {"detected": false, "strength": 1, "details": "Sideways: False, High volume count: 0, Support tests: 12"}, "distribution": {"detected": false, "strength": 1, "details": "Sideways: False, High volume count: 0, Resistance tests: 12"}, "testing": {"detected": false, "strength": 1, "details": "Testing low: False, Testing high: True, Low volume: False"}, "buying_climax": {"detected": false, "strength": 0, "details": "Near high: False, Very high volume: False, Wide up candle: False, Upper wick: False"}, "selling_climax": {"detected": false, "strength": 1, "details": "Near low: False, Very high volume: False, Wide down candle: False, Lower wick: True"}}, "support_resistance": {"support_levels": [245.69, 241.8201, 229.72, 219.38, 225.7], "resistance_levels": [238.96, 247.19, 260.1, 250.0]}, "multi_timeframe_context": {"1h": {"trend_direction": "SIDEWAYS", "signal_strength": null}}, "risk_reward": {"risk_reward_ratio": 0, "stop_loss": 241.84, "take_profit": 241.84}, "volatility": 2.326015895677004, "confidence_score": 50.0}, "output": {"signal": {"type": null, "strength": null}, "explanation": "VPA Analysis for AAPL on 2025-02-28 09:00 (1d):\n\n**Signal:** NEUTRAL (None)\n\n**Trend Context:** The primary trend is currently SIDEWAYS (Price change: -1.51%, Volume trend: FLAT). Recent price action shows a CONSOLIDATION (NEUTRAL). \n\n**Current Candle Analysis:**\n- Candle Type: WIDE\n- Volume: AVERAGE\n- Signal: None (None)\n\n**Detected Patterns:** None\n\n**Support/Resistance:**\n- Support Levels: 245.69, 241.82, 229.72, 219.38, 225.70\n- Resistance Levels: 238.96, 247.19, 260.10, 250.00\n\n**Risk-Reward Analysis:**\n- Risk-Reward Ratio: 0.00\n- Suggested Stop Loss: 241.84\n- Suggested Take Profit: 241.84\n\n**Multi-Timeframe Context:**\n- 1h: SIDEWAYS trend, None signal\n\n**Confidence Score:** 50.0/100\n\n**Conclusion:** Based on the SIDEWAYS trend, the AVERAGE volume on the WIDE candle, a None NEUTRAL signal is generated with a confidence score of 50.0/100.", "confidence_score": 50.0}}
